Domain name,Agency,Maintaining office,Use case,Type of Government,Federal branch,State,Comments,Link
1-800-vermont.com,,,,State,,Vermont,Travel and Tourism Site for Vermont -- Note added 6/6/13 19:19 Domain first added 2013-06-06.. Domain first added 2013-06-06.,http://1-800-vermont.com/
174.132.145.94/~hope,,,,Local,,North Carolina,"Town of Hope Mills, NC -- Note added 12/4/13 19:14 Domain first added 2013-06-06. Domain first added 2013-06-06.",http://townofhopemills.com/
1800arkansas.com,,,,State,,,See historical snapshot at: http://web.archive.org/web/20080120044716/http://www.1800arkansas.com/  -- Note added 1/24/14 14:38 Domain first added 2014-01-24. Domain first added 2014-01-24.,#N/A
1800runaway.org,,,,Quasigovernmental,,,"The National Runaway Safeline serves as the federally designated national communication system for runaway and homeless youth. Services are provided through funding from Family and Youth Services Bureau in the Administration for Children and Families, U.S. Department of Health and Human Services and the generosity of private funders (individual donors, corporate partners, and foundation grants). -- Note added 7/23/14 13:04 Domain first added 2014-01-10. Domain first added 2014-01-10.",http://www.1800runaway.org/
18f.us,,,,Federal,,,"18F, General Services Administration -- Note added 11/10/14 19:10 Domain first added 2014-11-10. Domain first added 2014-11-10.",https://midas.18f.us/
211.getcare.com,,,,State,,Virginia,"2-1-1 VIRGINIA is a service of the Virginia Department of Social Services provided in partnership with the Council of Community Services, the Family Resource and Referral Center, The Planning Council, the United Way of Central Virginia, and the United Way of Greater Richmond and Petersburg. -- Note added 5/27/14 14:14 Domain first added 2014-05-27. Domain first added 2014-05-27.",https://211.getcare.com/211provider/consumer/index211.do
211virginia.org,,,,State,,Virginia,"2-1-1 VIRGINIA is a service of the Virginia Department of Social Services provided in partnership with the Council of Community Services, the Family Resource and Referral Center, The Planning Council, the United Way of Central Virginia, and the United Way of Greater Richmond and Petersburg. -- Note added 1/10/14 19:17 Domain first added 2014-01-10. Domain first added 2014-01-10.",http://211virginia.org
360eldorado.com/Government,,,,Local,,Kansas,"City of El Dorado, KS -- Note added 11/19/13 12:57 Domain first added 2013-11-19. Domain first added 2013-11-19.",http://www.360eldorado.com/Government/CityofElDorado.html
3riverscfc.org,Combined Federal Campaign,,,Federal,,"Ohio, Pennsylvania, West Virginia",3 Rivers/Pennsylvania West Combined Federal Campaign -- Note added 6/6/13 18:08 Domain first added 2013-06-06. Domain first added 2013-06-06.,http://3riverscfc.org/
4thjudicialda.com,,,,State,,Colorado,4th Judicial District Attorney -- Note added 1/10/14 19:17 Domain first added 2014-01-10. Domain first added 2014-01-10.,http://4thjudicialda.com/start.aspx
511ny.org,,,,State,,New York,"511 NY (New York State Department of Transportation), the free, official one-stop, all-encompassing telephone and Web service offering  information on transportation services and conditions throughout New York State.  -- Note added 1/24/14 14:34 Domain first added 2014-01-24. Domain first added 2014-01-24.",http://511ny.org/
911digitalarchive.org,,,,Quasigovernmental,,,The September 11 Digital Archive (funded by a major grant from the Alfred P. Sloan Foundation and organized by the American Social History Project at the City University of New York Graduate Center and the Center for History and New Media at George Mason University) -- Note added 6/6/13 18:08 Domain first added 2013-06-06. Domain first added 2013-06-06.,http://911digitalarchive.org/
a2gov.org,,,,Local,,Michigan,"City of Ann Arbor, MI -- Note added 8/31/16 16:38 Domain first added 2016-08-31. Domain first added 2016-08-31.",http://www.a2gov.org/
aacounty.org,,,,County,,Maryland,"Anne Arundel County, MD -- Note added 4/21/14 14:52 Domain first added 2013-06-06. Domain first added 2013-06-06.",http://www.aacounty.org/
aal.army,Department of the Army,,,Federal,,,"The Army Applications Laboratory was established in 2018, along with the stand-up of the Army Futures Command, to act as a concierge service across the Army’s Future Force Modernization Enterprise and the broader commercial marketplace of ideas. Based on the 8th floor of the Capital Factory in Austin, AAL’s mission is to align innovative solutions and technologies with Army problems, resources and programs to rapidly discover, validate and transition technology applications in support of Army modernization. - From https://armyfuturescommand.com/aal/. aal.army links to Army Futures Command (armyfuturescommand.com) -- 8/26/2019 DPM Domain first added 2019-08-26. Domain first added 2019-08-26.",https://aal.army
aapcc.org,,,,Quasigovernmental,,,American Association of Poison Control Centers -- Note added 1/10/14 19:19 Domain first added 2014-01-10. Domain first added 2014-01-10.,http://www.aapcc.org/
aatwp.org,,,,Local,,Michigan,"Ann Arbor Charter Township, MI -- Note added 9/2/15 19:54 Domain first added 2013-06-06. Domain first added 2013-06-06.",http://aatwp.org/
aberdeen-md.org,,,,Local,,Maryland,"City of Aberdeen, MD -- Note added 3/20/14 17:17 Domain first added 2013-06-06. Domain first added 2013-06-06.",http://www.aberdeen-md.org/
aberdeen.sd.us,,,,Local,,South Dakota,"City of Aberdeen, SD -- Note added 11/18/13 14:17 Domain first added 2013-06-06. Domain first added 2013-06-06.",http://aberdeen.sd.us/
aberdeenms.us,,,,Local,,Mississippi,"City of Aberdeen, MS -- Note added 7/8/14 12:52 Domain first added 2013-06-06. Domain first added 2013-06-06.",http://aberdeenms.us/
aberdeennj.org,,,,Local,,New Jersey,"Township of Aberdeen, NJ -- Note added 6/27/14 13:03 Domain first added 2013-06-06. Domain first added 2013-06-06.",http://www.aberdeennj.org/
aberdeenwa.gov,,,,Local,,Washington,"City of Aberdeen, WA -- Note added 9/12/14 5:24 Domain first added 2013-06-06. Domain first added 2013-06-06.",http://aberdeenwa.gov/
abilenecityhall.com,,,,Local,,Kansas,"City of Abilene, KS -- Note added 6/6/13 18:08 Domain first added 2013-06-06. Domain first added 2013-06-06.",http://abilenecityhall.com/
abilenetx.com,,,,Local,,Texas,"City of Abilene, TX -- Note added 3/3/15 6:31 Domain first added 2013-06-06. Domain first added 2013-06-06.",http://abilenetx.com/
abington.org,,,,Local,,Pennsylvania,"Township of Abington, PA -- Note added 6/27/14 16:12 Domain first added 2013-06-06. Domain first added 2013-06-06.",http://abington.org/
academyadmissions.com,Department of Defense (DOD),,,Federal,,,Air Force Academy Admissions -- Note added 3/24/14 16:11 Domain first added 2014-03-24. Domain first added 2014-03-24.,https://www.academyadmissions.com/
accessduarte.com,,,,Local,,California,"City of Duarte, CA -- Note added 2/27/15 18:10 Domain first added 2013-06-06. Domain first added 2013-06-06.",http://accessduarte.com/
accessesmeralda.com,,,,County,,Nevada,"County of Esmeralda, NV -- Note added 11/18/13 14:25 Domain first added 2013-06-06. Domain first added 2013-06-06.",http://www.accessesmeralda.com/
accessfayetteville.org,,,,Local,,Arkansas,"City of Fayetteville, AR -- Note added 7/17/13 16:00 Domain first added 2013-06-06. Domain first added 2013-06-06.",http://accessfayetteville.org/
accessidaho.org,,,,State,,Idaho,State of Idaho (mirror website of www.idaho.gov) -- Note added 7/17/14 14:28 Domain first added 2013-06-06. Domain first added 2013-06-06.,http://www.accessidaho.org/
accesskent.com,,,,Local,,Michigan,"accesskent, mi -- Note added 9/2/15 19:54 Domain first added 2013-06-06. Domain first added 2013-06-06.",https://www.accesskent.com/
accessportsmouthva.com,,,,Local,,Virginia,"City of Portsmouth, VA Economic Development -- Note added 9/5/2020 18:10 Domain first added 2020-09-05. Domain first added 2020-09-05.",https://www.accessportsmouthva.com/
accidentmd.org,,,,County,,Maryland,"Accident Maryland, located in Garrett County, MD. -- Note added 4/29/14 14:21 Domain first added 2013-06-06. Domain first added 2013-06-06.",http://www.accidentmd.org
aces.edu,,,,State,,Alabama,Alabama Cooperative Extension System -- Note added 6/12/13 16:37 Domain first added 2013-06-06. Domain first added 2013-06-06.,http://www.aces.edu/main/
aces.nmsu.edu/pubs,,,,State,,New Mexico,New Mexico Cooperative Extension Publications -- Note added 7/25/13 17:38 Domain first added 2013-06-06. Domain first added 2013-06-06.,#N/A
acgov.org,,,,County,,California,"Alameda, CA County website -- Note added 2/27/15 18:18 Domain first added 2013-06-06. Domain first added 2013-06-06.",http://acgov.org/
aclink.org,,,,County,,New Jersey,"Atlantic County, NJ  -- Note added 6/27/14 13:13 Domain first added 2013-06-06. Domain first added 2013-06-06.",http://www.aclink.org/
actonmaine.org,,,,Local,,Maine,"acton, maine -- Note added 8/27/15 17:55 Domain first added 2013-06-06. Domain first added 2013-06-06.",http://actonmaine.org/
acworth.org,,,,Local,,Georgia,"Acworth, GA -- Note added 8/25/15 14:03 Domain first added 2013-06-06. Domain first added 2013-06-06.",http://cityofacworth.org/
adamscounty.org,,,,County,,Nebraska,"Adams County, NE -- Note added 12/6/13 18:48 Domain first added 2013-06-06. Domain first added 2013-06-06.",http://adamscounty.org/
adamscounty.us,,,,County,,Pennsylvania,"Adams County, PA -- Note added 7/24/13 18:55 Domain first added 2013-06-06. Domain first added 2013-06-06.",http://www.adamscounty.us/Pages/Home.aspx
adamstwp.org,,,,Local,,Pennsylvania,"Adams Township, PA -- Note added 6/30/14 13:50 Domain first added 2013-06-06. Domain first added 2013-06-06.",http://adamstwp.org/
adaok.com,,,,Local,,Oklahoma,"addock, ok -- Note added 8/28/15 16:26 Domain first added 2013-06-06. Domain first added 2013-06-06.",http://adaok.com/
adaweb.net,,,,County,,Idaho,"Ada County, ID -- Note added 7/14/14 13:54 Domain first added 2013-06-06. Domain first added 2013-06-06.",https://adacounty.id.gov/
addisla.org,,,,Local,,Louisiana,"Town of Addis, LA -- Note added 8/21/15 14:16 Domain first added 2013-06-06. Domain first added 2013-06-06.",http://addisla.org/
addisonadvantage.org,,,,Local,,Illinois,"Village of Addison, IL -- Note added 7/1/14 18:53 Domain first added 2013-06-06. Domain first added 2013-06-06.",http://addisonadvantage.org/
addisonwi.org,,,,Local,,Wisconsin,"Town of Addison, WI -- Note added 7/25/14 5:44 Domain first added 2013-06-06. Domain first added 2013-06-06.",http://addisonwi.org/
adeliowa.org,,,,Local,,Iowa,"City of Adel, IA -- Note added 7/19/13 13:11 Domain first added 2013-06-06. Domain first added 2013-06-06.",http://adeliowa.org/default.page
adellwi.govoffice2.com,,,,Local,,Wisconsin,"Village of Adell, WI -- Note added 1/13/14 19:14 Domain first added 2013-06-06. Domain first added 2013-06-06.",http://www.adellwi.govoffice2.com/
adlnet.org,Department of Defense (DOD),,,Federal,,,"Advanced Distributed Learning, an official website of the U.S. Government sponsored by the Office of the Under Secretary of Defense for Personnel and Readiness (OUSD P&R) -- Note added 11/13/13 14:12 Domain first added 2013-11-13. Domain first added 2013-11-13.",http://adlnet.org/
adoptpakids.org,,,,State,,Pennsylvania,Pennsylvania Adoption Exchange -- Note added 6/30/14 15:39 Domain first added 2013-06-06. Domain first added 2013-06-06.,http://www.adoptpakids.org/
adoptuskids.org,,,,Quasigovernmental,,,AdoptUSKids is a service of the U.S. Children's Bureau (HHS) and has been in operation since 2002 by the Adoption Exchange Association ¬†under a cooperative agreement (grant #90CQ0003). -- Note added 6/14/13 18:04 Domain first added 2013-06-06. Domain first added 2013-06-06.,#N/A
adph.org,,,,State,,Alabama,Alabama Department of Public Health -- Note added 6/12/13 16:40 Domain first added 2013-06-06. Domain first added 2013-06-06.,http://adph.org/
aerhq.org,,,,Quasigovernmental,,,Army Emergency Relief is a private nonprofit organization incorporated in 1942 by the Secretary of War and the Army Chief of Staff. -- Note added 11/18/13 14:29 Domain first added 2013-06-06. Domain first added 2013-06-06.,http://www.aerhq.org/dnn563/
afacademy.af.edu,Department of Defense (DOD),,,Federal,,,United States Air Force Academy email domain. -- Note added 09/01/21 16:57 Domain first added 2021-09-01. Domain first added 2021-09-01.,https://usafa.edu
afb.org,,,,Quasigovernmental,,,American Foundation for the Blind -- Note added 6/14/13 18:08 Domain first added 2013-06-06. Domain first added 2013-06-06.,http://www.afb.org/default.aspx
afcity.org,,,,Local,,Utah,"American Fork City, UT -- Note added 7/19/13 18:40 Domain first added 2013-06-06. Domain first added 2013-06-06.",http://afcity.org/
afcrossroads.com,,,,Quasigovernmental,,,Armed Forces Crossroads -- Note added 6/14/13 18:11 Domain first added 2013-06-06. Domain first added 2013-06-06.,#N/A
afneurope.net,Department of Defense (DOD),,,Federal,,,American Forces Network Europe. AFN American Forces Network &reg; is a registered trademark of the U.S. Department of Defense. -- Note added 5/8/15 14:17 Domain first added 2015-05-08. Domain first added 2015-05-08.,http://www.afneurope.net/
afnpacific.net,Department of Defense (DOD),,,Federal,,,American Forces Network Pacific. AFN American Forces Network &reg; is a registered trademark of the U.S. Department of Defense. -- Note added 5/8/15 14:18 Domain first added 2015-05-08. Domain first added 2015-05-08.,http://afnpacific.net/
afognak.org,,,,Native Sovereign Nation / Tribal,,Alaska,"Native Village of Afognak, Kodiak, AK -- Note added 6/12/13 15:46 Domain first added 2013-06-06. Domain first added 2013-06-06.",http://afognak.org/
afpmb.org,,,,Federal,,,Armed Forces Pest Management Board is a Directorate in the Office of the Deputy Under Secretary of Defense for Installations and Environment (DUSD(I&E)). -- Note added 6/14/13 18:13 Domain first added 2013-06-06. Domain first added 2013-06-06.,#N/A
afreserve.com,,,,Federal,,,US Air Force Reserve recruiting site -- Note added 6/6/13 18:08 Domain first added 2013-06-06. Domain first added 2013-06-06.,https://afreserve.com/
afthunderbirds.com,,,,Federal,,,Air Force Thunderbirds -- Note added 9/12/14 11:40 Domain first added 2014-09-12. Domain first added 2014-09-12.,http://afthunderbirds.com/
aftoniowa.com,,,,Local,,Iowa,"City of Afton, IA -- Note added 7/21/15 12:31 Domain first added 2013-06-06. Domain first added 2013-06-06.",http://www.aftoniowa.com/
ag.umass.edu,,,,State,,Massachusetts,University of Massachusetts Center for Agriculture Research and Extension -- Note added 11/20/13 15:32 Domain first added 2013-06-06. Domain first added 2013-06-06.,http://ag.umass.edu/
ag.unr.edu/gbem,,,,Federal,,,"Great Basin Ecology Laboratory (GBEL), the Nevada Forestry Sciences Laboratory is part of the USDA Forest Service, Rocky Mountain Research Stationand is located on the University of Nevada, Reno. -- Note added 9/15/15 16:57 Domain first added 2013-06-06. Domain first added 2013-06-06.",#N/A
agfirst.com,,,,Federal,,,"AgFirst Farm Credit Bank is part of the national Farm Credit System, the largest agricultural lending organization in the United States -- Note added 7/19/13 13:35 Domain first added 2013-06-06. Domain first added 2013-06-06.",http://agfirst.com/index.asp
agnic.org,,,,Quasigovernmental,,,"Agriculture Network Information Collaborative (AgNIC), a voluntary alliance of institutions working to offer quick and reliable access to quality agricultural information and sources -- Note added 8/20/13 12:17 Domain first added 2013-08-20. Domain first added 2013-08-20.",#N/A
agribank.com,,,,Federal,,,"Under the Farm Credit System's cooperative structure, AgriBank is owned by 17 affiliated Farm Credit Associations. The AgriBank District covers America's Midwest, a fifteen state area from Wyoming to Ohio and Minnesota to Arkansas. -- Note added 6/17/13 15:03 Domain first added 2013-06-06. Domain first added 2013-06-06.",#N/A
agrilifeextension.tamu.edu,,,,State,,Texas,Texas A&M AgriLife Extension -- Note added 3/3/15 6:32 Domain first added 2013-06-06. Domain first added 2013-06-06.,http://agrilifeextension.tamu.edu/
ahfa.com,,,,State,,Alabama,Alabama Housing Finance Authority -- Note added 6/12/13 16:40 Domain first added 2013-06-06. Domain first added 2013-06-06.,http://www.ahfa.com/
ahfc.us,,,,State,,Alaska,Alaska Housing Finance Corporation -- Note added 6/6/13 18:08 Domain first added 2013-06-06. Domain first added 2013-06-06.,http://www.ahfc.us/
ahnj.com,,,,Local,,New Jersey,"Borough of Atlantic Highlands, NJ -- Note added 6/30/14 11:38 Domain first added 2013-06-06. Domain first added 2013-06-06.",http://ahnj.com/ahnj/
aidea.org,,,,State,,Alaska,Alaska Industrial Development and Export Authority -- Note added 6/6/13 18:08 Domain first added 2013-06-06. Domain first added 2013-06-06.,http://www.aidea.org/
airdefenseartillery.com,,,,Federal,,,"Air Defense Artillery, a magazine of the Armed Forces as listed at http://www.defense.gov/pubs/magazines.html.  -- Note added 11/18/13 14:34 Domain first added 2013-06-06. Domain first added 2013-06-06.",http://airdefenseartillery.com/
airforce.com,,,,Federal,,,US Air Force recruiting site -- Note added 6/6/13 18:08 Domain first added 2013-06-06. Domain first added 2013-06-06.,https://www.airforce.com/
airmont.org,,,,Local,,New York,"Village of Airmont, NY -- Note added 9/26/14 18:33 Domain first added 2013-06-06. Domain first added 2013-06-06.",http://www.airmont.org/
airspacemag.com,,,,Federal,,,Smithsonian Air & Space Magazine -- Note added 8/25/14 13:00 Domain first added 2014-08-25. Domain first added 2014-08-25.,http://www.airspacemag.com/?no-ist
ajb.org,,,,Federal,,,"America's Job Bank, a¬†CareerOneStop site sponsored by the U. S. Department of Labor,¬†Employment and Training Administration. -- Note added 6/14/13 18:21 Domain first added 2013-06-06. Domain first added 2013-06-06.",#N/A
ajcity.net,,,,Local,,Arizona,"Apache Junction, AZ -- Note added 11/18/13 14:35 Domain first added 2013-06-06. Domain first added 2013-06-06.",http://www.ajcity.net/
ak-prepared.com,,,,State,,Alaska,Alaska's Department of Military and Veterans Affairs Division of Homeland Security and Emergency Management -- Note added 6/27/14 6:01 Domain first added 2013-06-06. Domain first added 2013-06-06.,http://ak-prepared.com/
akaerospace.com,,,,State,,Alaska,Alaska Aerospace Corporation (Board of directors appointed by Alaska governor) -- Note added 7/23/14 15:36 Domain first added 2013-06-06. Domain first added 2013-06-06.,http://akaerospace.com/index.html
akenergyauthority.org,,,,State,,Alaska,Alaska Energy Authority -- Note added 6/6/13 18:08 Domain first added 2013-06-06. Domain first added 2013-06-06.,http://www.akenergyauthority.org/
akoltco.org,,,,County,,Alaska,Alaska Office of Long Term Care Ombudsman -- Note added 6/27/14 6:06 Domain first added 2013-06-06. Domain first added 2013-06-06.,http://akoltco.org/
akpb.org,,,,State,,Alaska,Alaska Public Broadcasting Commission -- Note added 6/6/13 18:08 Domain first added 2013-06-06. Domain first added 2013-06-06.,http://akpb.org/
akron-pa.com,,,,Local,,Pennsylvania,"Borough of Akron, PA -- Note added 6/30/14 15:42 Domain first added 2013-06-06. Domain first added 2013-06-06.",http://akron-pa.com/
akronia.org,,,,Local,,Iowa,"City of Akron, IA -- Note added 6/6/13 18:09 Domain first added 2013-06-06. Domain first added 2013-06-06.",http://akronia.org/
akrr.com,,,,State,,Alaska,Alaska Railroad Corporation -- Note added 6/6/13 18:08 Domain first added 2013-06-06. Domain first added 2013-06-06.,#N/A
alabama.travel,,,,State,,Alabama,Travel and Tourism Site for Alabama -- Note added 6/6/13 19:22 Domain first added 2013-06-06. Domain first added 2013-06-06.,http://alabama.travel/
alabamacounterdrug.com,,,,State,,Alabama,Alabama National Guard Counterdrug Program -- Note added 1/23/14 13:41 Domain first added 2014-01-23. Domain first added 2014-01-23.,http://www.alabamacounterdrug.com/
alabamafilm.org,,,,State,,Alabama,Alabama Film Office -- Note added 6/12/13 16:42 Domain first added 2013-06-06. Domain first added 2013-06-06.,http://alabamafilm.org/2010/index2.shtml
alachuacounty.us,,,,County,,Florida,"Alachua County, FL -- Note added 6/6/13 18:08 Domain first added 2013-06-06. Domain first added 2013-06-06.",http://alachuacounty.us/Pages/AlachuaCounty.aspx
alalinc.net,,,,State,,Alabama,"Alabama's Legal Information Center, Alabama Supreme Court and State Law Library Catalog -¬†catalog.alalinc.net and 2.alalinc.net -- Note added 6/12/13 16:43 Domain first added 2013-06-07. Domain first added 2013-06-07.",#N/A
alamedahsg.org,,,,Local,,California,"Housing Authority of the City of Alameda, CA -- Note added 6/12/13 18:44 Domain first added 2013-06-06. Domain first added 2013-06-06.",http://alamedahsg.org/
alamotexas.org,,,,Local,,Texas,"City of Alamo, TX -- Note added 3/3/15 6:33 Domain first added 2013-06-06. Domain first added 2013-06-06.",http://www.alamotexas.org/
alamotownship.org,,,,Local,,Michigan,"alamo township, mi -- Note added 9/2/15 19:55 Domain first added 2013-06-06. Domain first added 2013-06-06.",http://www.alamotownship.org/
alaskacfc.org,Combined Federal Campaign,,,Federal,,Alaska,Alaska Combined Federal Campaign -- Note added 6/7/13 12:14 Domain first added 2013-06-06. Domain first added 2013-06-06.,http://www.alaskacfc.org/_root/
alaskarailroad.com,,,,State,,Alaska,Alaska Railroad Corporation -- Note added 7/2/13 17:55 Domain first added 2013-06-06. Domain first added 2013-06-06.,http://www.alaskarailroad.com/
alaskarrt.org,,,,Regional,,Alaska,"Alaska Regional Response Team, an advisory board to the Federal On Scene Coordinator (FOSC). -- Note added 6/27/14 6:10 Domain first added 2013-06-07. Domain first added 2013-06-07.",http://alaskarrt.org/
alaskaseafood.org,,,,State,,Alaska,Alaska Seafood Marketing Institute -- Note added 6/6/13 18:08 Domain first added 2013-06-06. Domain first added 2013-06-06.,http://alaskaseafood.org/
albanyca.org,,,,Local,,California,"Official city of Albany, CA website -- Note added 3/2/15 20:59 Domain first added 2013-06-06. Domain first added 2013-06-06.",http://albanyca.org/
albanycounty.com,,,,County,,New York,"Albany County, NY -- Note added 12/6/13 13:38 Domain first added 2013-06-06. Domain first added 2013-06-06.",http://albanycounty.com/Home.aspx
albanymo.net,,,,Local,,Missouri,"City of Albany, MO -- Note added 9/2/15 14:11 Domain first added 2013-06-06. Domain first added 2013-06-06.",http://www.albanymo.net/
albanynh.org,,,,Local,,New Hampshire,"albany, nh -- Note added 8/28/15 18:34 Domain first added 2013-06-06. Domain first added 2013-06-06.",http://www.albanynh.org/
albanyny.org,,,,Local,,New York,"City of Albany, NY -- Note added 7/24/13 18:57 Domain first added 2013-06-06. Domain first added 2013-06-06.",http://www.albanyny.org/Home.aspx
albanytownship.com,,,,Local,,Minnesota,"Albany Township, MN -- Note added 7/19/13 13:37 Domain first added 2013-06-06. Domain first added 2013-06-06.",http://albanytownship.com/Home.php
albemarle.org,,,,County,,Virginia,"Albemarle County, VA -- Note added 5/27/14 14:17 Domain first added 2013-06-06. Domain first added 2013-06-06.",http://www.albemarle.org/
albionme.com,,,,Local,,Maine,"Town of Albion, ME -- Note added 7/18/14 11:27 Domain first added 2013-06-06. Domain first added 2013-06-06.",http://www.albionme.com/
albme.org,,,,State,,Alabama,Alabama State Board of Medical Examiners (an administrative and regulatory agency of the state of Alabama) and the Medical Licensure Commission of Alabama -- Note added 6/12/13 16:46 Domain first added 2013-06-06. Domain first added 2013-06-06.,http://albme.org/
albop.com,,,,State,,Alabama,Alabama Board of Pharmacy -- Note added 6/12/13 16:47 Domain first added 2013-06-06. Domain first added 2013-06-06.,http://albop.com/
alburtis.org,,,,Local,,Pennsylvania,"Borough of Alburtis, PA -- Note added 6/30/14 15:44 Domain first added 2013-06-06. Domain first added 2013-06-06.",http://alburtis.org/
aleutianseast.org,,,,Local,,Alaska,"Aleutians East Borough, AK -- Note added 6/7/13 12:38 Domain first added 2013-06-06. Domain first added 2013-06-06.",http://www.aleutianseast.org/
alexandercityonline.com,,,,Local,,Alabama,"Alexander City, AL -- Note added 6/12/13 17:14 Domain first added 2013-06-06. Domain first added 2013-06-06.",http://www.alexandercityonline.com/
alexandria-nj.us,,,,Local,,New Jersey,"Alexandria Township, NJ  -- Note added 6/30/14 11:40 Domain first added 2013-06-06. Domain first added 2013-06-06.",http://alexandria-nj.us/
alexandrianh.com,,,,Local,,New Hampshire,"alexandria, nh -- Note added 8/28/15 18:35 Domain first added 2013-06-06. Domain first added 2013-06-06.",http://alexandrianh.com/
alexandriatownship.org,,,,Local,,Minnesota,"Alexandria Township, MN -- Note added 3/11/15 15:17 Domain first added 2013-06-06. Domain first added 2013-06-06.",http://www.alexandriatownship.org/
alfredme.us,,,,Local,,Maine,"alfred, me -- Note added 8/27/15 17:56 Domain first added 2013-06-06. Domain first added 2013-06-06.",http://www.alfredme.us/
alfredny.org,,,,Local,,New York,"Village of Alfred, NY -- Note added 6/8/15 12:04 Domain first added 2013-06-06. Domain first added 2013-06-06.",http://alfredny.org/
algomacity.org,,,,Local,,Wisconsin,"City of Algoma, WI -- Note added 7/25/14 5:05 Domain first added 2013-06-06. Domain first added 2013-06-06.",http://www.algomacity.org/
algonquin.org,,,,Local,,Illinois,"Village of Algonquin, IL -- Note added 7/1/14 18:55 Domain first added 2013-06-06. Domain first added 2013-06-06.",http://algonquin.org/
alhurra.com,,,,Federal,,,"Alhurra Television, Middle East Broadcasting Networks, Inc. (as listed at http://www.bbg.gov/broadcasters/mbn/).  -- Note added 11/18/13 14:45 Domain first added 2013-07-31. Domain first added 2013-07-31.",http://www.alhurra.com/
allamuchynj.org,,,,Local,,New Jersey,"Village of Allamuchy, NJ -- Note added 6/30/14 11:42 Domain first added 2013-07-24. Domain first added 2013-07-24.",http://allamuchynj.org/
allegancounty.org,,,,County,,Michigan,"allegan county, nh -- Note added 9/2/15 19:55 Domain first added 2013-06-06. Domain first added 2013-06-06.",http://cms.allegancounty.org/sitepages/default.aspx#.VedTH_lViko
alleganyco.com,,,,County,,New York,"Allegany County, NY -- Note added 6/7/15 19:57 Domain first added 2013-06-06. Domain first added 2013-06-06.",http://alleganyco.com/
alleghanycounty.us,,,,County,,Virginia,"Alleghany County, VA -- Note added 8/28/13 12:11 Domain first added 2013-06-06. Domain first added 2013-06-06.",http://www.alleghanycounty.us/index.html
alleghenycounty.us,,,,County,,Pennsylvania,"Allegheny County, PA -- Note added 7/24/13 13:26 Domain first added 2013-07-24. Domain first added 2013-07-24.",http://alleghenycounty.us/
alleghenytownship.net,,,,Local,,Pennsylvania,"Allegheny Township, Westmoreland County, PA -- Note added 9/23/15 12:55 Domain first added 2015-09-23. Domain first added 2015-09-23.",http://alleghenytownship.net/
allencounty.org,,,,County,,Kansas,"Allen County, KS -- Note added 6/30/14 6:17 Domain first added 2013-06-06. Domain first added 2013-06-06.",http://allencounty.org/
allencountykentucky.com,,,,County,,Kentucky,"allen county, Ky -- Note added 8/27/15 15:11 Domain first added 2013-06-06. Domain first added 2013-06-06.",http://allencountykentucky.com/
allendalecounty.com,,,,County,,South Carolina,"Allendale County, SC -- Note added 7/23/13 19:51 Domain first added 2013-06-06. Domain first added 2013-06-06.",http://allendalecounty.com/
allenhurstnj.org,,,,Local,,New Jersey,"Borough of Allenhurst, NJ -- Note added 6/30/14 16:14 Domain first added 2013-06-06. Domain first added 2013-06-06.",http://allenhurstnj.org/content/125/default.aspx
allentownship.org,,,,Local,,Pennsylvania,"Allen Township, PA -- Note added 6/30/14 15:47 Domain first added 2013-06-06. Domain first added 2013-06-06.",http://allentownship.org/
almacity.com,,,,Local,,Nebraska,"City of Alma, NE -- Note added 12/6/13 18:48 Domain first added 2013-06-06. Domain first added 2013-06-06.",http://www.almacity.com/
almawisconsin.com,,,,Local,,Wisconsin,"City of Alma, WI -- Note added 7/25/14 5:06 Domain first added 2013-06-06. Domain first added 2013-06-06.",http://almawisconsin.com/
alpenacounty.org,,,,County,,Michigan,"alpena county, mi -- Note added 9/2/15 19:55 Domain first added 2013-06-06. Domain first added 2013-06-06.",http://alpenacounty.org/
alphaboro.org,,,,County,,New Jersey,"Borough of Alpha, NJ (Warren County) -- Note added 6/30/14 11:46 Domain first added 2013-06-06. Domain first added 2013-06-06.",http://alphaboro.org/
alpharetta.ga.us,,,,Local,,Georgia,"Alpharetta, GA -- Note added 8/25/15 14:03 Domain first added 2013-06-06. Domain first added 2013-06-06.",http://www.alpharetta.ga.us/
alpinecity.org,,,,Local,,Utah,"City of Alpine, UT -- Note added 8/19/14 4:58 Domain first added 2013-06-06. Domain first added 2013-06-06.",http://www.alpinecity.org/
alpinenj07620.org,,,,County,,New Jersey,"Borough of Alpine, NJ (Bergen County) -- Note added 6/30/14 11:48 Domain first added 2013-06-06. Domain first added 2013-06-06.",http://alpinenj07620.org/index.html
alpinetwp.org,,,,Local,,Michigan,"alpine township, mi -- Note added 9/2/15 19:56 Domain first added 2013-06-06. Domain first added 2013-06-06.",http://alpinetwp.org/
alsde.edu,,,,State,,Alabama,Alabama State Department of Education -- Note added 6/12/13 17:15 Domain first added 2013-06-06. Domain first added 2013-06-06.,http://www.alsde.edu/Pages/home.aspx
alsteadnh.org,,,,Local,,New Hampshire,"alstead, nh -- Note added 8/28/15 18:35 Domain first added 2013-06-06. Domain first added 2013-06-06.",http://www.alsteadnh.org/
altamonte.org,,,,Local,,Florida,"City of Altamonte Springs, FL -- Note added 2/25/15 15:22 Domain first added 2013-06-06. Domain first added 2013-06-06.",http://altamonte.org/
altamontil.net,,,,Local,,Illinois,"City of Altamont, IL -- Note added 7/1/14 18:55 Domain first added 2013-06-06. Domain first added 2013-06-06.",http://altamontil.net/
altamontvillage.org,,,,Local,,New York,"Village of Altamont, NY -- Note added 6/8/15 12:05 Domain first added 2013-06-06. Domain first added 2013-06-06.",http://altamontvillage.org/Pages/index
alton-il.com,,,,Local,,Illinois,"City of Alton, IL -- Note added 7/1/14 19:14 Domain first added 2013-06-06. Domain first added 2013-06-06.",http://www.alton-il.com/
altoona-iowa.com,,,,Local,,Iowa,"Altoona, Ia -- Note added 8/25/15 19:56 Domain first added 2013-06-06. Domain first added 2013-06-06.",http://www.altoona-iowa.com/
alvaok.org,,,,Local,,Oklahoma,"alva, ok -- Note added 8/28/15 16:27 Domain first added 2013-06-06. Domain first added 2013-06-06.",http://alvaok.org/
amador-city.com/government,,,,Local,,California,Amador City website -- Note added 3/10/15 16:31 Domain first added 2013-06-06. Domain first added 2013-06-06.,http://www.amador-city.com/amador-city-government.html
amadorcity.net,,,,Local,,California,"Amador City, CA -- Note added 3/3/15 13:11 Domain first added 2015-03-03. Domain first added 2015-03-03.",http://www.amador-city.com/
ambridgeboro.org,,,,Local,,Pennsylvania,"Borough of Ambridge, PA -- Note added 6/30/14 15:48 Domain first added 2013-06-06. Domain first added 2013-06-06.",http://www.ambridgeboro.org/
ameliacova.com,,,,County,,Virginia,"Amelia County, VA -- Note added 5/27/14 20:31 Domain first added 2013-06-06. Domain first added 2013-06-06.",http://www.ameliacova.com/
americanpresidents.org,,,,Federal,,,American Presidents: Life Portraits (C-SPAN) -- Note added 6/14/13 18:23 Domain first added 2013-06-06. Domain first added 2013-06-06.,#N/A
americansamoa.travel,,,,State,,American Samoa,Travel and Tourism Site for American Samoa -- Note added 6/6/13 19:22 Domain first added 2013-06-06. Domain first added 2013-06-06.,http://www.americansamoa.travel/
americorpsconnect.org,,,,Federal,,,"AmeriCorps Connect, Corporation for National and Community Service -- Note added 6/6/13 18:08 Domain first added 2013-06-06. Domain first added 2013-06-06.",#N/A
amerywisconsin.org,,,,Local,,Wisconsin,"City of Amery, WI -- Note added 11/20/13 16:12 Domain first added 2013-06-06. Domain first added 2013-06-06.",http://amerywisconsin.org/
amherst.ny.us,,,,Local,,New York,"Town of Amherst, NY -- Note added 5/27/15 18:42 Domain first added 2013-06-06. Domain first added 2013-06-06.",http://www.amherst.ny.us/
amityville.com,,,,Local,,New York,"Village of Amityville, Long Island, NY -- Note added 6/8/15 12:05 Domain first added 2013-06-06. Domain first added 2013-06-06.",http://amityville.com/
amtrak.com,,,,Federal,,,"Amtrak, the National Railroad Passenger Corporation -- Note added 11/18/13 14:58 Domain first added 2013-06-06. Domain first added 2013-06-06.",http://www.amtrak.com/home
amtrakcascades.com,,,,State,,Washington,"Amtrak Cascades, a train service sponsored by the state departments of transportation of Washington and Oregon. -- Note added 6/17/14 14:40 Domain first added 2013-07-30. Domain first added 2013-07-30.",http://amtrakcascades.com/
amver.com,,,,Federal,,,"Automated Mutual Assistance Vessel Rescue (AMVER) System, sponsored by the United States Coast Guard, is a computer-based voluntary global ship reporting system used worldwide by search and rescue authorities to arrange for assistance to persons in distress at sea. -- Note added 1/23/15 15:04 Domain first added 2015-01-23. Domain first added 2015-01-23.",http://www.amver.com/
anaheim.net,,,,Local,,California,City of Anaheim website -- Note added 3/3/15 19:03 Domain first added 2013-06-06. Domain first added 2013-06-06.,http://anaheim.net/
anc1c.org,,,,Local,,District of Columbia,DC Advisory Neighborhood Commission 1C -- Note added 6/7/13 17:33 Domain first added 2013-06-06. Domain first added 2013-06-06.,#N/A
anc2e.com,,,,Local,,District of Columbia,DC Advisory Neighborhood Commission 2E -- Note added 6/7/13 17:34 Domain first added 2013-06-06. Domain first added 2013-06-06.,#N/A
anc2f.org,,,,Local,,District of Columbia,DC Advisory Neighborhood Commission 2F -- Note added 6/7/13 17:34 Domain first added 2013-06-06. Domain first added 2013-06-06.,#N/A
anc3e.org,,,,Local,,District of Columbia,DC Advisory Neighborhood Commission 3E -- Note added 6/7/13 17:35 Domain first added 2013-06-06. Domain first added 2013-06-06.,#N/A
anderson.govoffice.com,,,,Local,,Alaska,"City of Anderson, AK -- Note added 6/7/13 12:39 Domain first added 2013-06-06. Domain first added 2013-06-06.",http://www.anderson.govoffice.com/
andersoncountysc.org,,,,County,,South Carolina,"anderson county, sc -- Note added 8/28/15 13:17 Domain first added 2013-06-06. Domain first added 2013-06-06.",http://www.andersoncountysc.org/
andersontownship.org,,,,Local,,Ohio,"Anderson Township, OH -- Note added 3/10/14 15:11 Domain first added 2013-06-06. Domain first added 2013-06-06.",http://www.andersontownship.org/
andover.nh.us,,,,Local,,New Hampshire,"Town of Andover, NH -- Note added 7/23/13 19:47 Domain first added 2013-06-06. Domain first added 2013-06-06.",http://andover.nh.us/
andoverct.org,,,,Local,,Connecticut,"Town of Andover, CT -- Note added 12/15/14 6:13 Domain first added 2013-06-06. Domain first added 2013-06-06.",http://andoverct.org/
andoverks.com,,,,Local,,Kansas,"City of Andover, KS -- Note added 6/6/13 18:08 Domain first added 2013-06-06. Domain first added 2013-06-06.",http://andoverks.com/
andovertwp.org,,,,Local,,New Jersey,"Andover Township, NJ (Incorporated 1864; Sussex County) -- Note added 6/30/14 16:15 Domain first added 2013-06-06. Domain first added 2013-06-06.",http://andovertwp.org/
angelinacounty.net,,,,County,,Texas,"Angelina County, TX -- Note added 3/3/15 6:33 Domain first added 2013-06-06. Domain first added 2013-06-06.",http://www.angelinacounty.net/
angier.org,,,,Local,,North Carolina,"angier, nc -- Note added 9/11/15 17:12 Domain first added 2013-06-06. Domain first added 2013-06-06.",http://angier.org/
angleton.tx.us,,,,Local,,Texas,"Angleton, TX -- Note added 3/3/15 6:35 Domain first added 2013-06-06. Domain first added 2013-06-06.",http://angleton.tx.us/
angolain.org,,,,Local,,Indiana,"Angola, In -- Note added 8/27/15 14:12 Domain first added 2013-06-06. Domain first added 2013-06-06.",http://angolain.org/
annetta.org,,,,Local,,Texas,"Town of Anetta, TX -- Note added 3/3/15 6:35 Domain first added 2013-06-06. Domain first added 2013-06-06.",http://annetta.org/
annualcreditreport.com,,,,Federal,,,AnnualCreditReport.com is the official site to help consumers to obtain their free credit report. -- Note added 6/6/13 18:08 Domain first added 2013-06-06. Domain first added 2013-06-06.,https://www.annualcreditreport.com/index.action
anokacounty.us,,,,County,,Minnesota,"Anoka County, MN -- Note added 4/19/15 23:57 Domain first added 2013-06-06. Domain first added 2013-06-06.",http://www.anokacounty.us/
anra.org,,,,Local,,Texas,"Angelina & Neches River Authority, TX -- Note added 3/3/15 6:36 Domain first added 2013-06-06. Domain first added 2013-06-06.",http://www.anra.org/
antigo-city.org,,,,Local,,Wisconsin,"City of Antigo, WI -- Note added 4/1/14 13:08 Domain first added 2013-06-06. Domain first added 2013-06-06.",http://www.antigo-city.org/
antrimcounty.org,,,,County,,Michigan,"antrim county, mi -- Note added 9/2/15 19:56 Domain first added 2013-06-06. Domain first added 2013-06-06.",http://www.antrimcounty.org/
antrimnh.org,,,,Local,,New Hampshire,"antrim, nh -- Note added 8/28/15 18:35 Domain first added 2013-06-06. Domain first added 2013-06-06.",http://antrimnh.org/Pages/index
apdcares.org,,,,State,,Florida,Agency for Persons with Disabilities (APD) -- Note added 2/25/15 15:33 Domain first added 2013-06-06. Domain first added 2013-06-06.,http://apdcares.org/
apexnc.org,,,,Local,,North Carolina,"apex, nc -- Note added 9/11/15 17:10 Domain first added 2013-06-06. Domain first added 2013-06-06.",http://apexnc.org/
apfc.org,,,,State,,Alaska,Alaska Permanent Fund Corporation -- Note added 6/6/13 18:08 Domain first added 2013-06-06. Domain first added 2013-06-06.,http://apfc.org/home/Content/home/index.cfm
aplingtonia.com,,,,Local,,Iowa,"Applington, IA -- Note added 8/25/15 19:56 Domain first added 2013-06-06. Domain first added 2013-06-06.",http://aplingtonia.com/
apollopa.org,,,,Local,,Pennsylvania,"Borough of Apollo, PA -- Note added 6/30/14 20:40 Domain first added 2013-06-06. Domain first added 2013-06-06.",http://apollopa.org
apopka.net,,,,Local,,Florida,City of Apoka -- Note added 6/15/15 19:34 Domain first added 2013-06-06. Domain first added 2013-06-06.,http://apopka.net/
appleton.org,,,,Local,,Wisconsin,"City of Appleton, WI -- Note added 7/25/14 5:07 Domain first added 2013-06-06. Domain first added 2013-06-06.",http://appleton.org/
applevalley.org,,,,Local,,California,City of Apple Valley website -- Note added 3/10/15 16:38 Domain first added 2013-06-06. Domain first added 2013-06-06.,http://applevalley.org/Index.aspx?page=1
apscservices.info,,,,State,,Arkansas,Arkansas Public Service Commission -- Note added 1/10/14 17:55 Domain first added 2014-01-10. Domain first added 2014-01-10.,http://www.apscservices.info/
arabcity.org,,,,Local,,Alabama,"City of Arab, AL -- Note added 6/12/13 17:15 Domain first added 2013-06-06. Domain first added 2013-06-06.",http://arabcity.org/
arbenefits.org,,,,State,,Arkansas,ARBenefitsfor Arkansas State and Public School Plan MembersProvided by the Employee Benefit Division of the [Arkansas] Department of Finance & Administration -- Note added 12/10/14 6:24 Domain first added 2014-03-20. Domain first added 2014-03-20.,http://portal.arbenefits.org/Pages/default.aspx
arcadialakes.net,,,,Local,,South Carolina,"arcadia lakes, sc -- Note added 8/28/15 13:17 Domain first added 2013-06-06. Domain first added 2013-06-06.",http://www.arcadialakes.net/
arcadialouisiana.org,,,,Local,,Louisiana,"Town of Arcadia, La. -- Note added 8/21/15 14:19 Domain first added 2013-06-06. Domain first added 2013-06-06.",http://arcadialouisiana.org/arcadialouisiana/Arcadia_Louisiana.html
archbold.com,,,,Local,,Ohio,"Village of Archbold, OH -- Note added 11/20/13 16:13 Domain first added 2013-06-06. Domain first added 2013-06-06.",http://www.archbold.com/
archuletacounty.org,,,,County,,Colorado,"Archuleta County, CO -- Note added 6/6/13 18:08 Domain first added 2013-06-06. Domain first added 2013-06-06.",http://archuletacounty.org/
ardc.org,,,,Regional,,Minnesota,"Arrowhead Regional Development Commission, MN -- Note added 3/11/15 15:19 Domain first added 2013-06-06. Domain first added 2013-06-06.",http://www.ardc.org/
ardsleyvillage.com,,,,Local,,New York,"Village of Ardsley, NY -- Note added 6/8/15 12:06 Domain first added 2013-06-06. Domain first added 2013-06-06.",http://www.ardsleyvillage.com/
arfireprotection.org,,,,State,,Arkansas,Arkansas Fire Protection Licensing Board -- Note added 6/12/13 18:10 Domain first added 2013-06-06. Domain first added 2013-06-06.,http://www.arfireprotection.org/
arguard.org,,,,State,,Arkansas,Arkansas National Guard -- Note added 1/23/14 13:42 Domain first added 2014-01-23. Domain first added 2014-01-23.,http://www.arguard.org/
argyleny.com,,,,Local,,New York,"Town of Argyle, NY -- Note added 6/8/15 12:07 Domain first added 2013-06-06. Domain first added 2013-06-06.",http://argyleny.com/
argyletx.com,,,,Local,,Texas,"Town of Argyle, TX -- Note added 7/25/13 14:58 Domain first added 2013-06-06. Domain first added 2013-06-06.",http://www.argyletx.com/town/Town-of-Argyle.html
argylewi.org,,,,Local,,Wisconsin,"Village of Argyle, WI -- Note added 7/25/14 5:10 Domain first added 2013-06-06. Domain first added 2013-06-06.",http://argylewi.org/
arizonaguide.com,,,,State,,Arizona,Travel and Tourism Site for Arizona -- Note added 6/6/13 19:16 Domain first added 2013-06-06. Domain first added 2013-06-06.,http://arizonaguide.com/
arizonalottery.com,,,,State,,Arizona,Arizona lottery -- Note added 11/18/13 15:03 Domain first added 2013-06-06. Domain first added 2013-06-06.,http://www.arizonalottery.com
arizonaworkforceconnection.com,,,,State,,Arizona,"Arizona's Workforce Connection!, a website of the Governor's Council on Workforce Policy developed to provide easy access to the workforce development system in Arizona. -- Note added 11/18/13 15:13 Domain first added 2013-06-06. Domain first added 2013-06-06.",http://www.arizonaworkforceconnection.com/
ark-ives.com,,,,State,,Arkansas,"Arkansas History Commission, a division of the Arkansas Department of Parks and Tourism -- Note added 12/10/14 6:32 Domain first added 2013-06-06. Domain first added 2013-06-06.",http://www.ark-ives.com/
arkansas.com,,,,State,,Arkansas,Travel and Tourism Site for Arkansas -- Note added 6/6/13 19:23 Domain first added 2013-06-06. Domain first added 2013-06-06.,http://www.arkansas.com/
arkansasctf.org,,,,State,,Arkansas,Arkansas Children's Trust Fund -- Note added 7/17/13 16:07 Domain first added 2013-06-06. Domain first added 2013-06-06.,http://www.arkansasctf.org/
arkansased.org,,,,State,,Arkansas,Arkansas Department of Education -- Note added 12/10/14 6:56 Domain first added 2013-06-06. Domain first added 2013-06-06.,http://www.arkansased.org/
arkansasedc.com,,,,State,,Arkansas,Arkansas Economic Development Coorporation (AEDC) -- Note added 1/24/14 14:36 Domain first added 2014-01-24. Domain first added 2014-01-24.,http://arkansasedc.com/
arkansasethics.com,,,,State,,Arkansas,Arkansas Ethics Commission -- Note added 7/17/13 16:13 Domain first added 2013-06-06. Domain first added 2013-06-06.,http://arkansasethics.com/
arkcity.org,,,,Local,,Kansas,"City of Arkansas City, KS -- Note added 6/6/13 18:08 Domain first added 2013-06-06. Domain first added 2013-06-06.",http://arkcity.org/portal/portal.aspx
arkidsfirst.com,,,,State,,Arkansas,"ARKids First health insurance, Arkansas Department of Human Services -- Note added 1/10/14 19:17 Domain first added 2014-01-10. Domain first added 2014-01-10.",http://arkidsfirst.com/home.htm
arkport.com,,,,Local,,New York,"Arkport, NY -- Note added 6/7/15 20:17 Domain first added 2013-06-06. Domain first added 2013-06-06.",http://arkport.com/
arlingtonva.us,,,,Local,,Virginia,"City of Arlington, Virginia -- Note added 8/30/13 13:07 Domain first added 2013-06-06. Domain first added 2013-06-06.",http://www.arlingtonva.us/
arlpc.org,,,,State,,Arkansas,Arkansas Livestock and Poultry Commission -- Note added 7/17/13 16:14 Domain first added 2013-06-06. Domain first added 2013-06-06.,http://www.arlpc.org/index.asp
armedforcessports.com,,,,Federal,,,"Armed Forces Sports, Department of Defense -- Note added 12/5/14 20:10 Domain first added 2014-12-05. Domain first added 2014-12-05.",http://www.armedforcessports.com/
armedicalboard.org,,,,State,,Arkansas,Arkansas State Medical Board -- Note added 7/17/13 17:16 Domain first added 2013-06-06. Domain first added 2013-06-06.,http://armedicalboard.org/
armstrongcounty.com,,,,County,,Pennsylvania,Armstrong County Tourist Bureau -- Note added 6/30/14 20:44 Domain first added 2013-06-06. Domain first added 2013-06-06.,http://armstrongcounty.com
armstrongtwp.org,,,,Local,,Pennsylvania,"Armstrong Township, Indiana County, PA -- Note added 9/23/15 12:57 Domain first added 2013-06-06. Domain first added 2013-06-06.",http://armstrongtwp.org/
armyfuturescommand.com,Department of the Army,,,Federal,,,Responsible for leading a team of Soldiers and civilians to streamline the Army’s modernization enterprise under a single command. The command enhances efficiency and effectiveness in delivering the technology necessary to maintain the Army’s competitive advantage and win wars. - From https://armyfuturescommand.com/leadership/. See also https://www.army.mil/futures. Domain first added 2019-08-26. Domain first added 2019-08-26.,https://armyfuturescommand.com/
arnoldmo.org,,,,Local,,Missouri,"City of Arnold, MO -- Note added 9/2/15 14:14 Domain first added 2013-06-06. Domain first added 2013-06-06.",http://www.arnoldmo.org/
arnoldsparkcity.com,,,,Local,,Iowa,"Arnolds Park, IA -- Note added 8/25/15 19:57 Domain first added 2013-06-06. Domain first added 2013-06-06.",http://arnoldsparkcity.com/
aroostook.me.us,,,,County,,Maine,"Aroostook County, ME -- Note added 6/12/13 19:13 Domain first added 2013-06-06. Domain first added 2013-06-06.",http://aroostook.me.us/
aroptometry.org,,,,State,,Arkansas,Arkansas State Board of Optometry -- Note added 11/18/13 15:44 Domain first added 2013-06-06. Domain first added 2013-06-06.,http://www.aroptometry.org/
arptb.org,,,,State,,Arkansas,Arkansas State Board of Physical Therapy -- Note added 11/18/13 15:45 Domain first added 2013-06-06. Domain first added 2013-06-06.,http://www.arptb.org/
arrowsic.org,,,,Local,,Maine,"arrowsic, me -- Note added 8/27/15 17:56 Domain first added 2013-06-06. Domain first added 2013-06-06.",http://arrowsic.org/
arroyogrande.org,,,,Local,,California,City of Arroyo Grande website -- Note added 3/10/15 16:50 Domain first added 2013-06-06. Domain first added 2013-06-06.,http://www.arroyogrande.org/
artesiansd.com,,,,Local,,South Dakota,"Town of Artesian, SD -- Note added 2/26/14 19:08 Domain first added 2013-06-06. Domain first added 2013-06-06.",http://artesiansd.com/
arundelmaine.org,,,,Local,,Maine,"Town of Arundel, ME -- Note added 11/20/13 16:21 Domain first added 2013-06-06. Domain first added 2013-06-06.",http://www.arundelmaine.org/
arvin.org,,,,Local,,California,City of Arvin website -- Note added 3/10/15 16:52 Domain first added 2013-06-06. Domain first added 2013-06-06.,http://www.arvin.org/
asbca.org,,,,State,,Arkansas,Arkansas State Board of Collection Agencies -- Note added 11/18/13 15:45 Domain first added 2013-06-06. Domain first added 2013-06-06.,http://www.asbca.org/
ascensionparish.net,,,,County,,Louisiana,"Ascension Parish, Louisiana -- Note added 8/21/15 17:38 Domain first added 2013-06-06. Domain first added 2013-06-06.",http://ascensionparish.net/
asdd.com,,,,State,,Alabama,"Alabama State Port Authority, Mobile, AL -- Note added 6/12/13 17:16 Domain first added 2013-06-06. Domain first added 2013-06-06.",http://asdd.com/
asgteo.com,,,,State,,American Samoa,American Samoa Territorial Energy Office -- Note added 6/7/13 14:55 Domain first added 2013-06-07. Domain first added 2013-06-07.,http://asgteo.com/
asharoken.com,,,,Local,,New York,"Village of Asharoken, NY -- Note added 6/8/15 12:07 Domain first added 2013-06-06. Domain first added 2013-06-06.",http://asharoken.com/
ashecountygov.com,,,,County,,North Carolina,"ashe county, nc -- Note added 9/11/15 17:11 Domain first added 2013-06-06. Domain first added 2013-06-06.",http://www.ashecountygov.com/
ashfordtownhall.org,,,,Local,,Connecticut,"Town of Ashford, CT -- Note added 12/15/14 6:14 Domain first added 2013-06-06. Domain first added 2013-06-06.",http://ashfordtownhall.org/
ashgrovemo.org,,,,Local,,Missouri,"City of Ash Grove, MO -- Note added 9/2/15 14:21 Domain first added 2013-06-06. Domain first added 2013-06-06.",http://www.ashgrovemo.gov/
ashiwi.org,,,,Native Sovereign Nation / Tribal,,New Mexico,"Pueblo of Zuni, Zuni, NM -- Note added 6/12/13 15:49 Domain first added 2013-06-06. Domain first added 2013-06-06.",http://ashiwi.org/
ashland-ohio.com,,,,Local,,Ohio,"City of Ashland, OH -- Note added 3/10/14 15:25 Domain first added 2013-06-06. Domain first added 2013-06-06.",http://www.ashland-ohio.com
ashland.ms,,,,Local,,Mississippi,"Town of Ashland, MS -- Note added 7/8/14 13:04 Domain first added 2013-06-06. Domain first added 2013-06-06.",http://ashland.ms/
ashland.or.us,,,,Local,,Oregon,"City of Ashland, OR -- Note added 6/12/14 12:36 Domain first added 2013-06-06. Domain first added 2013-06-06.",http://ashland.or.us/
ashlandcounty.org,,,,County,,Ohio,"Ashland County, OH -- Note added 3/10/14 15:29 Domain first added 2013-06-06. Domain first added 2013-06-06.",http://www.ashlandcounty.org
ashlandmass.com,,,,Local,,Massachusetts,"Ashland, Ma -- Note added 8/26/15 15:35 Domain first added 2013-06-06. Domain first added 2013-06-06.",http://www.ashlandmass.com/
ashlandmo.us,,,,Local,,Missouri,"City of Ash Land, MO -- Note added 9/2/15 14:32 Domain first added 2013-06-06. Domain first added 2013-06-06.",http://ashlandmo.us/
ashley-nd.com,,,,Local,,North Dakota,"City of Ashley, ND -- Note added 7/18/13 12:51 Domain first added 2013-06-06. Domain first added 2013-06-06.",http://ashley-nd.com/
ashtownship.org,,,,Local,,Michigan,"ash township, mi -- Note added 9/2/15 19:57 Domain first added 2013-06-06. Domain first added 2013-06-06.",http://ashtownship.org/
ashwaubenon.com,,,,Local,,Wisconsin,"Village of Ashwaubenon, WI -- Note added 4/1/14 14:06 Domain first added 2013-06-06. Domain first added 2013-06-06.",http://www.ashwaubenon.com/
askjan.org,,,,Federal,,,"Job Accommodation Network, a service of U.S. Department of Labor's Office of Disability Employment Policy. -- Note added 9/24/13 12:49 Domain first added 2013-09-24. Domain first added 2013-09-24.",http://askjan.org/
askpsc.com,,,,State,,New York,New York State Public Service Commission‚Äôs Consumer Web Site -- Note added 1/10/14 19:17 Domain first added 2014-01-10. Domain first added 2014-01-10.,http://www.askpsc.com/
asmdc.org,,,,State,,California,"California State Assembly Democratic Caucus, State of California -- Note added 6/6/13 18:08 Domain first added 2013-06-06. Domain first added 2013-06-06.",#N/A
aspenpitkin.com,,,,County,,Colorado,"Aspen and Pitkin Counties, CO -- Note added 7/11/14 5:17 Domain first added 2013-06-06. Domain first added 2013-06-06.",http://aspenpitkin.com/
aspinwallpa.com,,,,Local,,Pennsylvania,"Aspinwall Borough, PA -- Note added 12/6/13 14:09 Domain first added 2013-06-06. Domain first added 2013-06-06.",http://www.aspinwallpa.com/default.aspx
assumptionla.com,,,,County,,Louisiana,"Assumption Parish, La -- Note added 8/24/15 13:55 Domain first added 2013-06-06. Domain first added 2013-06-06.",http://assumptionla.com/
asthmacommunitynetwork.org,,,,Quasigovernmental,,," Asthma Community Network            Join today and become a partner in building and maintaining AsthmaCommunityNetwork.org. This online Network is designed for community-based asthma programs and organizations that sponsor them&mdash;including representatives of health plans and providers, government health and environmental agencies, nonprofits, coalitions, schools and more. The Network is supported by the http://www.epa.gov/ U.S. Environmental Protection Agency in partnership with http://asthma.umich.edu/ Allies Against Asthma, a program of the Robert Wood Johnson Foundation and the http://www.asthmacommunitynetwork.org/mcanpartners Merck Childhood Asthma Network, Inc. (MCAN), a nonprofit organization funded by the Merck Company Foundation. From http://www.asthmacommunitynetwork.org/about/whoweare ; Retrieved December 23, 2016         -- Note added 12/23/16 21:37 Domain first added 2016-12-23. Domain first added 2016-12-23.",http://www.asthmacommunitynetwork.org/
astontownship.net,,,,Local,,Pennsylvania,"Aston Township, PA -- Note added 6/30/14 20:47 Domain first added 2013-06-06. Domain first added 2013-06-06.",http://astontownship.net/
astoria.or.us,,,,Local,,Oregon,"City of Astoria, OR -- Note added 6/12/14 12:37 Domain first added 2013-06-06. Domain first added 2013-06-06.",http://astoria.or.us/
atascadero.org,,,,Local,,California,City of Atascadero website -- Note added 3/10/15 16:58 Domain first added 2013-06-06. Domain first added 2013-06-06.,http://atascadero.org/
atchisoncountyks.org,,,,County,,Kansas,"Atchison County, KS -- Note added 6/6/13 18:08 Domain first added 2013-06-06. Domain first added 2013-06-06.",http://atchisoncountyks.org/
atglen.org,,,,Local,,Pennsylvania,"Borough of Atglen, PA -- Note added 6/30/14 20:50 Domain first added 2013-06-06. Domain first added 2013-06-06.",http://atglen.org/
athensal.us,,,,Local,,Alabama,"City of Athens, AL -- Note added 6/12/13 17:17 Domain first added 2013-06-06. Domain first added 2013-06-06.",http://athensal.us/
athensclarkecounty.com,,,,County,,Georgia,Athens-Clarke County Unified Government -- Note added 6/6/13 18:08 Domain first added 2013-06-06. Domain first added 2013-06-06.,http://athensclarkecounty.com/
athenscountygovernment.com,,,,County,,Ohio,"Athens County, OH -- Note added 11/20/13 16:17 Domain first added 2013-06-06. Domain first added 2013-06-06.",#N/A
athensoh.org,,,,County,,Ohio,"Athens County, OH -- Note added 11/20/13 16:18 Domain first added 2013-11-20. Domain first added 2013-11-20.",http://www.co.athensoh.org/
athenstownship.com,,,,Local,,Minnesota,"Athens Township, MN -- Note added 3/20/14 17:18 Domain first added 2013-06-06. Domain first added 2013-06-06.",http://athenstownship.com/
athenswis.com,,,,Local,,Wisconsin,"Village of Athens, WI -- Note added 7/25/14 5:09 Domain first added 2013-06-06. Domain first added 2013-06-06.",http://www.athenswis.com/
atlanticbeach-nc.com,,,,Local,,North Carolina,"atlantic beach, nc -- Note added 9/11/15 17:13 Domain first added 2013-06-06. Domain first added 2013-06-06.",http://atlanticbeach-nc.com/
atlanticcoastcfc.org,Combined Federal Campaign,,,Federal,,Florida,Atlantic Coast Combined Federal Campaign -- Note added 6/15/15 19:37 Domain first added 2013-06-06. Domain first added 2013-06-06.,http://www.atlanticcoastcfc.org/
atlastownship.org,,,,Local,,Michigan,"atlas township, mi -- Note added 9/2/15 19:57 Domain first added 2013-06-06. Domain first added 2013-06-06.",http://atlastownship.org/
atlfa.org,,,,State,,Virginia,Assistive Technology Loan Fund Authority. The authority offers low interest loans for a variety of special equipment to eligible applicants. See the establishing law at http://law.lis.virginia.gov/authorities/assistive-technology-loan-fund-authority-atlfa  -- Note added 7/23/14 15:46 Domain first added 2013-06-06. Domain first added 2013-06-06.,http://atlfa.org/
attica.org,,,,Local,,New York,"Village of Attica, NY -- Note added 5/27/15 18:46 Domain first added 2013-06-06. Domain first added 2013-06-06.",http://www.attica.org/
atwater.org,,,,Local,,California,City of Atwater website -- Note added 3/10/15 17:00 Domain first added 2013-06-06. Domain first added 2013-06-06.,http://atwater.org/
auburnalabama.org,,,,Local,,Alabama,"City of Auburn, AL -- Note added 6/12/13 17:20 Domain first added 2013-06-06. Domain first added 2013-06-06.",http://auburnalabama.org/
auburnhills.org,,,,Local,,Michigan,"auburn hills, mi -- Note added 9/2/15 19:57 Domain first added 2013-06-06. Domain first added 2013-06-06.",http://auburnhills.org/
auburnnh.us,,,,Local,,New Hampshire,"auburn, nh -- Note added 8/28/15 18:36 Domain first added 2013-06-06. Domain first added 2013-06-06.",http://www.auburnnh.us/
auburnrancheria.com,,,,Native Sovereign Nation / Tribal,,,United Auburn Indian Community website -- Note added 3/9/15 19:43 Domain first added 2013-06-06. Domain first added 2013-06-06.,http://www.auburnrancheria.com
audubonparknj.org,,,,County,,New Jersey,"Audubon Park Borough, NJ (Camden County) -- Note added 6/30/14 11:54 Domain first added 2013-06-06. Domain first added 2013-06-06.",http://audubonparknj.org/index.html
auglaizecounty.org,,,,County,,Ohio,"Auglaize County, OH -- Note added 3/10/14 16:09 Domain first added 2013-06-06. Domain first added 2013-06-06.",http://www2.auglaizecounty.org/
aumsville.us,,,,Local,,Oregon,"City of Aumsville, OR -- Note added 6/20/14 9:31 Domain first added 2013-06-06. Domain first added 2013-06-06.",http://aumsville.us/
aurora-cityhall.org,,,,Local,,Missouri,"City of Aurora, MO -- Note added 9/2/15 14:41 Domain first added 2013-06-06. Domain first added 2013-06-06.",http://aurora-cityhall.org/
aurora-il.org,,,,Local,,Illinois,"City of Aurora, IL -- Note added 11/20/13 16:47 Domain first added 2013-06-06. Domain first added 2013-06-06.",http://aurora-il.org/
auroranewyork.us,,,,Local,,New York,"Village of Aurora, NY -- Note added 6/8/15 12:08 Domain first added 2013-06-06. Domain first added 2013-06-06.",http://auroranewyork.us/
auroraoh.com,,,,Local,,Ohio,"Aurora, OH -- Note added 6/6/13 18:08 Domain first added 2013-06-06. Domain first added 2013-06-06.",http://auroraoh.com/
ausabletownship.net,,,,Local,,Michigan,"ausable township, mi -- Note added 9/2/15 19:58 Domain first added 2013-06-06. Domain first added 2013-06-06.",http://ausabletownship.net/
austerlitzny.com,,,,Local,,New York,"Town of Austerlitz, NY -- Note added 6/8/15 12:08 Domain first added 2013-06-06. Domain first added 2013-06-06.",http://austerlitzny.com/
austincounty.com,,,,County,,Texas,"Austin County, TX -- Note added 3/3/15 6:37 Domain first added 2013-06-06. Domain first added 2013-06-06.",http://austincounty.com/
austintowntwp.com,,,,Local,,Ohio,"Austintown Township, OH -- Note added 3/10/14 16:14 Domain first added 2013-06-06. Domain first added 2013-06-06.",http://austintowntwp.com/
auxpa.org,,,,Federal,,,"U.S. Coast Guard Auxillary, Department of Public Affairs -- Note added 10/24/14 12:20 Domain first added 2014-10-24. Domain first added 2014-10-24.",http://www.auxpa.org/
auxvassemo.com,,,,Local,,Missouri,"City of Auxvasse, MO. -- Note added 9/2/15 15:03 Domain first added 2013-06-06. Domain first added 2013-06-06.",http://www.auxvassemo.com/Pages/default.aspx
avalon.law.yale.edu,,,,Quasigovernmental,,,"The Avalon Project, documents in law, history, and diplomacy -- Note added 6/14/13 18:25 Domain first added 2013-06-06. Domain first added 2013-06-06.",#N/A
avalonboro.org,,,,County,,New Jersey,"Avalon Borough, NJ (Cape May County) -- Note added 6/30/14 11:57 Domain first added 2013-06-06. Domain first added 2013-06-06.",http://avalonboro.net/
avamissouri.org,,,,Local,,Missouri,"City of Ava, MO. -- Note added 9/2/15 15:28 Domain first added 2013-06-06. Domain first added 2013-06-06.",http://avamissouri.org/
avcp.org,,,,Native Sovereign Nation / Tribal,,Alaska,"Association of Village Council Presidents (AVCP) is a regional tribal council based in Bethel, Alaska. -- Note added 6/12/13 15:01 Domain first added 2013-06-12. Domain first added 2013-06-12.",http://avcp.org/
avon-ny.org,,,,Local,,New York,"Community of Avon, NY -- Note added 6/8/15 12:09 Domain first added 2013-06-06. Domain first added 2013-06-06.",http://avon-ny.org/
avon.org,,,,Local,,Colorado,"Town of Avon, CO -- Note added 6/6/13 18:08 Domain first added 2013-06-06. Domain first added 2013-06-06.",http://avon.org/
avonbytheseanj.com,,,,County,,New Jersey,"Avon Borough (Avon by the Sea, NJ -Monmouth County) -- Note added 6/30/14 12:00 Domain first added 2013-06-06. Domain first added 2013-06-06.",http://www.avonbytheseanj.com/
avondale.org,,,,Local,,Arizona,"City of Avondale, AZ -- Note added 11/18/13 15:47 Domain first added 2013-06-06. Domain first added 2013-06-06.",http://avondale.org/
avondaleboro.net,,,,Local,,Pennsylvania,"Borough of Avondale, PA -- Note added 6/30/14 20:51 Domain first added 2013-06-06. Domain first added 2013-06-06.",http://avondaleboro.net/
avondaleestates.org,,,,Local,,Georgia,"City of Avondale Estates, Ga -- Note added 8/25/15 14:05 Domain first added 2013-06-06. Domain first added 2013-06-06.",http://avondaleestates.org/
avongov.org,,,,Local,,Indiana,"Avon, In -- Note added 8/27/15 14:12 Domain first added 2013-06-06. Domain first added 2013-06-06.",http://avongov.org/
avonlake.org,,,,Local,,Ohio,"City of Avon Lake, OH -- Note added 3/10/14 16:17 Domain first added 2013-06-06. Domain first added 2013-06-06.",http://www.avonlake.org/
avonmass.org,,,,Local,,Massachusetts,"Town of Avon, MA -- Note added 8/26/15 15:35 Domain first added 2013-06-06. Domain first added 2013-06-06.",http://www.avon-ma.gov/
avonpark.cc,,,,Local,,Florida,"City of Avon Park, FL -- Note added 6/15/15 19:38 Domain first added 2013-06-06. Domain first added 2013-06-06.",http://avonpark.cc/
avontownship.org,,,,Local,,Minnesota,"Avon Township, MN -- Note added 3/11/15 15:23 Domain first added 2013-06-06. Domain first added 2013-06-06.",http://avontownship.org/
awendawsc.org,,,,Local,,South Carolina,"awendaw, sc -- Note added 8/28/15 13:18 Domain first added 2013-06-06. Domain first added 2013-06-06.",http://awendawsc.org/
aww.aww-sp.com,,,,Federal,,,America's Waterway Watch¬†is a public outreach program encouraging participants to simply report suspicious activity to the Coast Guard and/or other law enforcement agencies.¬† -- Note added 6/6/13 18:08 Domain first added 2013-06-06. Domain first added 2013-06-06.,#N/A
ayden.com,,,,Local,,North Carolina,"ayden, nc -- Note added 9/11/15 17:53 Domain first added 2013-06-06. Domain first added 2013-06-06.",http://www.ayden.com/
azbbhe.us,,,,State,,Arizona,Arizona Board of Behavioral Health Examiners -- Note added 12/11/13 13:50 Domain first added 2013-06-06. Domain first added 2013-06-06.,http://azbbhe.us/
azcommerce.com,,,,State,,Arizona,Arizona Commerce Authority -- Note added 12/11/13 13:50 Domain first added 2013-06-06. Domain first added 2013-06-06.,http://www.azcommerce.com/
azdentalboard.us,,,,State,,Arizona,Arizona State Board of Dental Examiners -- Note added 12/11/13 13:50 Domain first added 2013-06-06. Domain first added 2013-06-06.,http://azdentalboard.us/
azstateparks.com,,,,State,,Arizona,Arizona State Parks -- Note added 12/11/13 13:51 Domain first added 2013-06-06. Domain first added 2013-06-06.,http://azstateparks.com/
babbitt-mn.com,,,,Local,,Minnesota,"City of Babbitt, MN -- Note added 3/11/15 15:26 Domain first added 2013-06-06. Domain first added 2013-06-06.",http://www.babbitt-mn.com/
backusmn.com,,,,Local,,Minnesota,"City of Backus, MN -- Note added 3/11/15 15:28 Domain first added 2013-06-06. Domain first added 2013-06-06.",http://backusmn.com/
badgerlandcfc.org,Combined Federal Campaign,,,Federal,,Wisconsin,Badgerland Combined Federal Campaign Serves following counties: ChippewaDaneDunnEu ClaireJacksonJuneauLa CrosseMonroeRockSaukVernon -- Note added 7/25/14 5:12 Domain first added 2013-06-06. Domain first added 2013-06-06.,http://www.badgerlandcfc.org/_root/
badin.org,,,,Local,,North Carolina,"badin, nc n  -- Note added 9/11/15 17:53 Domain first added 2013-06-06. Domain first added 2013-06-06.",http://badin.org/
bainbridgecity.com,,,,Local,,Georgia,"City of Bainbridge, GA -- Note added 8/25/15 14:05 Domain first added 2013-06-06. Domain first added 2013-06-06.",http://bainbridgecity.com/
bainbridgeny.org,,,,Local,,New York,"Community of Bainbridge, NY -- Note added 6/8/15 12:09 Domain first added 2013-06-06. Domain first added 2013-06-06.",http://bainbridgeny.org/
bainbridgetwp.com,,,,Local,,Ohio,"Bainbridge Township, Chagrin Falls, OH -- Note added 12/5/13 14:35 Domain first added 2013-06-06. Domain first added 2013-06-06.",http://bainbridgetwp.com/
bakercity.com,,,,Local,,Oregon,"City of Baker City, OR -- Note added 6/20/14 9:31 Domain first added 2013-06-06. Domain first added 2013-06-06.",http://bakercity.com/
bakercounty.org,,,,County,,Oregon,"Baker County, OR -- Note added 6/12/14 14:13 Domain first added 2013-06-06. Domain first added 2013-06-06.",http://www.bakercounty.org
bakercountyfl.org,,,,Local,,Florida,"The City of Baker County, FL NOTE:  This is currently a test site -- Note added 6/15/15 19:40 Domain first added 2013-06-06. Domain first added 2013-06-06.",http://208.75.175.18/testsite/
bakersfieldcity.us,,,,Local,,California,City of Bakersfield  website -- Note added 3/10/15 17:10 Domain first added 2013-06-06. Domain first added 2013-06-06.,http://www.bakersfieldcity.us/
baldwinborough.org,,,,Local,,Pennsylvania,"Baldwin Borough, PA -- Note added 6/28/13 17:10 Domain first added 2013-06-06. Domain first added 2013-06-06.",http://baldwinborough.org/
baldwincity.org,,,,Local,,Kansas,"City of Baldwin City, KS -- Note added 6/30/14 6:22 Domain first added 2013-06-06. Domain first added 2013-06-06.",http://www.baldwincity.org/
baldwincountyga.com,,,,County,,Georgia,"Baldwin County, Ga -- Note added 8/25/15 14:07 Domain first added 2013-06-06. Domain first added 2013-06-06.",http://www.baldwincountyga.com/
baldwinpark.com,,,,Local,,California,City of Baldwin Park website -- Note added 3/10/15 17:14 Domain first added 2013-06-06. Domain first added 2013-06-06.,http://baldwinpark.com
baldwinsville.org,,,,Local,,New York,"Village of Baldwinsville, NY -- Note added 11/10/15 12:17 Domain first added 2013-06-06. Domain first added 2013-06-06.",http://www.baldwinsville.org/
baldwintownship.com,,,,Local,,Pennsylvania,"Township of Baldwin, PA -- Note added 7/1/14 12:46 Domain first added 2013-06-06. Domain first added 2013-06-06.",http://baldwintownship.com/
baldwintownship.govoffice.com,,,,Local,,Minnesota,"Baldwin Township, MN -- Note added 7/19/13 12:59 Domain first added 2013-06-06. Domain first added 2013-06-06.",http://www.baldwintownship.govoffice.com/
baldwintownship.net,,,,Local,,Michigan,"Baldwin Township, MI -- Note added 7/19/13 12:58 Domain first added 2013-07-19. Domain first added 2013-07-19.",http://baldwintownship.net/
balharbourgov.com,,,,Local,,Florida,"Bal Harbour, FL -- Note added 6/16/15 14:03 Domain first added 2013-06-06. Domain first added 2013-06-06.",http://www.balharbourgov.com/
balkantownship.com,,,,Local,,Minnesota,"Town of Balkan, Balkan Township  -- Note added 3/24/15 1:22 Domain first added 2013-06-06. Domain first added 2013-06-06.",http://www.balkantownship.com/
ballardsvillefire.com,,,,Local,,Kentucky,"City of Crestwood, KY Domain first added 2022-03-23. Domain first added 2022-03-23.",https://ballardsvillefire.com/
ballville.org,,,,Local,,Ohio,"Ballville Township, Fremont, OH -- Note added 3/10/14 16:21 Domain first added 2013-06-06. Domain first added 2013-06-06.",http://ballville.org/
ballwin.mo.us,,,,Local,,Missouri,"City of Ballwin, MO. -- Note added 9/4/15 12:31 Domain first added 2013-06-06. Domain first added 2013-06-06.",http://www.ballwin.mo.us/
baltic.govoffice.com,,,,Local,,South Dakota,"City of Baltic, SD -- Note added 7/19/13 13:00 Domain first added 2013-06-06. Domain first added 2013-06-06.",http://www.baltic.govoffice.com/
baltimoreohio.org,,,,Local,,Ohio,"Village of Baltimore, OH -- Note added 3/10/14 16:24 Domain first added 2013-06-06. Domain first added 2013-06-06.",http://baltimoreohio.org/
baltometro.org,,,,Local,,Maryland,Baltimore Metropolitan Council -- Note added 4/29/14 14:30 Domain first added 2013-06-06. Domain first added 2013-06-06.,http://www.baltometro.org/
bambergsc.com,,,,Local,,South Carolina,"bamberg, sc -- Note added 8/28/15 13:18 Domain first added 2013-06-06. Domain first added 2013-06-06.",http://bambergsc.com/
banderacounty.org,,,,County,,Texas,"Bandera County, TX -- Note added 3/3/15 6:38 Domain first added 2013-06-06. Domain first added 2013-06-06.",http://banderacounty.org/
baragacounty.org,,,,County,,Michigan,"baraga county, mi -- Note added 9/2/15 19:58 Domain first added 2013-06-06. Domain first added 2013-06-06.",http://www.baragacounty.org/
barnegat.net,,,,Local,,New Jersey,"Barnegat Township, NJ (Ocean County) -- Note added 6/30/14 12:02 Domain first added 2013-06-06. Domain first added 2013-06-06.",http://www.barnegat.net/
barnes-wi.com,,,,Local,,Wisconsin,"Town of Barnes, WI -- Note added 7/25/14 5:13 Domain first added 2013-06-06. Domain first added 2013-06-06.",http://www.barnes-wi.com/
barnesvillemd.org,,,,County,,Maryland,"Barnesville is located in Montgomery County, MD -- Note added 5/2/14 19:51 Domain first added 2013-06-06. Domain first added 2013-06-06.",http://www.barnesvillemd.org
barnesvillemn.com,,,,Local,,Minnesota,"City of Barnesville, MN -- Note added 3/24/15 1:25 Domain first added 2013-06-06. Domain first added 2013-06-06.",http://www.barnesvillemn.com/
barnetvt.org,,,,Local,,Vermont,"Town of Barnet, VT -- Note added 8/13/14 5:20 Domain first added 2013-06-06. Domain first added 2013-06-06.",http://barnetvt.org/
barnstablecounty.org,,,,County,,Massachusetts,"Barnstable County, MA -- Note added 8/26/15 15:36 Domain first added 2013-06-06. Domain first added 2013-06-06.",http://www.barnstablecounty.org/
barnstead.org,,,,Local,,New Hampshire,"barnstead, nh -- Note added 8/28/15 18:36 Domain first added 2013-06-06. Domain first added 2013-06-06.",http://barnstead.org/
barrecity.org,,,,Local,,Vermont,"City of Barre, VT -- Note added 8/13/14 5:21 Domain first added 2013-06-06. Domain first added 2013-06-06.",http://www.barrecity.org/
barretown.org,,,,Local,,Vermont,"Town of Barre, VT -- Note added 8/13/14 5:22 Domain first added 2013-06-06. Domain first added 2013-06-06.",http://barretown.org/
barrierislandscouncil.com,,,,Local,,Florida,Barrier Island Governmental Council -- Note added 6/15/15 19:43 Domain first added 2013-06-06. Domain first added 2013-06-06.,http://barrierislandscouncil.com/
barringtonboro.com,,,,County,,New Jersey,"Barrington, NJ (now Camden County- established 1700s in Gloucester County)  Incorporated as a borough in 1917. -- Note added 6/30/14 12:06 Domain first added 2013-06-06. Domain first added 2013-06-06.",http://barringtonboro.com/
barrowga.org,,,,Local,,Georgia,"Barrow, GA -- Note added 8/25/15 14:08 Domain first added 2013-06-06. Domain first added 2013-06-06.",http://www.barrowga.org/
barrycounty.org,,,,County,,Michigan,"barry county, mi -- Note added 9/2/15 19:59 Domain first added 2013-06-06. Domain first added 2013-06-06.",http://www.barrycounty.org/
barstowca.org,,,,Local,,California,municipal website -- Note added 3/4/15 20:46 Domain first added 2013-06-06. Domain first added 2013-06-06.,http://barstowca.org
bartholomewco.com,,,,County,,Indiana,"Bartholomew, In -- Note added 8/27/15 14:13 Domain first added 2013-06-06. Domain first added 2013-06-06.",http://www.bartholomew.in.gov/courts.html
bartlettnh.org,,,,Local,,New Hampshire,"bartlett, nh -- Note added 8/28/15 18:36 Domain first added 2013-06-06. Domain first added 2013-06-06.",http://www.townofbartlettnh.org/
barton.allconet.org,,,,Local,,Maryland,"Town of Barton, MD -- Note added 1/13/14 19:34 Domain first added 2013-06-06. Domain first added 2013-06-06.",http://barton.allconet.org/
bartoncounty.org,,,,County,,Kansas,"Barton County, KS -- Note added 11/20/13 16:52 Domain first added 2013-06-06. Domain first added 2013-06-06.",http://www.bartoncounty.org/
bartowga.org,,,,County,,Georgia,"Bartow County, Ga -- Note added 8/25/15 14:08 Domain first added 2013-06-06. Domain first added 2013-06-06.",http://bartowga.org/
basalt.net,,,,Local,,Colorado,"Town of Basalt, CO -- Note added 7/11/14 5:20 Domain first added 2013-06-06. Domain first added 2013-06-06.",http://basalt.net/
bassriver-nj.org,,,,County,,New Jersey,"Bass River, NJ (Burlington County)  -- Note added 6/30/14 12:08 Domain first added 2013-06-06. Domain first added 2013-06-06.",http://www.bassriver-nj.org/
batavianewyork.com,,,,Local,,New York,"City of Batavia, NY -- Note added 6/8/15 12:10 Domain first added 2013-06-06. Domain first added 2013-06-06.",http://www.batavianewyork.com/
batesburg-leesville.org,,,,Local,,South Carolina,"batesburg-leesville, sc -- Note added 8/28/15 13:19 Domain first added 2013-06-06. Domain first added 2013-06-06.",http://batesburg-leesville.org/
bathcountyva.org,,,,County,,Virginia,"Bath County, VA -- Note added 5/30/14 13:41 Domain first added 2013-06-06. Domain first added 2013-06-06.",http://www.bathcountyva.org/
bathtownship.org,,,,Local,,Ohio,"Bath Township, Summit County, OH -- Note added 3/10/14 16:25 Domain first added 2013-06-06. Domain first added 2013-06-06.",http://bathtownship.org/
battleshipnc.com,,,,State,,North Carolina,"USS North Carolina Battleship, North Carolina Department of Cultural Resources -- Note added 3/20/14 17:19 Domain first added 2013-07-24. Domain first added 2013-07-24.",http://battleshipnc.com/
baxley.org,,,,Local,,Georgia,"Baxley, Ga -- Note added 8/25/15 14:08 Domain first added 2013-06-06. Domain first added 2013-06-06.",http://baxley.org/
baxter-iowa.com,,,,Local,,Iowa,"Baxter, Ia -- Note added 8/25/15 19:57 Domain first added 2013-06-06. Domain first added 2013-06-06.",http://baxter-iowa.com/
baxtercounty.org,,,,County,,Arkansas,"Baxter County, AR -- Note added 7/17/13 17:21 Domain first added 2013-06-06. Domain first added 2013-06-06.",http://baxtercounty.org/
baxterestates.org,,,,State,,New York,"Village of Baxter Estates, Port Washington, NY -- Note added 6/8/15 12:11 Domain first added 2013-06-06. Domain first added 2013-06-06.",http://baxterestates.org/index.html
baycitymi.org,,,,Local,,Michigan,"bay city, mi -- Note added 9/2/15 19:59 Domain first added 2013-06-06. Domain first added 2013-06-06.",http://baycitymi.org/
baycitywi.org,,,,Local,,Wisconsin,"City of Bay City, WI -- Note added 7/25/14 5:14 Domain first added 2013-06-06. Domain first added 2013-06-06.",http://baycitywi.org/
bayfieldcounty.org,,,,County,,Wisconsin,"Bayfield County, WI -- Note added 7/25/14 5:14 Domain first added 2013-06-06. Domain first added 2013-06-06.",http://bayfieldcounty.org/
bayharborislands.org,,,,Local,,Florida,The Town of Bay Harbor Islands -- Note added 6/16/15 14:03 Domain first added 2013-06-06. Domain first added 2013-06-06.,http://bayharborislands.org/
bayheadnj.org,,,,County,,New Jersey,"Bayhead, NH (Ocean County)  -- Note added 6/30/14 12:10 Domain first added 2013-06-06. Domain first added 2013-06-06.",http://bayheadnj.org/bhnj/
baylorcountytexas.us,,,,County,,Texas,"Baylor County, TX -- Note added 3/3/15 6:39 Domain first added 2013-06-06. Domain first added 2013-06-06.",http://baylorcountytexas.us/
baymills.org,,,,Native Sovereign Nation / Tribal,,Michigan,"Bay Mills Indian Community, Brimley, MI¬† -- Note added 6/12/13 16:02 Domain first added 2013-06-06. Domain first added 2013-06-06.",http://www.baymills.org/
bayonnenj.org,,,,Local,,New Jersey,"City of Bayonne, NJ -- Note added 6/30/14 16:23 Domain first added 2013-06-06. Domain first added 2013-06-06.",http://www.bayonnenj.org/
baytown.org,,,,Local,,Texas,"City of Baytown, TX -- Note added 3/3/15 6:40 Domain first added 2013-06-06. Domain first added 2013-06-06.",http://baytown.org/
bbna.com,,,,Native Sovereign Nation / Tribal,,Alaska,"Bristol Bay Native Association is a regional tribal council based in Dillingham, AK -- Note added 6/12/13 15:04 Domain first added 2013-06-12. Domain first added 2013-06-12.",http://bbna.com/
bcnv.org,,,,Local,,Nevada,"Boulder City, NV -- Note added 8/7/15 15:18 Domain first added 2013-06-06. Domain first added 2013-06-06.",http://www.bcnv.org/
bcua.org,,,,County,,New Jersey,Bergen County Utilities Authority -- Note added 7/23/14 13:06 Domain first added 2013-06-06. Domain first added 2013-06-06.,http://www.bcua.org/
beachwoodohio.com,,,,Local,,Ohio,"City of Beachwood, OH -- Note added 3/10/14 16:27 Domain first added 2013-06-06. Domain first added 2013-06-06.",http://beachwoodohio.com/
beachwoodusa.com,,,,County,,New Jersey,"Borough of Beachwood, NJ ( Ocean County) -- Note added 6/30/14 12:16 Domain first added 2013-06-06. Domain first added 2013-06-06.",http://beachwoodusa.com/
beadle.sdcounties.org,,,,County,,South Dakota,"Beadle County, SD -- Note added 2/26/14 19:19 Domain first added 2014-02-26. Domain first added 2014-02-26.",http://beadle.sdcounties.org/
bearlakecounty.info,,,,County,,Idaho,"Bear Lake County, ID -- Note added 7/5/13 18:26 Domain first added 2013-06-06. Domain first added 2013-06-06.",http://www.bearlakecounty.info/
bearlakemichigan.org,,,,Local,,Michigan,"bear lake, michigan -- Note added 9/2/15 20:00 Domain first added 2013-06-06. Domain first added 2013-06-06.",http://www.bearlakemichigan.org/
beaufortnc.org,,,,Local,,North Carolina,"beaufort, nc -- Note added 9/11/15 17:54 Domain first added 2013-06-06. Domain first added 2013-06-06.",http://beaufortnc.org/
beaver.okcounties.org,,,,County,,Oklahoma,"Beaver County, OK -- Note added 7/8/13 15:57 Domain first added 2013-06-06. Domain first added 2013-06-06.",http://beaver.okcounties.org/
beavercreektownship.org,,,,Local,,Ohio,"Beavercreek Township, Greene County, OH -- Note added 3/10/14 16:29 Domain first added 2013-06-06. Domain first added 2013-06-06.",http://beavercreektownship.org/
beaverheadcounty.org,,,,County,,Montana,"Beaverhead County, MT -- Note added 11/22/13 12:33 Domain first added 2013-06-06. Domain first added 2013-06-06.",http://beaverheadcounty.org/
beaverpa.us,,,,Local,,Pennsylvania,"Borough of Beaver, PA -- Note added 7/1/14 12:48 Domain first added 2013-06-06. Domain first added 2013-06-06.",http://beaverpa.us/
beavertonmi.org,,,,Local,,Michigan,"beaverton, mi -- Note added 9/2/15 20:00 Domain first added 2013-06-06. Domain first added 2013-06-06.",http://www.beavertonmi.org/
beaverutah.net,,,,Local,,Utah,"City of Beaver, UT -- Note added 8/19/14 4:59 Domain first added 2013-06-06. Domain first added 2013-06-06.",http://beaverutah.net/
beckham.okcounties.org,,,,County,,Oklahoma,"Beckham County, OK -- Note added 8/2/13 14:48 Domain first added 2013-08-02. Domain first added 2013-08-02.",http://beckham.okcounties.org/
beckley.org,,,,Local,,West Virginia,"City of Beckley, WV -- Note added 7/24/14 5:21 Domain first added 2013-06-06. Domain first added 2013-06-06.",http://beckley.org/
bedfordmi.org,,,,Local,,Michigan,"bedford, mi  -- Note added 9/2/15 20:00 Domain first added 2013-06-06. Domain first added 2013-06-06.",http://bedfordmi.org/
bedfordnh.org,,,,Local,,New Hampshire,"bedford, nh -- Note added 8/28/15 18:37 Domain first added 2013-06-06. Domain first added 2013-06-06.",http://bedfordnh.org/Pages/index
bedminster.us,,,,Local,,New Jersey,"Bedminster Township, NJ (1749--Somerset County) -- Note added 6/30/14 12:20 Domain first added 2013-06-06. Domain first added 2013-06-06.",http://www.bedminster.us/
belaireks.org,,,,Local,,Kansas,"City of Bel Aire, KS -- Note added 6/30/14 6:23 Domain first added 2013-06-06. Domain first added 2013-06-06.",http://belaireks.org/
belairmd.org,,,,Local,,Maryland,"Bel Air, MD -- Note added 5/2/14 20:06 Domain first added 2013-06-06. Domain first added 2013-06-06.",http://www.belairmd.org
belchertown.org,,,,Local,,Massachusetts,"Belchertown, MA -- Note added 8/26/15 15:36 Domain first added 2013-06-06. Domain first added 2013-06-06.",http://belchertown.org/
bellacresborough.org,,,,Local,,Pennsylvania,"Borough of Bell Acres, PA -- Note added 7/1/14 12:49 Domain first added 2013-06-06. Domain first added 2013-06-06.",http://bellacresborough.org/
bellairemichigan.com,,,,Local,,Michigan,"bellaire, michigan -- Note added 9/2/15 20:01 Domain first added 2013-06-06. Domain first added 2013-06-06.",http://www.bellairemichigan.com/
bellcountytx.com,,,,County,,Texas,"Bell County, TX -- Note added 3/3/15 6:41 Domain first added 2013-06-06. Domain first added 2013-06-06.",http://bellcountytx.com/
belleairbluffs.org,,,,Local,,Florida,The City of Belleair Bluffs -- Note added 6/16/15 14:05 Domain first added 2013-06-06. Domain first added 2013-06-06.,http://belleairbluffs.org/
bellefonte.net,,,,Local,,Pennsylvania,"Borough of Bellefonte, PA -- Note added 7/1/14 12:50 Domain first added 2013-06-06. Domain first added 2013-06-06.",http://bellefonte.net/
belleplaineiowa.us,,,,Local,,Iowa,"Bell Plaine, IA -- Note added 8/25/15 19:57 Domain first added 2013-06-06. Domain first added 2013-06-06.",http://www.belleplaineiowa.us/
belleplainemn.com,,,,Local,,Minnesota,"City of Belle Plaine, MN -- Note added 3/24/15 1:27 Domain first added 2013-06-06. Domain first added 2013-06-06.",http://www.belleplainemn.com/
bellerosevillage.org,,,,Local,,New York,"Village of Bellerose, NY -- Note added 8/13/14 16:59 Domain first added 2013-06-06. Domain first added 2013-06-06.",http://bellerosevillage.org/
belleterre.us,,,,Local,,New York,"Village of Belle Terre, NY -- Note added 6/8/15 12:11 Domain first added 2013-06-06. Domain first added 2013-06-06.",http://belleterre.us/Home/tabid/115/Default.aspx
belleville.net,,,,Local,,Illinois,"City of Belleville, IL -- Note added 7/1/14 19:16 Domain first added 2013-06-06. Domain first added 2013-06-06.",http://belleville.net/
bellevillenj.org,,,,Local,,New Jersey,Requires 'www' to resolve. -- Note added 6/30/14 16:25 Domain first added 2013-06-06. Domain first added 2013-06-06.,http://www.bellevillenj.org/
bellevillewi.org,,,,Local,,Wisconsin,"Village of Belleville, WI -- Note added 7/25/14 5:15 Domain first added 2013-06-06. Domain first added 2013-06-06.",http://www.bellevillewi.org/
bellevue.net,,,,Local,,Nebraska,"City of Bellevue, NE -- Note added 12/6/13 18:49 Domain first added 2013-06-06. Domain first added 2013-06-06.",http://bellevue.net/
bellevueboro.com,,,,Local,,Pennsylvania,"Borough of Bellevue, PA -- Note added 7/1/14 12:55 Domain first added 2013-06-06. Domain first added 2013-06-06.",http://www.bellevuepa.org/
bellevueky.org,,,,Local,,Kentucky,"bellevue, Ky -- Note added 8/27/15 15:11 Domain first added 2013-06-06. Domain first added 2013-06-06.",http://bellevueky.org/
bellflower.org,,,,Local,,California,"City of Bellflower, CA -- Note added 7/19/13 13:44 Domain first added 2013-06-06. Domain first added 2013-06-06.",http://bellflower.org/home/index.asp
bellgardens.org,,,,Local,,California,municipal website -- Note added 3/4/15 20:56 Domain first added 2013-06-06. Domain first added 2013-06-06.,http://www.bellgardens.org
bellinghamma.org,,,,Local,,Massachusetts,"Town of Bellingham, MA -- Note added 8/13/14 17:00 Domain first added 2013-06-06. Domain first added 2013-06-06.",http://www.bellinghamma.org/Pages/index
bellmawr.com,,,,Local,,New Jersey,"Town of Bellmawr, NJ -- Note added 7/19/13 17:06 Domain first added 2013-06-06. Domain first added 2013-06-06.",http://www.bellmawr.com/
bellportvillage.org,,,,Local,,New York,"Village of Bellport, NY -- Note added 11/20/13 16:56 Domain first added 2013-06-06. Domain first added 2013-06-06.",http://www.bellportvillage.org/ny/
belmar.com,,,,County,,New Jersey,"Belmar, NJ (Monmouth County) -- Note added 6/30/14 12:24 Domain first added 2013-06-06. Domain first added 2013-06-06.",http://belmar.com/
belmontcountyohio.org,,,,County,,Ohio,"Belmont County, OH -- Note added 3/10/14 16:31 Domain first added 2013-06-06. Domain first added 2013-06-06.",http://www.belmontcountyohio.org/
belmontnh.org,,,,Local,,New Hampshire,"belmont, nh -- Note added 8/28/15 18:37 Domain first added 2013-06-06. Domain first added 2013-06-06.",http://belmontnh.org/
beloitks.org,,,,Local,,Kansas,"City of Beloit, KS -- Note added 6/30/14 6:24 Domain first added 2013-06-06. Domain first added 2013-06-06.",http://www.beloitks.org/
belton.org,,,,Local,,Missouri,"City of Belton, MO. -- Note added 9/4/15 12:48 Domain first added 2013-06-06. Domain first added 2013-06-06.",http://belton.org/
belview.org,,,,Local,,Minnesota,"City of Belview, MN -- Note added 8/13/14 17:01 Domain first added 2013-06-06. Domain first added 2013-06-06.",http://www.belview.org/default.aspx
bemidjitownship.com,,,,Local,,Minnesota,"Bemidiji Township, MN -- Note added 3/24/15 1:36 Domain first added 2013-06-06. Domain first added 2013-06-06.",http://www.bemidjitownship.com/
benavon.com,,,,Local,,Pennsylvania,"Borough of Ben Avon, PA -- Note added 7/1/14 12:56 Domain first added 2013-06-06. Domain first added 2013-06-06.",http://benavon.com/
benavonheightsborough.com,,,,Local,,Pennsylvania,"Borough of Ben Avon Heights, PA -- Note added 7/1/14 12:58 Domain first added 2013-06-06. Domain first added 2013-06-06.",http://benavonheightsborough.com/
benefeds.com,,,,Federal,,,"BENEFEDS, Federal Employees Dental and Vision Insurance Program, U.S. http://www.opm.gov/ Office of Personnel Management -- Note added 12/2/13 19:39 Domain first added 2013-12-02. Domain first added 2013-12-02.",https://www.benefeds.com/
benhillcounty.com,,,,County,,Georgia,"Ben Hill County, Ga -- Note added 8/25/15 14:09 Domain first added 2013-06-06. Domain first added 2013-06-06.",http://benhillcounty.com/
bennertownship.org,,,,Local,,Pennsylvania,"Benner Township, Centre County, PA -- Note added 9/23/15 13:06 Domain first added 2015-09-23. Domain first added 2015-09-23.",#N/A
bennettsvillesc.com,,,,Local,,South Carolina,"bennettsville, sc -- Note added 8/28/15 13:19 Domain first added 2013-06-06. Domain first added 2013-06-06.",http://bennettsvillesc.com/
bennington.org,,,,Local,,Vermont,"Town of Bennington, VT -- Note added 8/13/14 5:24 Domain first added 2013-06-06. Domain first added 2013-06-06.",http://bennington.org/
bensalemtwp.org,,,,Local,,Pennsylvania,"Bensalem Township, Bucks County, PA -- Note added 9/23/15 12:59 Domain first added 2013-06-06. Domain first added 2013-06-06.",http://www.bensalempa.gov/
bensenville.il.us,,,,Local,,Illinois,"Village of Bensenville, IL -- Note added 6/6/13 18:09 Domain first added 2013-06-06. Domain first added 2013-06-06.",http://bensenville.il.us/
benson-vt.com,,,,Local,,Vermont,"Town of Benson, VT -- Note added 8/13/14 5:24 Domain first added 2013-06-06. Domain first added 2013-06-06.",http://benson-vt.com/
bensonmn.org,,,,Local,,Minnesota,"City of Benson, MN -- Note added 3/24/15 1:38 Domain first added 2013-06-06. Domain first added 2013-06-06.",http://www.bensonmn.org/
bentonvillear.com,,,,Local,,Arkansas,"City of Bentonville, AR -- Note added 12/10/14 6:42 Domain first added 2013-06-06. Domain first added 2013-06-06.",http://bentonvillear.com/
bentonvillebattlefield.com,,,,Local,,North Carolina,"Battle of Bentonville, NC -- Note added 9/11/15 17:55 Domain first added 2013-06-06. Domain first added 2013-06-06.",http://www.nchistoricsites.org/bentonvi/
bentonwi.us,,,,Local,,Wisconsin,"Village of Benton, WI -- Note added 3/20/14 17:21 Domain first added 2013-06-06. Domain first added 2013-06-06.",http://www.bentonwi.us/
beresfordsd.com,,,,Local,,South Dakota,"City of Beresford, SD n  -- Note added 7/17/14 5:10 Domain first added 2013-06-06. Domain first added 2013-06-06.",http://www.beresfordsd.com/
bergenfieldboro.com,,,,County,,New Jersey,"Borough of Bergenfield, NJ (Bergen County) -- Note added 6/30/14 12:26 Domain first added 2013-06-06. Domain first added 2013-06-06.",http://bergenfieldboro.com/
berkeley-lake.com,,,,Local,,Georgia,"City of Berkeley Lake, GA -- Note added 6/6/13 18:09 Domain first added 2013-06-06. Domain first added 2013-06-06.",http://berkeley-lake.com/
berkeleycountycomm.org,,,,County,,West Virginia,"Berkeley County, WV -- Note added 7/24/14 5:22 Domain first added 2013-06-06. Domain first added 2013-06-06.",http://berkeleycountycomm.org/
berkeleyheightstwp.com,,,,Local,,New Jersey,Berkley Heights Township (Union County) -- Note added 7/3/14 17:05 Domain first added 2013-06-06. Domain first added 2013-06-06.,http://berkeleyheightstwp.com/
berkleymich.org,,,,Local,,Michigan,"berkley, mi -- Note added 9/2/15 20:01 Domain first added 2013-06-06. Domain first added 2013-06-06.",http://berkleymich.org/
berkshireny.net,,,,Local,,New York,"Town of Berkshire, NY -- Note added 6/28/13 16:57 Domain first added 2013-06-06. Domain first added 2013-06-06.",http://www.berkshireny.net/
berkshireplanning.org,,,,Regional,,Massachusetts,Berkshire Regional Planning Commission -- Note added 8/26/15 15:37 Domain first added 2013-06-06. Domain first added 2013-06-06.,http://berkshireplanning.org/
berkshiretwp.org,,,,Local,,Ohio,"Berkshire Township, Delaware, OH -- Note added 3/10/14 16:33 Domain first added 2013-06-06. Domain first added 2013-06-06.",http://berkshiretwp.org/
berlinnj.org,,,,Local,,New Jersey,"Borough of Berlin, NJ -- Note added 7/23/14 13:09 Domain first added 2013-06-06. Domain first added 2013-06-06.",http://berlinnj.org/
berlintwp.com,,,,Local,,New Jersey,"Township of Berlin, NJ (Incorporated April 11, 1910) -- Note added 7/7/14 18:57 Domain first added 2013-06-06. Domain first added 2013-06-06.",http://berlintwp.com/
berlinvt.org,,,,Local,,Vermont,"Town of Berlin, VT -- Note added 8/13/14 5:25 Domain first added 2013-06-06. Domain first added 2013-06-06.",http://berlinvt.org/
bernards.org,,,,Local,,New Jersey,Bernards Township (chartered 1760 -Somerset County) -- Note added 7/3/14 17:18 Domain first added 2013-06-06. Domain first added 2013-06-06.,http://bernards.org/
bernardsvilleboro.org,,,,County,,New Jersey,"Borough of Bernardsville, NJ (Somerset County -- Note added 7/3/14 17:21 Domain first added 2013-06-06. Domain first added 2013-06-06.",http://www.bernardsvilleboro.org/
bernicela.org,,,,Local,,Louisiana,"Bernice, La -- Note added 8/24/15 13:56 Domain first added 2013-06-06. Domain first added 2013-06-06.",http://bernicela.org/
berriencounty.org,,,,County,,Michigan,"berrien county, mi -- Note added 9/2/15 20:01 Domain first added 2013-06-06. Domain first added 2013-06-06.",http://berriencounty.org/
berryhilltn.org,,,,Local,,Tennessee,"City of Berry Hill, TN -- Note added 6/6/13 18:09 Domain first added 2013-06-06. Domain first added 2013-06-06.",http://berryhilltn.org/
berwickborough.org,,,,Local,,Pennsylvania,"Borough of Berwick, PA -- Note added 7/1/14 13:00 Domain first added 2013-06-06. Domain first added 2013-06-06.",http://berwickborough.org/
berwickmaine.org,,,,Local,,Maine,"berwick, maine -- Note added 8/27/15 17:58 Domain first added 2013-06-06. Domain first added 2013-06-06.",http://www.berwickmaine.org/
berwicktownship.com,,,,Local,,Pennsylvania,"Berwick Township, Adams County, PA -- Note added 9/23/15 13:06 Domain first added 2015-09-23. Domain first added 2015-09-23.",#N/A
berwyn-heights.com,,,,Local,,Maryland,"Berwyn Heights, MD -- Note added 5/2/14 20:08 Domain first added 2013-06-06. Domain first added 2013-06-06.",http://www.berwyn-heights.com
bessemercity.com,,,,Local,,North Carolina,"bessemer city, nc -- Note added 9/11/15 18:19 Domain first added 2013-06-06. Domain first added 2013-06-06.",http://bessemercity.com/
bethalto.com,,,,Local,,Illinois,"Village of Bethalto, IL -- Note added 7/1/14 19:17 Domain first added 2013-06-06. Domain first added 2013-06-06.",http://bethalto.com/
bethanymo.com,,,,Local,,Missouri,"City of Bethany, MO -- Note added 11/19/13 13:16 Domain first added 2013-11-19. Domain first added 2013-11-19.",http://www.bethanymo.com/
bethelmaine.org,,,,Local,,Maine,"Town of Bethel, ME -- Note added 8/13/14 17:30 Domain first added 2013-06-06. Domain first added 2013-06-06.",http://www.bethelmaine.org/pages/index
bethelpark.net,,,,Local,,Pennsylvania,"Municipality of Bethel Park, PA -- Note added 7/1/14 13:01 Domain first added 2013-06-06. Domain first added 2013-06-06.",http://www.bethelpark.net/
betheltownship.org,,,,Local,,Ohio,"Bethel Township, Miami County, OH -- Note added 3/10/14 16:35 Domain first added 2013-06-06. Domain first added 2013-06-06.",http://betheltownship.org/
bethelvt.com,,,,Local,,Vermont,"Bethel Historical Society, VT -- Note added 8/13/14 5:26 Domain first added 2013-06-06. Domain first added 2013-06-06.",http://bethelvt.com/
bethlehemnh.org,,,,Local,,New Hampshire,"Town of Bethlehem, NH -- Note added 6/28/13 18:15 Domain first added 2013-06-28. Domain first added 2013-06-28.",http://bethlehemnh.org/
bethlehemnj.org,,,,Local,,New Jersey,"Bethlehem Township, NJ -- Note added 6/28/13 16:38 Domain first added 2013-06-06. Domain first added 2013-06-06.",http://bethlehemnj.org/
bethlehemtwp.com,,,,Local,,Pennsylvania,"Bethlehem Township, PA -- Note added 7/1/14 13:03 Domain first added 2013-06-06. Domain first added 2013-06-06.",http://bethlehemtwp.com/
bettendorf.org,,,,Local,,Iowa,"Bettendorf, IA -- Note added 8/25/15 19:58 Domain first added 2013-06-06. Domain first added 2013-06-06.",http://bettendorf.org/
beulahnd.org,,,,Local,,North Dakota,"City of Beulah, ND -- Note added 7/17/14 6:12 Domain first added 2013-06-06. Domain first added 2013-06-06.",http://www.beulahnd.org/
beverlyhills.org,,,,Local,,California,municipal website -- Note added 3/4/15 21:06 Domain first added 2013-06-06. Domain first added 2013-06-06.,http://beverlyhills.org/
bexar.org,,,,County,,Texas,"Bexar County, TX -- Note added 3/3/15 6:43 Domain first added 2013-06-06. Domain first added 2013-06-06.",http://www.bexar.org/
bexley.org,,,,Local,,Ohio,"City of Bexley, OH -- Note added 3/10/14 16:37 Domain first added 2013-06-06. Domain first added 2013-06-06.",http://www.bexley.org/
bgky.org,,,,Local,,Kentucky,"bowling green, ky -- Note added 8/27/15 15:12 Domain first added 2013-06-06. Domain first added 2013-06-06.",http://bgky.org/
bgohio.org,,,,Local,,Ohio,"City of Bowling Green, OH -- Note added 3/10/14 16:38 Domain first added 2013-06-06. Domain first added 2013-06-06.",http://bgohio.org/
biddefordmaine.org,,,,Local,,Maine,"biddeford, maine -- Note added 8/27/15 17:58 Domain first added 2013-06-06. Domain first added 2013-06-06.",http://www.biddefordmaine.org/
bie.edu,Department of the Interior,,,Federal,,,The Bureau of Indian Education’s (BIE) bie.edu is an Indian education website. The BIE is institutionally accredited by the U.S. Department of Education to own and operate the .edu domain to align with the educational mission of the BIE. Domain first added 1/7/14 - updated 02/03/2020. Domain first added 1/7/14 - updated 02/03/2020.,https://bie.edu/
bienvilleparish.org,,,,County,,Louisiana,Bienville Parish (LA) Clerk's Office -- Note added 8/13/14 17:25 Domain first added 2013-06-06. Domain first added 2013-06-06.,http://clerk.bienvilleparish.org
big-valley.net,,,,Local,,California,REVISIT - http://big-valley.net and http://www.big-valley.net both redirect to the tribe's Outlook web access. No homepage was found. -- Note added 12/4/13 19:41 Domain first added 2013-06-06. Domain first added 2013-06-06.,#N/A
bigfalls.govoffice.com,,,,Local,,Minnesota,"City of Big Falls, MN -- Note added 1/13/14 19:35 Domain first added 2013-06-06. Domain first added 2013-06-06.",http://www.bigfalls.govoffice.com/
biggs.org,,,,Local,,California,School district website -- Note added 3/4/15 21:34 Domain first added 2013-06-06. Domain first added 2013-06-06.,#N/A
biglakemn.org,,,,Local,,Minnesota,"City of Big Lake, MN -- Note added 3/24/15 1:41 Domain first added 2013-06-06. Domain first added 2013-06-06.",http://www.biglakemn.org/
biglaketownship.com,,,,Local,,Minnesota,"Town of Big Lake, MN; Big Lake Township, MN -- Note added 3/24/15 1:43 Domain first added 2013-06-06. Domain first added 2013-06-06.",http://www.biglaketownship.com/
bigsandyrancheria.com,,,,Native Sovereign Nation / Tribal,,,Western Mono Indian tribe -- Note added 3/5/15 16:10 Domain first added 2013-06-06. Domain first added 2013-06-06.,http://www.bigsandyrancheria.com/
bigstonecounty.org,,,,County,,Minnesota,"Big Stone County, MN -- Note added 3/24/15 1:46 Domain first added 2013-06-06. Domain first added 2013-06-06.",http://www.bigstonecounty.org/
bigstonegap.org,,,,Local,,Virginia,"Town of Big Stone Gap, VA -- Note added 6/6/14 13:46 Domain first added 2013-06-06. Domain first added 2013-06-06.",http://bigstonegap.org/
biloxi.ms.us,,,,Local,,Mississippi,"City of Biloxi, MS -- Note added 7/8/14 13:04 Domain first added 2013-06-06. Domain first added 2013-06-06.",http://www.biloxi.ms.us/
biltmoreforest.org,,,,Local,,North Carolina,"Town of Biltmore Forest, NC -- Note added 1/15/14 12:12 Domain first added 2014-01-15. Domain first added 2014-01-15.",http://www.biltmoreforest.org/
biltmoreforesttownhall.homestead.com,,,,Local,,North Carolina,"Town of Biltmore Forest, NC -- Note added 1/15/14 12:11 Domain first added 2013-06-06. Domain first added 2013-06-06.",http://biltmoreforesttownhall.homestead.com/
bingenwashington.org,,,,Local,,Washington,"City of Bingen, WA -- Note added 9/12/14 5:25 Domain first added 2013-06-06. Domain first added 2013-06-06.",http://bingenwashington.org/
binghamfarms.org,,,,Local,,Michigan,"bingham farms, mi -- Note added 9/2/15 20:02 Domain first added 2013-06-06. Domain first added 2013-06-06.",http://binghamfarms.org/
binghammaine.org,,,,Local,,Maine,"bingham, maine -- Note added 8/27/15 17:59 Domain first added 2013-06-06. Domain first added 2013-06-06.",http://www.binghammaine.org/index.php
birdislandcity.com,,,,Local,,Minnesota,"City of Bird Island, MN -- Note added 3/24/15 1:48 Domain first added 2013-06-06. Domain first added 2013-06-06.",http://birdislandcity.com/wordpress/
bismarck.org,,,,Local,,North Dakota,"City of Bismark, ND -- Note added 7/18/13 12:52 Domain first added 2013-06-06. Domain first added 2013-06-06.",http://bismarck.org/
bismarckairport.com,,,,Local,,North Dakota,"Bismark Airport - operated by the City of Bismark, ND -- Note added 7/18/14 5:21 Domain first added 2013-06-06. Domain first added 2013-06-06.",http://bismarckairport.com/
bixby.com,,,,Local,,Oklahoma,"City of Bixby, OK -- Note added 11/22/13 14:13 Domain first added 2013-06-06. Domain first added 2013-06-06.",http://www.bixby.com/
blackcreektownship.org,,,,Local,,Pennsylvania,"Black Creek Township, Luzerne County, PA -- Note added 9/23/15 13:06 Domain first added 2015-09-23. Domain first added 2015-09-23.",#N/A
blackduckmn.com,,,,Local,,Minnesota,"City of Blackduck, MN -- Note added 3/24/15 1:50 Domain first added 2013-06-06. Domain first added 2013-06-06.",http://www.blackduckmn.com/
blackearthwisconsin.com,,,,Local,,Wisconsin,"Village of Black Earth, WI -- Note added 7/25/14 5:16 Domain first added 2013-06-06. Domain first added 2013-06-06.",http://www.blackearthwisconsin.com/
blackfeetnation.com,,,,Native Sovereign Nation / Tribal,,Montana,"Montana Governor's Office of Indian AffairsBlackfeet Nation, MT -- Note added 3/2/15 6:28 Domain first added 2013-06-06. Domain first added 2013-06-06.",http://tribalnations.mt.gov/blackfeet
blackfordcounty.com,,,,County,,Indiana,"Blackford County, IN -- Note added 7/25/13 14:56 Domain first added 2013-07-25. Domain first added 2013-07-25.",http://blackfordcounty.com/
blackriverfalls.com,,,,Local,,Wisconsin,"City of Black River Falls, WI -- Note added 7/25/14 5:18 Domain first added 2013-06-06. Domain first added 2013-06-06.",http://blackriverfalls.com/
blackriverny.org,,,,Local,,New York,"Village of Black River, NY -- Note added 6/17/15 16:24 Domain first added 2013-06-06. Domain first added 2013-06-06.",http://www.blackriverny.org/
blacksburg.va.us,,,,Local,,Virginia,"Town of Blacksburg, VA -- Note added 5/30/14 13:44 Domain first added 2013-06-06. Domain first added 2013-06-06.",http://blacksburg.va.us/
bladennc.govoffice3.com,,,,County,,North Carolina,"Bladen County, NC -- Note added 7/25/13 15:01 Domain first added 2013-06-06. Domain first added 2013-06-06.",http://www.bladennc.govoffice3.com/
blaine.okcounties.org,,,,County,,Oklahoma,"Blaine County, OK -- Note added 8/2/13 14:46 Domain first added 2013-08-02. Domain first added 2013-08-02.",http://blaine.okcounties.org/
blairco.org,,,,County,,Pennsylvania,"Blair County, PA -- Note added 6/12/13 19:08 Domain first added 2013-06-06. Domain first added 2013-06-06.",http://blairco.org/Pages/default.aspx
blairstown-nj.org,,,,Local,,New Jersey,"Blairstown, NJ (Warren County) -- Note added 7/23/14 13:10 Domain first added 2013-06-06. Domain first added 2013-06-06.",http://blairstown-nj.org/
bleckley.org,,,,Local,,Georgia,"Bleckley, Ga -- Note added 8/25/15 14:10 Domain first added 2013-06-06. Domain first added 2013-06-06.",http://bleckley.org/
blmgrove.com,,,,Local,,Wisconsin,"Town of Blooming Grove, WI -- Note added 7/25/14 5:19 Domain first added 2013-06-06. Domain first added 2013-06-06.",http://blmgrove.com/
bloomfieldct.org,,,,Local,,Connecticut,"Town of Bloomfield, CT -- Note added 12/15/14 6:15 Domain first added 2013-06-06. Domain first added 2013-06-06.",http://bloomfieldct.org/Plugs/home.aspx
bloomfieldhillsmi.net,,,,Local,,Michigan,"bloomfield hills, mi -- Note added 9/2/15 20:02 Domain first added 2013-06-06. Domain first added 2013-06-06.",http://bloomfieldhillsmi.net/
bloomfieldnm.com,,,,Local,,New Mexico,"City of Bloomfield, NM -- Note added 6/6/13 18:09 Domain first added 2013-06-06. Domain first added 2013-06-06.",http://bloomfieldnm.com/
bloomfieldny.org,,,,Local,,New York,"Village of Bloomfield, NY -- Note added 6/17/15 16:25 Domain first added 2013-06-06. Domain first added 2013-06-06.",http://bloomfieldny.org/default.html
bloomfieldtownship.org,,,,Local,,Indiana,"Bloomfield Township, In -- Note added 8/27/15 14:15 Domain first added 2013-06-06. Domain first added 2013-06-06.",http://www.bloomfieldtownship.org/
bloomfieldtwp.org,,,,Local,,Michigan,"bloomfield township, mi -- Note added 9/2/15 20:03 Domain first added 2013-06-06. Domain first added 2013-06-06.",http://www.bloomfieldtwp.org/
bloomfieldtwpnj.com,,,,Local,,New Jersey,"Township of Bloomfield, NJ (Essex County) -- Note added 7/3/14 17:36 Domain first added 2013-06-06. Domain first added 2013-06-06.",http://bloomfieldtwpnj.com/
bloomingdale-ga.com,,,,Local,,Georgia,"City of Bloomingdale, Ga -- Note added 8/25/15 14:10 Domain first added 2013-06-06. Domain first added 2013-06-06.",http://www.bloomingdale-ga.com/
bloomingdalenj.org,,,,Local,,New Jersey,"bloomingdale, nj -- Note added 9/15/15 18:55 Domain first added 2013-06-06. Domain first added 2013-06-06.",http://bloomingdalenj.org/
bloomingprairie.com,,,,Local,,Minnesota,"City of Blooming Prairie, MN -- Note added 3/24/15 1:53 Domain first added 2013-06-06. Domain first added 2013-06-06.",http://www.bloomingprairie.com/
bloomsburgpa.org,,,,Local,,Pennsylvania,"Town of Bloomsburg, PA -- Note added 7/1/14 13:06 Domain first added 2013-06-06. Domain first added 2013-06-06.",http://bloomsburgpa.org/
bloomsburynewjersey.com,,,,Local,,New Jersey,"Bloomsbury, NJ -- Note added 9/15/15 18:55 Domain first added 2013-06-06. Domain first added 2013-06-06.",http://bloomsburynewjersey.com/
blossburg.org,,,,Local,,Pennsylvania,"Borough of Blossburg, PA -- Note added 7/1/14 13:07 Domain first added 2013-06-06. Domain first added 2013-06-06.",http://blossburg.org/
blueash.com,,,,Local,,Ohio,"City of Blue Ash, OH -- Note added 3/10/14 16:39 Domain first added 2013-06-06. Domain first added 2013-06-06.",http://blueash.com/
bluefieldva.org,,,,Local,,Virginia,"Town of Bluefield, VA -- Note added 5/30/14 13:45 Domain first added 2013-06-06. Domain first added 2013-06-06.",http://bluefieldva.org/
blueisland.org,,,,Local,,Illinois,"City of Blue Island, IL -- Note added 7/5/13 17:58 Domain first added 2013-06-06. Domain first added 2013-06-06.",http://www.blueisland.org/
bluemoundsvillage.com,,,,Local,,Wisconsin,"Village of Blue Mounds, WI -- Note added 3/20/14 17:25 Domain first added 2013-06-06. Domain first added 2013-06-06.",http://www.bluemoundsvillage.com/
bluespringsgov.com,,,,Local,,Missouri,"City of Blue Springs, MO. n  -- Note added 9/4/15 13:00 Domain first added 2013-06-06. Domain first added 2013-06-06.",http://bluespringsgov.com/
bluffdale.com,,,,Local,,Utah,"City of Bluffdale, UT -- Note added 8/19/14 4:59 Domain first added 2013-06-06. Domain first added 2013-06-06.",http://bluffdale.com/control.php
bmbt.org,,,,State,,North Carolina,North Carolina Board of Massage & Bodywork Therapy -- Note added 9/11/15 18:20 Domain first added 2013-06-06. Domain first added 2013-06-06.,http://bmbt.org/
bmcnc.org,,,,Local,,North Carolina,Black Mountain Neuro-Medical Treatment Center -- Note added 7/24/13 15:21 Domain first added 2013-06-06. Domain first added 2013-06-06.,http://bmcnc.org/
boardmantwp.com,,,,Local,,Ohio,"Boardman Township, Boardman, OH -- Note added 3/10/14 16:43 Domain first added 2013-06-06. Domain first added 2013-06-06.",http://boardmantwp.com/
bobber.info,,,,Federal,,,"Bobber, the official dog of the US Army Corps of Engineer's National Water Safety Program (watersafety.usace.army.mil) -- Note added 6/6/13 18:08 Domain first added 2013-06-06. Domain first added 2013-06-06.",#N/A
bogalusa.org,,,,Local,,Louisiana,"Bogulasa, LA -- Note added 8/24/15 13:57 Domain first added 2013-06-06. Domain first added 2013-06-06.",http://bogalusa.org/
boggstownship.org,,,,Local,,Pennsylvania,"Boggs Township, Centre County, PA -- Note added 9/23/15 13:00 Domain first added 2013-06-06. Domain first added 2013-06-06.",http://www.boggstownship.org/
bogotaonline.org,,,,Local,,New Jersey,"Borough of Bogota, NJ -- Note added 7/25/13 15:53 Domain first added 2013-06-06. Domain first added 2013-06-06.",http://www.bogotaonline.org/
boilingspringlakes.com,,,,Local,,North Carolina,"boiling spring lakes, nc -- Note added 9/11/15 18:24 Domain first added 2013-06-06. Domain first added 2013-06-06.",http://www.cityofbsl.org/
boisecounty.us,,,,County,,Idaho,"Boise County, ID -- Note added 7/5/13 18:27 Domain first added 2013-06-06. Domain first added 2013-06-06.",http://www.boisecounty.us/
bolingbrook.com,,,,Local,,Illinois,"Village of Boilingbrook, IL -- Note added 7/1/14 19:19 Domain first added 2013-06-06. Domain first added 2013-06-06.",http://www.bolingbrook.com/
bolton.govoffice.com,,,,Local,,Connecticut,"Town of Bolton, CT -- Note added 3/20/14 17:29 Domain first added 2013-06-06. Domain first added 2013-06-06.",http://www.bolton.govoffice.com/
boltonnewyork.com,,,,Local,,New York,"Town of Bolton, NY -- Note added 6/6/13 18:08 Domain first added 2013-06-06. Domain first added 2013-06-06.",http://www.boltonnewyork.com/
boltonvt.com,,,,Local,,Vermont,"Town of Bolton, VT -- Note added 8/13/14 5:27 Domain first added 2013-06-06. Domain first added 2013-06-06.",http://boltonvt.com/
bonneausc.com,,,,Local,,South Carolina,"Town of Bonneau, SC -- Note added 8/18/14 16:46 Domain first added 2013-06-06. Domain first added 2013-06-06.",#N/A
bonnersprings.org,,,,Local,,Kansas,"City of Bonner Springs, KS -- Note added 6/30/14 6:25 Domain first added 2013-06-06. Domain first added 2013-06-06.",http://bonnersprings.org/
bonneterre.net,,,,Local,,Missouri,"City of Bonne Terre, MO -- Note added 10/21/14 18:50 Domain first added 2013-06-06. Domain first added 2013-06-06.",http://bonneterre.net/
books.missouri.org,,,,Local,,Missouri,"Missouri Center for the Books, an affiliate of the national Center for the Book in the Library of Congress, which was established by law in 1977 to strengthen and celebrate the vital role of books, reading, and libraries in the cultural life of the nation. -- Note added 9/22/15 18:54 Domain first added 2013-06-06. Domain first added 2013-06-06.",http://books.missouri.org/
boonecountyil.org,,,,County,,Illinois,"Boone County, IL -- Note added 7/1/14 19:20 Domain first added 2013-06-06. Domain first added 2013-06-06.",http://www.boonecountyil.org/
boonecountyky.org,,,,County,,Kentucky,"Boone County, ky -- Note added 8/27/15 16:10 Domain first added 2013-06-06. Domain first added 2013-06-06.",http://boonecountyky.org/
boonegov.com,,,,Local,,Iowa,"Boone, IA -- Note added 8/25/15 19:58 Domain first added 2013-06-06. Domain first added 2013-06-06.",http://boonegov.com/
boonton.org,,,,Local,,New Jersey,"boonton, NJ -- Note added 9/15/15 18:56 Domain first added 2013-06-06. Domain first added 2013-06-06.",http://www.boonton.org/
boontontownship.com,,,,Local,,New Jersey,"Township of Boonton, Morris County, NJ -- Note added 8/18/14 16:54 Domain first added 2013-06-06. Domain first added 2013-06-06.",http://boontontownship.com/
boonville-mo.org,,,,Local,,Missouri,"City of Boonville, MO. -- Note added 9/4/15 13:47 Domain first added 2013-06-06. Domain first added 2013-06-06.",http://boonville-mo.org/
bordentowntownship.com,,,,Local,,New Jersey,"bordentown township, NJ -- Note added 9/15/15 18:56 Domain first added 2013-06-06. Domain first added 2013-06-06.",http://www.bordentowntownship.com/
boro.dormont.pa.us,,,,Local,,Pennsylvania,"Borough of Dormont, PA -- Note added 7/1/14 13:13 Domain first added 2013-06-06. Domain first added 2013-06-06.",http://www.boro.dormont.pa.us/
boro.newtown.pa.us,,,,Local,,Pennsylvania,"Borough of Newtown, PA -- Note added 7/1/14 13:15 Domain first added 2013-06-06. Domain first added 2013-06-06.",http://www.boroughofnewtown.com/
borough-of-flemington-municipal-government.eggzack.com,,,,Local,,New Jersey,"Borough of Flemington, NJ -- Note added 1/15/14 12:18 Domain first added 2013-06-06. Domain first added 2013-06-06.",http://borough-of-flemington-municipal-government.eggzack.com/
borough.castle-shannon.pa.us,,,,Local,,Pennsylvania,"Castle Shannon Borough, PA -- Note added 3/20/14 17:34 Domain first added 2013-06-06. Domain first added 2013-06-06.",http://borough.castle-shannon.pa.us/
borough.chambersburg.pa.us,,,,Local,,Pennsylvania,"Borough of Chambersburg, PA -- Note added 7/1/14 13:19 Domain first added 2013-06-06. Domain first added 2013-06-06.",http://borough.chambersburg.pa.us/
borough.emmaus.pa.us,,,,Local,,Pennsylvania,"Borough of Emmaus, PA -- Note added 7/1/14 13:31 Domain first added 2013-06-06. Domain first added 2013-06-06.",http://borough.emmaus.pa.us/
borough.hanover.pa.us,,,,Local,,Pennsylvania,"Borough of Hanover, PA -- Note added 7/1/14 13:35 Domain first added 2013-06-06. Domain first added 2013-06-06.",http://www.hanoverboroughyorkcountypa.info/
borough.kenai.ak.us,,,,Local,,Alaska,"Kenai Peninsula Borough, AK -- Note added 1/2/14 14:49 Domain first added 2013-06-06. Domain first added 2013-06-06.",http://www.borough.kenai.ak.us/
borough.ketchikan.ak.us,,,,Local,,Alaska,"Ketchikan Gateway Borough, AK -- Note added 6/7/13 12:42 Domain first added 2013-06-06. Domain first added 2013-06-06.",http://borough.ketchikan.ak.us/
borough.mountpocono.pa.us,,,,Local,,Pennsylvania,"Borough of Mount Pocono, PA -- Note added 7/1/14 13:40 Domain first added 2013-06-06. Domain first added 2013-06-06.",http://borough.mountpocono.pa.us/
borough.shippensburg.pa.us,,,,Local,,Pennsylvania,"Borough of Shippensburg, PA -- Note added 7/1/14 13:42 Domain first added 2013-06-06. Domain first added 2013-06-06.",http://www.borough.shippensburg.pa.us/
borough.stroudsburg.pa.us,,,,Local,,Pennsylvania,"Borough of Stroudsburg, PA -- Note added 7/1/14 13:43 Domain first added 2013-06-06. Domain first added 2013-06-06.",http://borough.stroudsburg.pa.us/
boroughofambler.com,,,,Local,,Pennsylvania,"Borough of Ambler, PA -- Note added 7/1/14 13:45 Domain first added 2013-06-06. Domain first added 2013-06-06.",http://boroughofambler.com/
boroughofavalon.org,,,,Local,,Pennsylvania,"Borough of Avalon, PA -- Note added 7/1/14 13:49 Domain first added 2013-06-06. Domain first added 2013-06-06.",http://boroughofavalon.org/
boroughofbridgeport.com,,,,Local,,Pennsylvania,"Borough of Bridgeport, PA -- Note added 7/1/14 13:51 Domain first added 2013-06-06. Domain first added 2013-06-06.",http://boroughofbridgeport.com/
boroughofeastnewark.com,,,,Local,,New Jersey,"Borough of East Newark, NJ -- Note added 9/15/15 18:57 Domain first added 2013-06-06. Domain first added 2013-06-06.",http://www.boroughofeastnewark.com/
boroughofmarietta.com,,,,Local,,Pennsylvania,"Borough of Marietta, PA -- Note added 7/1/14 13:55 Domain first added 2013-06-06. Domain first added 2013-06-06.",http://boroughofmarietta.com
boroughofnorthvale.com,,,,Local,,New Jersey,"borough of northvale, NJ -- Note added 9/15/15 18:57 Domain first added 2013-06-06. Domain first added 2013-06-06.",http://boroughofnorthvale.com/
boroughofpalmyra.com,,,,Local,,New Jersey,"borough of palmyra, NJ -- Note added 9/15/15 18:58 Domain first added 2013-06-06. Domain first added 2013-06-06.",http://boroughofpalmyra.com/
boroughofroselle.com,,,,Local,,New Jersey,"borough of roselle, NJ -- Note added 9/15/15 18:58 Domain first added 2013-06-06. Domain first added 2013-06-06.",http://www.boroughofroselle.com/
boroughofwoodbine.net,,,,Local,,New Jersey,"Borough of Woodbine, NJ -- Note added 12/4/13 19:12 Domain first added 2013-06-06. Domain first added 2013-06-06.",http://boroughofwoodbine.net/
boroughwestmifflin.com,,,,Local,,Pennsylvania,"Borough of West Mifflin, PA -- Note added 8/26/13 16:30 Domain first added 2013-06-06. Domain first added 2013-06-06.",http://www.westmifflinborough.com/
borregowd.org,,,,Local,,California,water district website -- Note added 3/4/15 22:13 Domain first added 2013-06-06. Domain first added 2013-06-06.,http://borregowd.org
boscobelwisconsin.com/city,,,,Local,,Wisconsin,"City of Boscobel, WI -- Note added 4/1/14 14:07 Domain first added 2013-06-06. Domain first added 2013-06-06.",http://www.boscobelwisconsin.com/city/index.html
bosquecounty.us,,,,County,,Texas,"Bosque County, TX -- Note added 3/3/15 6:44 Domain first added 2013-06-06. Domain first added 2013-06-06.",http://bosquecounty.us/
bossiercity.org,,,,Local,,Louisiana,"Bossier City, La -- Note added 8/24/15 13:58 Domain first added 2013-06-06. Domain first added 2013-06-06.",http://bossiercity.org/
bostonfed.org,,,,Local,,Massachusetts,Federal Reserve Bank of Boston -- Note added 1/10/14 19:17 Domain first added 2014-01-10. Domain first added 2014-01-10.,http://bostonfed.org/
bostonga.com,,,,Local,,Georgia,"Boston, Ga -- Note added 8/25/15 14:11 Domain first added 2013-06-06. Domain first added 2013-06-06.",http://bostonga.com/
botco.homestead.com,,,,County,,North Dakota,"Bottineau County, ND -- Note added 7/18/13 12:53 Domain first added 2013-06-06. Domain first added 2013-06-06.",http://botco.homestead.com/
bottineau.govoffice.com,,,,Local,,North Dakota,"City of Bottineau, ND -- Note added 7/18/13 12:54 Domain first added 2013-06-06. Domain first added 2013-06-06.",http://www.bottineau.govoffice.com/
bouldercounty.org,,,,County,,Colorado,"Boulder County, CO -- Note added 1/2/14 14:47 Domain first added 2014-01-02. Domain first added 2014-01-02.",http://www.bouldercounty.org/pages/default.aspx
boundarycountyid.org,,,,County,,Idaho,"Boundary County, ID -- Note added 7/5/13 18:27 Domain first added 2013-06-06. Domain first added 2013-06-06.",http://boundarycountyid.org/
boundbrook-nj.org,,,,Local,,New Jersey,"bound brook,  nj -- Note added 9/15/15 18:58 Domain first added 2013-06-06. Domain first added 2013-06-06.",http://boundbrook-nj.org/
bourboncountyks.org,,,,County,,Kansas,"Bourbon County, KS -- Note added 3/20/14 17:36 Domain first added 2013-06-06. Domain first added 2013-06-06.",http://bourboncountyks.org/
bovinany.org,,,,Local,,New York,"Town of Bovina, NY -- Note added 6/17/15 16:28 Domain first added 2013-06-06. Domain first added 2013-06-06.",http://bovinany.org/
bow-nh.com,,,,Local,,New Hampshire,"bow, nh -- Note added 8/28/15 18:38 Domain first added 2013-06-06. Domain first added 2013-06-06.",http://bow-nh.com/Pages/index
bowdoinham.com,,,,Local,,Maine,"bowdoinham, me -- Note added 8/27/15 17:59 Domain first added 2013-06-06. Domain first added 2013-06-06.",http://www.bowdoinham.com/
bowdoinme.com,,,,Local,,Maine,"bowdoin, me -- Note added 8/27/15 17:59 Domain first added 2013-06-06. Domain first added 2013-06-06.",http://bowdoinme.com/
bowdon.net,,,,Local,,Georgia,"Bowdon, Ga -- Note added 8/25/15 14:11 Domain first added 2013-06-06. Domain first added 2013-06-06.",http://bowdon.net/
bowdonnd.com,,,,Local,,North Dakota,"City of Bowdon, ND -- Note added 7/18/13 12:55 Domain first added 2013-06-06. Domain first added 2013-06-06.",http://www.bowdonnd.com/
bowmannd.com/city,,,,Local,,North Dakota,"City of Bowman, ND -- Note added 7/18/13 17:22 Domain first added 2013-07-18. Domain first added 2013-07-18.",http://bowmannd.com/city/
bowmannd.com/county,,,,County,,North Dakota,"Bowman County, ND -- Note added 7/18/13 17:21 Domain first added 2013-06-06. Domain first added 2013-06-06.",http://bowmannd.com/county/
boxelder.us,,,,Local,,South Dakota,"City of Box Elder, SD -- Note added 7/17/14 5:11 Domain first added 2013-06-06. Domain first added 2013-06-06.",http://boxelder.us/
boxeldercounty.org,,,,County,,Utah,"Box Elder County, UT -- Note added 8/19/14 5:00 Domain first added 2013-06-06. Domain first added 2013-06-06.",http://www.boxeldercounty.org/
boydeniowa.net,,,,Local,,Iowa,"Boyden, Ia -- Note added 8/25/15 19:59 Domain first added 2013-06-06. Domain first added 2013-06-06.",http://boydeniowa.net/
bozeman.net,,,,Local,,Montana,"City of Bozeman, MT -- Note added 11/22/13 12:38 Domain first added 2013-06-06. Domain first added 2013-06-06.",http://www.bozeman.net/Home
bradford-vt.us,,,,Local,,Vermont,"Town of Bradford, VT -- Note added 8/13/14 5:28 Domain first added 2013-06-06. Domain first added 2013-06-06.",http://bradford-vt.us/
bradfordcountypa.org,,,,County,,Pennsylvania,"Bradford County, PA -- Note added 7/5/13 18:25 Domain first added 2013-06-06. Domain first added 2013-06-06.",http://bradfordcountypa.org/
bradfordnh.com,,,,Local,,New Hampshire,The Bradford Business Association  -- Note added 8/28/15 18:38 Domain first added 2013-06-06. Domain first added 2013-06-06.,http://www.bradfordnh.com/
bradfordpa.com,,,,Local,,Pennsylvania,"City of Bradford, PA -- Note added 7/1/14 17:56 Domain first added 2013-06-06. Domain first added 2013-06-06.",http://bradfordpa.com
bradfordtwpmckeancnty.jimdo.com,,,,Local,,Pennsylvania,"Bradford Township, McKean County, PA -- Note added 9/23/15 13:06 Domain first added 2015-09-23. Domain first added 2015-09-23.",#N/A
bradfordwoodspa.org,,,,Local,,Pennsylvania,"Bradford Woods, PA -- Note added 7/1/14 17:59 Domain first added 2013-06-06. Domain first added 2013-06-06.",http://bradfordwoodspa.org/
bradleybeachonline.com,,,,Local,,New Jersey,"bradley beach, NJ -- Note added 9/15/15 18:59 Domain first added 2013-06-06. Domain first added 2013-06-06.",http://bradleybeachonline.com/
bradleyco.net,,,,County,,Tennessee,"Bradley County, TN -- Note added 6/20/14 14:33 Domain first added 2013-06-06. Domain first added 2013-06-06.",http://bradleyco.net/
bradytwp.org,,,,Local,,Michigan,"brady township, mi -- Note added 9/2/15 20:03 Domain first added 2013-06-06. Domain first added 2013-06-06.",http://bradytwp.org/
bradytwp.us,,,,Local,,Pennsylvania,"Brady Township, Butler County, PA -- Note added 9/23/15 13:06 Domain first added 2015-09-23. Domain first added 2015-09-23.",#N/A
braham.com,,,,Local,,Minnesota,"City of Braham, MN -- Note added 3/24/15 1:54 Domain first added 2013-06-06. Domain first added 2013-06-06.",http://www.braham.com/
braintreevt.com,,,,Local,,Vermont,"Town of Braintree, VT -- Note added 8/13/14 5:29 Domain first added 2013-06-06. Domain first added 2013-06-06.",http://www.braintreevt.com/
branchburg.nj.us,,,,Local,,New Jersey,"branchburg, nj -- Note added 9/15/15 18:59 Domain first added 2013-06-06. Domain first added 2013-06-06.",http://branchburg.nj.us/
brandenburgky.org,,,,Local,,Kentucky,"brandenburg, Ky -- Note added 8/27/15 16:11 Domain first added 2013-06-06. Domain first added 2013-06-06.",http://brandenburgky.org/
brandon.govoffice.com,,,,Local,,South Dakota,"City of Brandon, SD -- Note added 3/20/14 17:37 Domain first added 2013-06-06. Domain first added 2013-06-06.",http://www.brandon.govoffice.com/
brandontownship.org,,,,Local,,Minnesota,"Brandon Township, MN -- Note added 3/24/15 1:56 Domain first added 2013-06-06. Domain first added 2013-06-06.",http://www.brandontownship.org/
brantleycountyga.blogspot.com,,,,County,,Georgia,"Brantley County, GA -- Note added 7/19/13 17:13 Domain first added 2013-06-06. Domain first added 2013-06-06.",http://brantleycountyga.blogspot.com/
brantny.com,,,,Local,,New York,"Town of Brant, NY -- Note added 6/17/15 16:30 Domain first added 2013-06-06. Domain first added 2013-06-06.",http://brantny.com/
braselton.net,,,,Local,,Georgia,"Braselton, Ga -- Note added 8/25/15 14:13 Domain first added 2013-06-06. Domain first added 2013-06-06.",http://braselton.net/
brattleboro.org,,,,Local,,Vermont,"Town of Brattleboro, VT -- Note added 8/13/14 5:30 Domain first added 2013-06-06. Domain first added 2013-06-06.",http://www.brattleboro.org/
brazoria-county.com,,,,County,,Texas,"Brazoria County, TX -- Note added 8/18/14 17:46 Domain first added 2013-06-06. Domain first added 2013-06-06.",http://www.brazoria-county.com/
brazos.org,,,,Local,,Texas,"Brazos River Authority, TX -- Note added 3/3/15 6:45 Domain first added 2013-06-06. Domain first added 2013-06-06.",http://www.brazos.org/
breese.org,,,,Local,,Illinois,"City of Breese, IL -- Note added 7/1/14 19:21 Domain first added 2013-06-06. Domain first added 2013-06-06.",http://breese.org/
brentwood-tn.org,,,,Local,,Tennessee,"City of Brentwood, TN -- Note added 6/20/14 14:33 Domain first added 2013-06-06. Domain first added 2013-06-06.",http://brentwood-tn.org/
brentwoodboro.com,,,,Local,,Pennsylvania,"Borough of Brentwood, PA -- Note added 11/20/13 17:08 Domain first added 2013-06-06. Domain first added 2013-06-06.",http://www.brentwoodboro.com/
brentwoodborough.com,,,,Local,,,"Borough of Brentwood, PA -- Note added 11/20/13 17:07 Domain first added 2013-06-06. Domain first added 2013-06-06.",#N/A
brentwoodmo.org,,,,Local,,Missouri,"City of Brentwood, MO. -- Note added 9/4/15 14:18 Domain first added 2013-06-06. Domain first added 2013-06-06.",http://brentwoodmo.org/
brevardcounty.us,,,,County,,Florida,"Brevard County, FL -- Note added 6/25/13 16:19 Domain first added 2013-06-06. Domain first added 2013-06-06.",http://brevardcounty.us/
brewstercountytx.com,,,,County,,Texas,"Brewster County, TX -- Note added 12/4/13 19:10 Domain first added 2013-06-06. Domain first added 2013-06-06.",http://brewstercountytx.com/
brgov.com,,,,Local,,Louisiana,"Baton Rouge, LA -- Note added 8/24/15 13:59 Domain first added 2013-06-06. Domain first added 2013-06-06.",http://brgov.com/
briarcliffmanor.org,,,,Local,,New York,"Village of Briarcliff Manor, NY -- Note added 6/17/15 16:31 Domain first added 2013-06-06. Domain first added 2013-06-06.",http://briarcliffmanor.org/pages/index
briarcreektwp.org,,,,Local,,Pennsylvania,"Briar Creek Township, Columbia County, PA -- Note added 9/23/15 13:06 Domain first added 2015-09-23. Domain first added 2015-09-23.",#N/A
bridgecitytex.com,,,,Local,,Texas,"Bridge City, TX -- Note added 12/4/13 19:09 Domain first added 2013-06-06. Domain first added 2013-06-06.",http://www.bridgecitytex.com/
bridgeportwashington.net,,,,Local,,Washington,"City of Bridgeport, WA -- Note added 9/12/14 5:26 Domain first added 2013-06-06. Domain first added 2013-06-06.",http://www.bridgeportwashington.net/
bridgeportwv.com,,,,Local,,West Virginia,"City of Bridgeport, WV -- Note added 7/24/14 5:22 Domain first added 2013-06-06. Domain first added 2013-06-06.",http://bridgeportwv.com/
bridgetonmo.com,,,,Local,,Missouri,"City of Bridgeton, MO. -- Note added 9/4/15 14:34 Domain first added 2013-06-06. Domain first added 2013-06-06.",http://bridgetonmo.com/
bridgevilleboro.com,,,,Local,,Pennsylvania,"Borough of Bridgeville, PA -- Note added 7/1/14 18:01 Domain first added 2013-06-06. Domain first added 2013-06-06.",http://bridgevilleboro.com/
bridgewatersd.com,,,,Local,,South Dakota,"City of Bridgewater, SD -- Note added 7/17/14 5:12 Domain first added 2013-06-06. Domain first added 2013-06-06.",http://bridgewatersd.com/
bridgewatertwp.org,,,,Local,,Minnesota,"Bridgewater Township, MN -- Note added 3/24/15 1:58 Domain first added 2013-06-06. Domain first added 2013-06-06.",http://bridgewatertwp.org/
bridgingfoundation.org,Japan-US Friendship Commission,,,Quasigovernmental,,District of Columbia,"The United States – Japan Bridging Foundation (USJBF), a 501 (c)(3) nonprofit organization created in 1998, was established at the recommendation of the Japan-US Friendship Commission, an independent federal agency. from https://www.bridgingfoundation.org/about-us . friendshipblossoms.org redirects to bridgingfoundation.org Domain first added 2020-07-14. Domain first added 2020-07-14.",https://www.bridgingfoundation.org
bridgman.org,,,,Local,,Michigan,"bridgeman on the lake, mi -- Note added 9/2/15 20:04 Domain first added 2013-06-06. Domain first added 2013-06-06.",http://www.bridgman.org/
briellenj.com,,,,Local,,New Jersey,"Borough of Brielle, NJ -- Note added 6/12/13 18:08 Domain first added 2013-06-06. Domain first added 2013-06-06.",http://briellenj.com/
brigantinebeachnj.com,,,,Local,,New Jersey,"brigantine beach, nj -- Note added 9/15/15 19:00 Domain first added 2013-06-06. Domain first added 2013-06-06.",http://brigantinebeachnj.com/
brightok.net/cartercounty,,,,County,,Oklahoma,"Carter County, OK -- Note added 7/5/13 17:59 Domain first added 2013-06-06. Domain first added 2013-06-06.",http://brightok.net/cartercounty/
brightoncity.org,,,,Local,,Michigan,"City of Brighton, MI -- Note added 9/2/15 20:04 Domain first added 2013-06-06. Domain first added 2013-06-06.",http://brightoncity.org/Home.aspx
brightontwp.com,,,,Local,,Michigan,"brighton township, mi -- Note added 9/2/15 20:17 Domain first added 2013-06-06. Domain first added 2013-06-06.",http://brightontwp.com/
brightontwp.org,,,,Local,,Pennsylvania,"Brighton Township, PA -- Note added 7/1/14 18:03 Domain first added 2013-06-06. Domain first added 2013-06-06.",http://brightontwp.org/
BrightonWI.com,,,,Local,,Wisconsin,"Town of Brighton, WI -- Note added 7/25/14 5:21 Domain first added 2013-06-06. Domain first added 2013-06-06.",http://brightonwi.com/
bristolbayboroughak.us,,,,Local,,Alaska,"Bristol Bay Borough, AK -- Note added 6/7/13 14:47 Domain first added 2013-06-07. Domain first added 2013-06-07.",#N/A
bristolmaine.org,,,,Local,,Maine,"bristol, maine -- Note added 8/27/15 18:00 Domain first added 2013-06-06. Domain first added 2013-06-06.",http://bristolmaine.org/
bristolri.us,,,,Local,,Rhode Island,"Town of Bristol, RI -- Note added 3/24/14 13:11 Domain first added 2014-03-24. Domain first added 2014-03-24.",http://bristolri.us/
bristolsd.com,,,,Local,,South Dakota,"City of Bristol, SD -- Note added 7/17/14 5:13 Domain first added 2013-06-06. Domain first added 2013-06-06.",http://www.bristolsd.com/
bristoltn.org,,,,Local,,Tennessee,"City of Bristol, TN -- Note added 6/20/14 14:34 Domain first added 2013-06-06. Domain first added 2013-06-06.",http://bristoltn.org/
bristoltownship.com,,,,Local,,Ohio,"Bristol Township, Trumbull County, OH -- Note added 3/10/14 16:46 Domain first added 2013-06-06. Domain first added 2013-06-06.",http://www.bristoltownship.com/
bristoltownship.org,,,,Local,,Pennsylvania,"Bristol Township, PA -- Note added 7/1/14 18:05 Domain first added 2013-06-06. Domain first added 2013-06-06.",http://bristoltownship.org/
bristolva.org,,,,Local,,Virginia,"City of Bristol, VA -- Note added 5/30/14 13:47 Domain first added 2013-06-06. Domain first added 2013-06-06.",http://bristolva.org/
bristolvt.org,,,,Local,,Vermont,"Town of Bristol, VT -- Note added 7/25/13 16:03 Domain first added 2013-06-06. Domain first added 2013-06-06.",http://www.bristolvt.org/
broadview-heights.org,,,,Local,,Ohio,"City of Broadview Heights, OH -- Note added 3/10/14 16:49 Domain first added 2013-06-06. Domain first added 2013-06-06.",http://broadview-heights.org/
brockportny.org,,,,Local,,New York,"Village of Brockport, NY -- Note added 6/17/15 16:42 Domain first added 2013-06-06. Domain first added 2013-06-06.",http://brockportny.org/
brockwaytownship.govoffice.com,,,,Local,,Minnesota,"Township of Brockway, MN -- Note added 3/20/14 17:38 Domain first added 2013-06-06. Domain first added 2013-06-06.",http://www.brockwaytownship.govoffice.com/
brocton.org,,,,Local,,New York,"Village of Brocton, NY -- Note added 11/9/15 20:22 Domain first added 2013-06-06. Domain first added 2013-06-06.",https://www.brocton.org/
brookfieldma.us,,,,Local,,Massachusetts,"Brookfield, MA -- Note added 8/26/15 15:39 Domain first added 2013-06-06. Domain first added 2013-06-06.",http://brookfieldma.us/
brookfieldnh.org,,,,Local,,New Hampshire,"brookfield, nh -- Note added 8/28/15 18:38 Domain first added 2013-06-06. Domain first added 2013-06-06.",http://www.brookfieldnh.org/Pages/index
brookfieldny.com,,,,Local,,New York,"Town of Brookfield, NY -- Note added 11/20/13 17:10 Domain first added 2013-06-06. Domain first added 2013-06-06.",#N/A
brookfieldny.us,,,,Local,,New York,"Town of Brookfield, NY -- Note added 11/20/13 17:12 Domain first added 2013-11-20. Domain first added 2013-11-20.",http://www.brookfieldny.us/
brookhaven.org,,,,Local,,New York,"Town of Brookhaven, NY -- Note added 6/17/15 16:44 Domain first added 2013-06-06. Domain first added 2013-06-06.",http://www.brookhaven.org/
brookhavenboro.com,,,,Local,,Pennsylvania,"Borough of Brookhaven, PA -- Note added 7/1/14 18:10 Domain first added 2013-06-06. Domain first added 2013-06-06.",http://brookhavenboro.com/
brookhavenms.com,,,,Local,,Mississippi,"Brookhaven, MS -- Note added 7/8/14 13:07 Domain first added 2013-06-06. Domain first added 2013-06-06.",http://brookhavenms.com/
brookings.or.us,,,,Local,,Oregon,"City of Brookings, OR -- Note added 6/13/14 6:12 Domain first added 2013-06-06. Domain first added 2013-06-06.",http://brookings.or.us/
brooklawn-nj.com,,,,Local,,New Jersey,"Borough of Brooklawn, NJ -- Note added 8/18/14 17:42 Domain first added 2013-06-06. Domain first added 2013-06-06.",http://www.brooklawn-nj.com/
brookline.nh.us,,,,Local,,New Hampshire,"brookline, nh -- Note added 8/28/15 18:39 Domain first added 2013-06-06. Domain first added 2013-06-06.",http://www.brookline.nh.us/
brooklinevt.com,,,,Local,,Vermont,"Town of Brookline, VT -- Note added 8/13/14 5:31 Domain first added 2013-06-06. Domain first added 2013-06-06.",http://brooklinevt.com/
brooklyn-usa.org,,,,Local,,New York,"Brooklyn Borough President, New York, NY -- Note added 11/20/13 18:25 Domain first added 2013-11-20. Domain first added 2013-11-20.",#N/A
brooklynpark.org,,,,Local,,Minnesota,"City of Brooklyn Park, MN -- Note added 3/24/15 2:02 Domain first added 2013-06-06. Domain first added 2013-06-06.",http://www.brooklynpark.org/
brooksga.com,,,,Local,,Georgia,"Brooks, Ga -- Note added 8/25/15 14:13 Domain first added 2013-06-06. Domain first added 2013-06-06.",http://brooksga.com/
brookstownship.org,,,,Local,,Michigan,"Brooks Township, Newaygo County, MI -- Note added 9/22/15 14:25 Domain first added 2013-06-06. Domain first added 2013-06-06.",http://www.brookstownship.org/
brookvilleohio.com,,,,Local,,Ohio,"City of Brookeville, OH -- Note added 3/10/14 16:50 Domain first added 2013-06-06. Domain first added 2013-06-06.",http://brookvilleohio.com/
brookwoodalabama.com,,,,Local,,Alabama,"Town of Brookwood, AL -- Note added 6/12/13 17:20 Domain first added 2013-06-06. Domain first added 2013-06-06.",http://brookwoodalabama.com/
brooten.govoffice.com,,,,Local,,Minnesota,"City of Brooten, MN -- Note added 3/20/14 17:38 Domain first added 2013-06-06. Domain first added 2013-06-06.",http://www.brooten.govoffice.com/
brothertownindians.org,,,,Local,,Wisconsin,"Brothertown Indian Nation, WI Eeyamquittoowauconnuck -- Note added 7/25/14 5:23 Domain first added 2013-06-06. Domain first added 2013-06-06.",http://brothertownindians.org/
broussardla.com,,,,Local,,Louisiana,"City of Broussard, LA -- Note added 8/24/15 14:00 Domain first added 2013-06-06. Domain first added 2013-06-06.",http://www.broussardla.com/
broward.org,,,,County,,Florida,"Broward County, FL -- Note added 1/6/14 19:08 Domain first added 2013-06-06. Domain first added 2013-06-06.",http://co.broward.fl.us/
browardchd.org,,,,County,,Florida,Florida Department of Health in Broward County -- Note added 6/16/15 14:10 Domain first added 2013-06-06. Domain first added 2013-06-06.,http://broward.floridahealth.gov/
browerville.govoffice.com,,,,Local,,Minnesota,"City of Browerville, MN -- Note added 3/20/14 17:39 Domain first added 2013-06-06. Domain first added 2013-06-06.",http://www.browerville.govoffice.com/
browncountytx.org,,,,County,,Texas,"Brown County, TX -- Note added 3/3/15 6:47 Domain first added 2013-06-06. Domain first added 2013-06-06.",http://www.browncountytx.org/
browndeerwi.org,,,,Local,,Wisconsin,"Village of Brown Deer, WI -- Note added 7/25/14 5:24 Domain first added 2013-06-06. Domain first added 2013-06-06.",http://browndeerwi.org/
browningmontana.com,,,,Local,,Montana,"Town of Browning, MT -- Note added 11/22/13 12:38 Domain first added 2013-06-06. Domain first added 2013-06-06.",http://browningmontana.com/
brownsburg.org,,,,Local,,Indiana,"brownsburg, In -- Note added 8/27/15 14:15 Domain first added 2013-06-06. Domain first added 2013-06-06.",http://www.brownsburg.org/
brownstown-mi.org,,,,Local,,Michigan,"brownstown, mi -- Note added 9/2/15 20:18 Domain first added 2013-06-06. Domain first added 2013-06-06.",http://brownstown-mi.org/
brucetwp.org,,,,Local,,Michigan,"bruce township, mi -- Note added 9/2/15 20:21 Domain first added 2013-06-06. Domain first added 2013-06-06.",http://brucetwp.org/
brule-wi.org,,,,Local,,Wisconsin,"Town of Brule, WI -- Note added 3/20/14 17:40 Domain first added 2013-06-06. Domain first added 2013-06-06.",http://brule-wi.org/
brundidge.org,,,,Local,,Alabama,"City of Brundidge, AL -- Note added 6/12/13 17:21 Domain first added 2013-06-06. Domain first added 2013-06-06.",http://www.brundidge.org/
brunsco.net,,,,County,,North Carolina,"brunswick county, nc -- Note added 9/11/15 18:24 Domain first added 2013-06-06. Domain first added 2013-06-06.",http://www.brunswickcountync.gov/
brunswickco.com,,,,County,,Virginia,"Brunswick County, VA -- Note added 6/6/14 13:47 Domain first added 2013-06-06. Domain first added 2013-06-06.",http://www.brunswickco.com/
brunswickga.org,,,,Local,,Georgia,"Brunswick, Ga -- Note added 8/25/15 14:17 Domain first added 2013-06-06. Domain first added 2013-06-06.",http://brunswickga.org/
brunswickme.org,,,,Local,,Maine,"brunswick, me -- Note added 8/27/15 18:00 Domain first added 2013-06-06. Domain first added 2013-06-06.",http://www.brunswickme.org/
brushcolo.com,,,,Local,,Colorado,"City of Brush, CO -- Note added 7/11/14 5:21 Domain first added 2013-06-06. Domain first added 2013-06-06.",http://brushcolo.com/
bruslyla.com,,,,Local,,Louisiana,"Town of Brusly, LA -- Note added 11/20/13 17:14 Domain first added 2013-06-06. Domain first added 2013-06-06.",http://bruslyla.com/
bryancountyga.org,,,,County,,Georgia,"Bryan County, Ga -- Note added 8/25/15 14:17 Domain first added 2013-06-06. Domain first added 2013-06-06.",http://bryancountyga.org/
bsi-vt.com/castleton,,,,Local,,,See historical snapshot at: http://web.archive.org/web/20130526210110/http://www.bsi-vt.com/castleton/  -- Note added 8/18/14 18:18 Domain first added 2014-08-18. Domain first added 2014-08-18.,#N/A
buckhannonwv.org,,,,Local,,West Virginia,"City of Buckhannon, WV -- Note added 7/24/14 5:23 Domain first added 2013-06-06. Domain first added 2013-06-06.",http://buckhannonwv.org/Welcome.html
buckinghamcountyva.org,,,,County,,Virginia,"Buckingham County, VA -- Note added 5/30/14 13:48 Domain first added 2013-06-06. Domain first added 2013-06-06.",http://buckinghamcountyva.org/
buckinghampa.org,,,,Local,,Pennsylvania,"Buckingham Township, PA -- Note added 7/1/14 18:12 Domain first added 2013-06-06. Domain first added 2013-06-06.",http://buckinghampa.org/
buckscounty.org,,,,County,,Pennsylvania,"Bucks County, PA -- Note added 7/1/14 18:17 Domain first added 2013-06-06. Domain first added 2013-06-06.",http://buckscounty.org/
bucoda.us,,,,Local,,Washington,"Town of Bucoda, WA -- Note added 1/14/14 14:23 Domain first added 2013-06-06. Domain first added 2013-06-06.",http://site.bucoda.us/
bucoks.com,,,,County,,Kansas,"Butler County, KS -- Note added 6/30/14 6:26 Domain first added 2013-06-06. Domain first added 2013-06-06.",http://www.bucoks.com/
buenaboro.org,,,,Local,,New Jersey,"Borough of Buena, New Jersey -- Note added 9/15/15 19:00 Domain first added 2013-06-06. Domain first added 2013-06-06.",http://buenaboro.org/
buenavistanj.com,,,,Local,,New Jersey,"buena vista township, NJ -- Note added 9/15/15 19:00 Domain first added 2013-06-06. Domain first added 2013-06-06.",http://www.buenavistanj.com/
buenavistatribe.com,,,,Native Sovereign Nation / Tribal,,California,"Buena Vista Me-Wuk Indian Tribe, CA -- Note added 6/12/13 16:07 Domain first added 2013-06-06. Domain first added 2013-06-06.",#N/A
buenavistavirginia.org,,,,Local,,Virginia,"City of Buena Vista, VA -- Note added 6/6/14 13:48 Domain first added 2013-06-06. Domain first added 2013-06-06.",http://buenavistavirginia.org/
buffalocenteriowa.com,,,,Local,,Iowa,"City of Buffalo Center, IA -- Note added 8/13/14 16:53 Domain first added 2013-06-06. Domain first added 2013-06-06.",http://www.buffalocenteriowa.com/
buffalocounty.com,,,,County,,Wisconsin,"Buffalo County, WI -- Note added 7/19/13 17:14 Domain first added 2013-06-06. Domain first added 2013-06-06.",http://www.buffalocounty.com/
buffalomissouri.us,,,,Local,,Missouri,"City of Buffalo, MO -- Note added 9/22/15 19:08 Domain first added 2013-06-06. Domain first added 2013-06-06.",http://www.buffalomissouri.us/
buffalooklahoma.com,,,,Local,,Oklahoma,"Town of Buffalo, OK -- Note added 9/22/15 19:09 Domain first added 2013-06-06. Domain first added 2013-06-06.",http://buffalooklahoma.com/
buffalotownship.com,,,,Local,,Pennsylvania,"Buffalo Township, Butler County, PA -- Note added 9/23/15 13:06 Domain first added 2015-09-23. Domain first added 2015-09-23.",#N/A
bugfest.org,,,,State,,North Carolina,NC museum of natural sciences  -- Note added 9/11/15 18:50 Domain first added 2013-06-06. Domain first added 2013-06-06.,http://bugfest.org/
bullheadcity.com,,,,Local,,Arizona,"Bullhead City, AZ -- Note added 12/11/13 13:51 Domain first added 2013-06-06. Domain first added 2013-06-06.",http://www.bullheadcity.com/
bullittcounty.org,,,,County,,Kentucky,bullit county Travel  -- Note added 8/27/15 16:12 Domain first added 2013-06-06. Domain first added 2013-06-06.,http://www.travelbullitt.org/
bullochcounty.net,,,,County,,Georgia,"Bulloch County, Ga -- Note added 8/25/15 14:17 Domain first added 2013-06-06. Domain first added 2013-06-06.",http://bullochcounty.net/
buncombecounty.org,,,,County,,North Carolina,"buncombe county, nc -- Note added 9/11/15 17:09 Domain first added 2013-06-06. Domain first added 2013-06-06.",http://buncombecounty.org/
bunkerhilltx.gov,,,,Local,,Texas,"City of Bunker Hill Village, TX -- Note added 3/3/15 6:48 Domain first added 2013-06-06. Domain first added 2013-06-06.",https://www.bunkerhilltx.gov/
burkburnett.org,,,,Local,,Texas,"City of Burkburnett, TX -- Note added 3/3/15 6:49 Domain first added 2013-06-06. Domain first added 2013-06-06.",http://www.burkburnett.org/
burkecountynd.com,,,,County,,North Dakota,"Burke County, ND -- Note added 7/18/13 17:25 Domain first added 2013-06-06. Domain first added 2013-06-06.",http://burkecountynd.com/
burkevermont.org,,,,Local,,Vermont,"Town of Burke, VT -- Note added 3/20/14 17:40 Domain first added 2013-06-06. Domain first added 2013-06-06.",http://burkevermont.org/
burleighco.com,,,,County,,North Dakota,"Burleigh County, ND -- Note added 7/18/13 17:25 Domain first added 2013-06-06. Domain first added 2013-06-06.",http://burleighco.com/
burlesontx.com,,,,Local,,Texas,"City of Burleson, TX -- Note added 3/3/15 6:50 Domain first added 2013-06-06. Domain first added 2013-06-06.",http://burlesontx.com/
burleyidaho.org,,,,Local,,Idaho,"City of Burley, ID -- Note added 7/5/13 18:27 Domain first added 2013-06-06. Domain first added 2013-06-06.",http://burleyidaho.org/
burlingame.org,,,,Local,,California,municipal website -- Note added 3/5/15 17:03 Domain first added 2013-06-06. Domain first added 2013-06-06.,http://burlingame.org/
burlington.org,,,,Local,,Massachusetts,"Burlington, MA -- Note added 8/26/15 15:40 Domain first added 2013-06-06. Domain first added 2013-06-06.",http://burlington.org/
burlingtoncolo.com,,,,Local,,Colorado,"City of Burlington, CO -- Note added 7/11/14 5:22 Domain first added 2013-06-06. Domain first added 2013-06-06.",http://burlingtoncolo.com/
burlingtonct.us,,,,Local,,Connecticut,"Town of Burlington, CT -- Note added 12/15/14 6:16 Domain first added 2013-06-06. Domain first added 2013-06-06.",http://burlingtonct.us/
burlingtoniowa.org,,,,Local,,Iowa,"City of Burlington, IA -- Note added 8/18/14 18:21 Domain first added 2013-06-06. Domain first added 2013-06-06.",http://www.burlingtoniowa.org/
burlingtonnj.us,,,,Local,,New Jersey,"burlington, nj -- Note added 9/15/15 19:01 Domain first added 2013-06-06. Domain first added 2013-06-06.",http://burlingtonnj.us/
burnetcountytexas.org,,,,County,,Texas,"Burnet County, TX -- Note added 3/3/15 6:51 Domain first added 2013-06-06. Domain first added 2013-06-06.",http://burnetcountytexas.org/
burnettcounty.com,,,,County,,Wisconsin,"Burnett County, WI -- Note added 7/25/14 5:26 Domain first added 2013-06-06. Domain first added 2013-06-06.",http://burnettcounty.com/
burnettown.com,,,,Local,,South Carolina,"Burnettown, South Carolina -- Note added 8/28/15 13:19 Domain first added 2013-06-06. Domain first added 2013-06-06.",http://burnettown.com/
burnsharbor.org,,,,Local,,Indiana,"Burns Harbor, In -- Note added 8/27/15 14:16 Domain first added 2013-06-06. Domain first added 2013-06-06.",http://www.burnsharbor-in.gov/
burnsville.org,,,,Local,,Minnesota,"City of Burnsville, MN -- Note added 6/6/13 18:09 Domain first added 2013-06-06. Domain first added 2013-06-06.",http://www.burnsville.org/
burnsvillems.com,,,,Local,,Mississippi,"City of Burnsville, MS -- Note added 7/8/14 13:07 Domain first added 2013-06-06. Domain first added 2013-06-06.",http://burnsvillems.com/
burrillville.org,,,,Local,,Rhode Island,"Town of Burrillville, RI -- Note added 6/2/15 13:45 Domain first added 2013-06-06. Domain first added 2013-06-06.",http://www.burrillville.org/Public_Documents/index
bushkilltownship.com,,,,Local,,Pennsylvania,"Bushkill Township, Northampton County, PA -- Note added 9/23/15 13:06 Domain first added 2015-09-23. Domain first added 2015-09-23.",#N/A
bushlibrary.tamu.edu,,,,Federal,,,George H.W. Bush Presidential Library and Museum -- Note added 6/12/13 16:26 Domain first added 2013-06-06. Domain first added 2013-06-06.,http://bushlibrary.tamu.edu/
business.centurytel.net/st.helenapj,,,,County,,Louisiana,"St. Helena Parish, La -- Note added 8/24/15 15:42 Domain first added 2013-06-06. Domain first added 2013-06-06.",http://sthelenaparish.la.gov/
butlerborough.com,,,,Local,,New Jersey,"Borough of Butler, NJ -- Note added 9/15/15 19:02 Domain first added 2013-06-06. Domain first added 2013-06-06.",http://butlerborough.com/
butlercoiowa.org,,,,County,,Iowa,"Butler County, IA -- Note added 8/25/15 20:00 Domain first added 2013-06-06. Domain first added 2013-06-06.",http://butlercoiowa.org/
butlercountyohio.org,,,,County,,Ohio,"Butler County, OH -- Note added 3/10/14 16:51 Domain first added 2013-06-06. Domain first added 2013-06-06.",http://www.butlercountyohio.org/
butlertownship.com,,,,Local,,Ohio,"Butler Township, Montgomery County, OH -- Note added 3/10/14 16:52 Domain first added 2013-06-06. Domain first added 2013-06-06.",http://butlertownship.com/
butlertwp.org,,,,Local,,Pennsylvania,"Butler Township, PA -- Note added 7/1/14 18:20 Domain first added 2013-06-06. Domain first added 2013-06-06.",http://butlertwp.org/
butte.sdcounties.org,,,,County,,South Dakota,"Butte County, SD -- Note added 3/21/14 19:36 Domain first added 2014-03-21. Domain first added 2014-03-21.",http://butte.sdcounties.org/
buttecounty.net,,,,County,,California,"Butte County, CA -- Note added 3/21/14 19:35 Domain first added 2013-06-06. Domain first added 2013-06-06.",https://www.buttecounty.net/
buttscountyga.com,,,,County,,Georgia,"Butts County, GA -- Note added 11/20/13 17:16 Domain first added 2013-11-20. Domain first added 2013-11-20.",http://buttscountyga.com/
buxton.me.us,,,,Local,,Maine,"Town of Buxton, ME -- Note added 8/18/14 18:33 Domain first added 2013-06-06. Domain first added 2013-06-06.",http://www.buxton.me.us/Pages/index
buxtonnd.com,,,,Local,,North Dakota,"City of Buxton, ND -- Note added 7/18/14 5:25 Domain first added 2013-06-06. Domain first added 2013-06-06.",http://buxtonnd.com/
buyaccessible.net,,,,Federal,,,"Section 508 blog, U.S. General Services Administration -- Note added 6/14/13 18:27 Domain first added 2013-06-06. Domain first added 2013-06-06.",#N/A
buyctbonds.com,,,,State,,Connecticut,State of Connecticut Bonds -- Note added 6/27/13 19:52 Domain first added 2013-06-27. Domain first added 2013-06-27.,http://buyctbonds.com/
bwhnj.com,,,,Local,,New Jersey,"Borough of Woodbury Heights, NJ -- Note added 9/15/15 19:02 Domain first added 2013-06-06. Domain first added 2013-06-06.",http://bwhnj.com/
byram-ms.us,,,,Local,,Mississippi,"City of Byram, MS -- Note added 11/20/13 17:17 Domain first added 2013-06-06. Domain first added 2013-06-06.",http://byram-ms.us/
byramtwp.org,,,,Local,,New Jersey,"byram township, NJ -- Note added 9/15/15 19:03 Domain first added 2013-06-06. Domain first added 2013-06-06.",http://byramtwp.org/
byrnesmill.org,,,,Local,,Missouri,"City of Byrnes Mill, MO. n  -- Note added 9/4/15 15:15 Domain first added 2013-06-06. Domain first added 2013-06-06.",http://byrnesmill.org/
byron.org,,,,Local,,Michigan,"byron, mi -- Note added 9/2/15 20:21 Domain first added 2013-06-06. Domain first added 2013-06-06.",http://byron.org/
byronga.com,,,,Local,,Georgia,"Byron, Ga -- Note added 8/25/15 14:18 Domain first added 2013-06-06. Domain first added 2013-06-06.",http://www.byronga.com/index.cfm
byronmn.com,,,,Local,,Minnesota,"City of Byron, MN -- Note added 3/24/15 2:07 Domain first added 2013-06-06. Domain first added 2013-06-06.",http://www.byronmn.com/
byronny.com,,,,Local,,New York,"Town of Byron, NY -- Note added 6/17/15 16:47 Domain first added 2013-06-06. Domain first added 2013-06-06.",http://byronny.com/
c3gov.com,,,,Local,,Colorado,"Commerce City, CO -- Note added 6/6/13 18:09 Domain first added 2013-06-06. Domain first added 2013-06-06.",http://c3gov.com/
ca-bishop.us,,,,Local,,California,Municipal website -- Note added 3/5/15 18:21 Domain first added 2013-06-06. Domain first added 2013-06-06.,http://www.ca-bishop.us/
caamuseum.org,,,,Local,,California,California African American Museum -- Note added 3/5/15 18:28 Domain first added 2013-06-06. Domain first added 2013-06-06.,http://www.caamuseum.org/
cabarruscounty.us,,,,County,,North Carolina,"Cabarrus County, NC -- Note added 8/28/13 12:12 Domain first added 2013-06-06. Domain first added 2013-06-06.",https://www.cabarruscounty.us/Pages/default.aspx
cabellcounty.org,,,,County,,West Virginia,"Cabell County, WV -- Note added 7/24/14 5:24 Domain first added 2013-06-06. Domain first added 2013-06-06.",http://cabellcounty.org/
cabool.org,,,,Local,,Missouri,"Town of Cabool, MO -- Note added 8/14/14 19:42 Domain first added 2013-06-06. Domain first added 2013-06-06.",http://cabool.org/
cachecounty.org,,,,County,,Utah,"Cache County, UT -- Note added 8/19/14 5:01 Domain first added 2013-06-06. Domain first added 2013-06-06.",https://www.cachecounty.org/
caddo.org,,,,County,,Louisiana,"Caddo Parish, LA -- Note added 8/18/14 18:35 Domain first added 2013-06-06. Domain first added 2013-06-06.",http://www.caddo.org/
cadillac-mi.net,,,,Local,,Michigan,"cadillac, mi -- Note added 9/2/15 20:26 Domain first added 2013-06-06. Domain first added 2013-06-06.",http://cadillac-mi.net/
caernarvon.org,,,,Local,,Pennsylvania,"Caernarvon Township, PA -- Note added 7/1/14 18:59 Domain first added 2013-06-06. Domain first added 2013-06-06.",http://caernarvon.org/
calaverasgov.us,,,,County,,California,"website of Calaveras County, CA -- Note added 3/5/15 19:22 Domain first added 2013-06-06. Domain first added 2013-06-06.",http://calaverasgov.us/
caldwell-nj.com,,,,Local,,New Jersey,"caldwell, nj -- Note added 9/15/15 19:08 Domain first added 2013-06-06. Domain first added 2013-06-06.",http://caldwell-nj.com/
caldwellcountync.org,,,,County,,North Carolina,"caldwell county, NC -- Note added 9/11/15 18:56 Domain first added 2013-06-06. Domain first added 2013-06-06.",http://caldwellcountync.org/
caledoniawi.com,,,,Local,,Wisconsin,"Village of Caledonia, WI -- Note added 7/25/14 5:26 Domain first added 2013-06-06. Domain first added 2013-06-06.",http://www.caledoniawi.com/default.aspx
calhouncotx.org,,,,County,,Texas,"Calhoun County, TX -- Note added 3/4/15 6:19 Domain first added 2013-06-06. Domain first added 2013-06-06.",http://www.calhouncotx.org/
calhouncounty.org,,,,County,,Alabama,"Calhoun County, AL -- Note added 6/12/13 17:21 Domain first added 2013-06-06. Domain first added 2013-06-06.",http://calhouncounty.org/
calhum.org,,,,State,,California,"California Humanities is an independent non-profit partner of the National Endowment for the Humanities,  nthat promotes the humanities in California in order to help create &ldquo;a state of open mind.' -- Note added 3/10/15 15:07 Domain first added 2013-06-06. Domain first added 2013-06-06.",http://calhum.org
californiacareers.info,,,,Local,,California,CA Dept of Education program -- Note added 3/5/15 21:13 Domain first added 2013-06-06. Domain first added 2013-06-06.,http://californiacareers.info/
californiacity.com,,,,Local,,California,municipal website -- Note added 3/5/15 21:30 Domain first added 2013-06-06. Domain first added 2013-06-06.,http://californiacity.com/
californiamuseum.org,,,,Local,,California,"California Museum in Sacramento, CA -- Note added 3/9/15 19:54 Domain first added 2013-06-06. Domain first added 2013-06-06.",http://www.californiamuseum.org
californiasbdc.org,,,,Local,,California,"Provides business guidance & tools for small businesses, and is funded partilly by federal SBA. -- Note added 3/10/15 15:22 Domain first added 2013-06-06. Domain first added 2013-06-06.",http://californiasbdc.org/
californiasciencecenter.org,,,,Local,,California,California Science Center Museum -- Note added 3/9/15 20:01 Domain first added 2013-06-06. Domain first added 2013-06-06.,http://californiasciencecenter.org/
californiavolunteers.org,,,,State,,California,"CaliforniaVolunteers, the state office that manages programs and initiatives aimed at increasing the number of Californians engaged in service and volunteering -- Note added 11/22/13 14:11 Domain first added 2013-06-06. Domain first added 2013-06-06.",http://www.californiavolunteers.org/
calipatria.com,,,,Local,,California,Calipatria municipal website -- Note added 3/5/15 22:08 Domain first added 2013-06-06. Domain first added 2013-06-06.,http://www.calipatria.com
calmaria.com,,,,Local,,Iowa,"Calmar, Ia -- Note added 8/25/15 20:02 Domain first added 2013-06-06. Domain first added 2013-06-06.",http://www.calmaria.com/
calntownship.org,,,,Local,,Pennsylvania,"Caln Township, PA -- Note added 7/1/14 19:01 Domain first added 2013-06-06. Domain first added 2013-06-06.",http://www.calntownship.org/
calottery.com,,,,Local,,California,California lottery -- Note added 6/12/13 14:05 Domain first added 2013-06-06. Domain first added 2013-06-06.,#N/A
calsilc.org,,,,State,,California,CA State Independent Living Counsel advocates for persons with disabilities to enable them to live independently. n  -- Note added 3/5/15 22:35 Domain first added 2013-06-06. Domain first added 2013-06-06.,http://calsilc.org/
calstrs.com,,,,State,,California,California State Teachers Retirement System -- Note added 3/9/15 15:17 Domain first added 2013-06-06. Domain first added 2013-06-06.,http://www.calstrs.com/
calvin-coolidge.org,,,,Quasigovernmental,,,"Calvin Coolidge Memorial Foundation, Inc. (CCMF) was established in 1960 as a non-profit educational organization. Since there is no presidential library for Calvin Coolidge, our 30th U.S. President, we develop materials and programs to present and preserve his legacy. -- Note added 6/14/13 18:45 Domain first added 2013-06-06. Domain first added 2013-06-06.",#N/A
cambridgeoh.org,,,,Local,,Ohio,"City of Cambridge, OH -- Note added 3/11/14 14:34 Domain first added 2013-06-06. Domain first added 2013-06-06.",http://www.cambridgeoh.org/
camdencounty.com,,,,County,,New Jersey,"camden county, nj -- Note added 9/15/15 19:09 Domain first added 2013-06-06. Domain first added 2013-06-06.",http://www.camdencounty.com/
camdentoncity.com,,,,Local,,Missouri,"City of Camdenton, MO -- Note added 9/24/15 14:23 Domain first added 2013-06-06. Domain first added 2013-06-06.",http://camdentoncity.com/
camdentownshipmn.com,,,,Local,,Minnesota,"Camden Township, MN -- Note added 3/24/15 2:10 Domain first added 2013-06-06. Domain first added 2013-06-06.",http://www.camdentownshipmn.com/Home.php
cameron-mo.com,,,,Local,,Missouri,"City of Cameron, MO. -- Note added 9/24/15 14:26 Domain first added 2013-06-06. Domain first added 2013-06-06.",http://cameron-mo.com/
cameronmo.com,,,,Local,,Missouri,"City of Cameron, MO -- Note added 6/6/13 18:09 Domain first added 2013-06-06. Domain first added 2013-06-06.",http://cameronmo.com/
cameronpark.org,,,,Local,,California,"Cameron Community Park Service District which supports recreational nprograms, park facilities, fire & emergency services and administrative services. -- Note added 3/9/15 15:50 Domain first added 2013-06-06. Domain first added 2013-06-06.",http://www.cameronpark.org
campbellcountyky.org,,,,County,,Kentucky,"Campbell County, KY -- Note added 3/20/14 17:44 Domain first added 2013-06-06. Domain first added 2013-06-06.",http://campbellcountyky.org/
campbellsport.govoffice.com,,,,Local,,Wisconsin,"Village of Campbellsport, WI -- Note added 3/20/14 17:45 Domain first added 2013-06-06. Domain first added 2013-06-06.",http://www.campbellsport.govoffice.com/
campbellsville.com,,,,Local,,Kentucky,"campbellsville, Ky -- Note added 8/27/15 16:13 Domain first added 2013-06-06. Domain first added 2013-06-06.",http://www.campbellsville.com/
camphillborough.com,,,,Local,,Pennsylvania,"Borough of Camp Hill, PA -- Note added 7/1/14 19:06 Domain first added 2013-06-06. Domain first added 2013-06-06.",http://www.camphillborough.com
camptonnh.org,,,,Local,,New Hampshire,"Town of Campton, NH -¬†http://www.camptonnh.org/nh/ -- Note added 7/5/13 18:02 Domain first added 2013-06-06. Domain first added 2013-06-06.",http://www.camptonnh.org/nh/
camptontownship.com,,,,Local,,Illinois,"Campton Township, IL -- Note added 7/1/14 19:20 Domain first added 2013-06-06. Domain first added 2013-06-06.",http://camptontownship.com/
canaannewyork.org,,,,Local,,New York,"Town of Canaan, NY -- Note added 6/17/15 16:48 Domain first added 2013-06-06. Domain first added 2013-06-06.",http://canaannewyork.org/
canadiancounty.org,,,,County,,Oklahoma,"Canadian County, OK -- Note added 8/2/13 14:58 Domain first added 2013-06-06. Domain first added 2013-06-06.",http://canadiancounty.org/
canalwinchester.org,,,,Local,,Ohio,"City of Canal Winchester, OH -- Note added 3/11/14 14:35 Domain first added 2013-06-06. Domain first added 2013-06-06.",http://canalwinchester.org/
canby.govoffice.com,,,,Local,,Minnesota,"City of Canby, MN -- Note added 3/20/14 17:45 Domain first added 2013-06-06. Domain first added 2013-06-06.",http://www.canby.govoffice.com/
candianh.org,,,,Local,,New Hampshire,"candia, nh -- Note added 8/28/15 18:41 Domain first added 2013-06-06. Domain first added 2013-06-06.",http://candianh.org/
candond.com/city_government,,,,Local,,North Dakota,"City of Cando, ND -- Note added 7/19/13 12:53 Domain first added 2013-06-06. Domain first added 2013-06-06.",http://www.candond.com/city_government/city_government.htm
canistotasd.com,,,,Local,,South Dakota,"City of Canistota, SD n  -- Note added 7/17/14 5:14 Domain first added 2013-06-06. Domain first added 2013-06-06.",http://www.canistotasd.com/
cannontwp.org,,,,Local,,Michigan,"cannon township, mi -- Note added 9/2/15 20:27 Domain first added 2013-06-06. Domain first added 2013-06-06.",http://cannontwp.org/
canosiatownship.qwestoffice.net,,,,Local,,Minnesota,"Canosia Township, MN -- Note added 3/24/15 2:12 Domain first added 2013-06-06. Domain first added 2013-06-06.",http://www.canosiatownship.qwestoffice.net/index.html
canterbury-nh.org,,,,Local,,New Hampshire,"canterbury, nh -- Note added 8/28/15 18:41 Domain first added 2013-06-06. Domain first added 2013-06-06.",http://canterbury-nh.org/Pages/index
canton-georgia.com,,,,Local,,Georgia,"City of Canton, Ga -- Note added 8/25/15 14:22 Domain first added 2013-06-06. Domain first added 2013-06-06.",http://canton-georgia.com/
canton-mi.org,,,,Local,,Michigan,"canton, mi -- Note added 9/2/15 20:27 Domain first added 2013-06-06. Domain first added 2013-06-06.",http://canton-mi.org/
cantonms.net,,,,Local,,,Canton Mississippi's Economic Development -- Note added 1/17/14 17:35 Domain first added 2014-01-17. Domain first added 2014-01-17.,#N/A
cantonnc.com,,,,Local,,North Carolina,"canton, nc -- Note added 9/11/15 18:56 Domain first added 2013-06-06. Domain first added 2013-06-06.",http://cantonnc.com/
cantonsd.org,,,,Local,,South Dakota,"City of Canton, SD -- Note added 7/31/13 18:34 Domain first added 2013-06-06. Domain first added 2013-06-06.",http://www.cantonsd.org/
canyon-tx.com,,,,Local,,Texas,"City of Canyon, TX -- Note added 3/4/15 6:39 Domain first added 2013-06-06. Domain first added 2013-06-06.",http://canyon-tx.com/
canyonco.org,,,,County,,Idaho,"Canyon County, ID -- Note added 7/5/13 18:28 Domain first added 2013-06-06. Domain first added 2013-06-06.",http://canyonco.org/
canyontx.com,,,,Local,,Texas,"City of Canyon, TX -- Note added 6/6/13 18:09 Domain first added 2013-06-06. Domain first added 2013-06-06.",http://canyontx.com/
capecharles.org,,,,Local,,Virginia,"Town of Cape Charles, VA -- Note added 5/30/14 13:50 Domain first added 2013-06-06. Domain first added 2013-06-06.",http://capecharles.org/
capecodcommission.org,,,,Local,,Massachusetts,"Cape Cod Commission, MA -- Note added 8/26/15 15:43 Domain first added 2013-06-06. Domain first added 2013-06-06.",http://www.capecodcommission.org/
capecoral.net,,,,Local,,Florida,"Cape Coral, FL -- Note added 6/16/15 14:12 Domain first added 2013-06-06. Domain first added 2013-06-06.",http://capecoral.net/
capeelizabeth.com,,,,Local,,Maine,"cape elizabeth, me -- Note added 8/27/15 18:04 Domain first added 2013-06-06. Domain first added 2013-06-06.",http://capeelizabeth.com/
capemaycity.com,,,,Local,,New Jersey,"City of Cape May, NJ -- Note added 9/15/15 19:10 Domain first added 2013-06-06. Domain first added 2013-06-06.",http://capemaycity.com/
capitol.org,,,,State,,Nebraska,Nebraska State Capitol -- Note added 12/6/13 19:48 Domain first added 2013-12-06. Domain first added 2013-12-06.,http://capitol.org/
capitolheightsmd.com,,,,Local,,Maryland,"Town of Capitol Heights, MD -- Note added 3/20/14 17:47 Domain first added 2013-06-06. Domain first added 2013-06-06.",http://capitolheightsmd.com/
capmembers.com,,,,Federal,,,"Civil Air Patrol, US Air Force Auxiliary ¬† -- Note added 6/14/13 18:46 Domain first added 2013-06-06. Domain first added 2013-06-06.",#N/A
cappo.org,,,,Local,,California,Professional organization of California Association of Public Procurement Professionals -- Note added 3/9/15 15:56 Domain first added 2013-06-06. Domain first added 2013-06-06.,#N/A
carboncounty.com,,,,County,,Pennsylvania,"Carbon County, PA -- Note added 7/1/14 19:17 Domain first added 2013-06-06. Domain first added 2013-06-06.",http://carboncounty.com/cc_home.asp
carbonwy.com,,,,County,,Wyoming,"Carbon County, WY -- Note added 6/6/13 18:09 Domain first added 2013-06-06. Domain first added 2013-06-06.",http://carbonwy.com/
careerinfonet.org,,,,Federal,,,An American Job Center partner. CareerInfoNet.org lists the Occupational Profiles on CareerOneStop.org. -- Note added 6/6/13 18:08 Domain first added 2013-06-06. Domain first added 2013-06-06.,#N/A
careeronestop.org,,,,Federal,,,"CareerOneStop is sponsored by the U. S. Department of Labor,¬†Employment and Training Administration -- Note added 6/6/13 18:08 Domain first added 2013-06-06. Domain first added 2013-06-06.",#N/A
carefree.org,,,,Local,,Arizona,"Town of Carefree, AZ -- Note added 12/11/13 13:52 Domain first added 2013-06-06. Domain first added 2013-06-06.",http://www.carefree.org/
carencro.org,,,,Local,,Louisiana,"Carencro, LA -- Note added 8/24/15 14:16 Domain first added 2013-06-06. Domain first added 2013-06-06.",http://carencro.org/
cariboucounty.us,,,,County,,Idaho,"Caribou County, ID -- Note added 7/5/13 18:54 Domain first added 2013-06-06. Domain first added 2013-06-06.",http://www.cariboucounty.us/
cariboumaine.org,,,,Local,,Maine,"City of Caribou, ME -- Note added 3/20/14 17:48 Domain first added 2013-06-06. Domain first added 2013-06-06.",http://cariboumaine.org/
carlislear.org,,,,Local,,Arkansas,"City of Carlisle, AR -- Note added 7/17/13 17:22 Domain first added 2013-06-06. Domain first added 2013-06-06.",http://carlislear.org/
carlislepa.org,,,,Local,,Pennsylvania,"Borough of Carlisle, PA -- Note added 7/1/14 19:21 Domain first added 2013-06-06. Domain first added 2013-06-06.",http://www.carlislepa.org
carljunction.org,,,,Local,,Missouri,"City of Carl Junction, MO. -- Note added 9/24/15 14:31 Domain first added 2013-06-06. Domain first added 2013-06-06.",http://carljunction.org/
carlostownship.org,,,,Local,,Minnesota,"Carlos Township, MN -- Note added 3/24/15 2:14 Domain first added 2013-06-06. Domain first added 2013-06-06.",http://carlostownship.org/
carlstadtnj.us,,,,Local,,New Jersey,"Borough of Carlstadt, NJ -- Note added 9/15/15 19:11 Domain first added 2013-06-06. Domain first added 2013-06-06.",http://www.carlstadtnj.us/
carmelny.org,,,,Local,,New York,"Town of Carmel, NY -- Note added 7/25/13 17:41 Domain first added 2013-06-06. Domain first added 2013-06-06.",http://www.ci.carmel.ny.us/
carmichaelpark.com,,,,Local,,California,"Carmichael Recreation and Park District highlights parks & recreational nopportunities in Carmichael, CA. -- Note added 3/9/15 16:12 Domain first added 2013-06-06. Domain first added 2013-06-06.",#N/A
carnegieborough.com,,,,Local,,Pennsylvania," Borough of Carnegie, PA -- Note added 7/1/14 19:23 Domain first added 2013-06-06. Domain first added 2013-06-06.",http://carnegieborough.com/
carocity.net,,,,Local,,Michigan,"caro city, mi -- Note added 9/2/15 20:27 Domain first added 2013-06-06. Domain first added 2013-06-06.",http://www.carocity.net/
carogalakeny.com,,,,Local,,New York,"Town of Caroga Lake, NY -- Note added 6/17/15 16:51 Domain first added 2013-06-06. Domain first added 2013-06-06.",http://carogalakeny.com/
carolinabeach.org,,,,Local,,North Carolina,"carolina beach, nc -- Note added 9/11/15 18:57 Domain first added 2013-06-06. Domain first added 2013-06-06.",http://carolinabeach.org/
carolinemd.org,,,,County,,Maryland,"Caroline County, MD -- Note added 5/27/14 1:20 Domain first added 2013-06-06. Domain first added 2013-06-06.",http://www.carolinemd.org
carolstream.org,,,,Local,,Illinois,"Village of Carol Stream, IL -- Note added 7/1/14 19:23 Domain first added 2013-06-06. Domain first added 2013-06-06.",http://carolstream.org/
carpinteria.ca.us,,,,Local,,California,City of Carpenteria website. Also accessed via nci.carpinteria.ca.us address. n  -- Note added 3/10/15 22:23 Domain first added 2013-06-06. Domain first added 2013-06-06.,http://carpinteria.ca.us/
carr.org,,,,County,,Maryland,"Carroll County, MD -- Note added 7/25/13 17:42 Domain first added 2013-06-06. Domain first added 2013-06-06.",http://ccgovernment.carr.org/ccg/default.asp
carr.org/~unionbr,,,,Local,,Maryland,"Town of Union Bridge, MD -- Note added 7/25/13 17:43 Domain first added 2013-07-25. Domain first added 2013-07-25.",http://www.carr.org/~unionbr/
carrabassettvalley.org,,,,Local,,Maine,"carrabassett valley, me -- Note added 8/27/15 18:05 Domain first added 2013-06-06. Domain first added 2013-06-06.",http://carrabassettvalley.org/
carringtonnd.com,,,,Local,,North Dakota,"City of Carrington, ND -- Note added 7/19/13 12:55 Domain first added 2013-06-06. Domain first added 2013-06-06.",http://www.carringtonnd.com/
carrollcountyga.com,,,,County,,Georgia,"Carroll County, Ga -- Note added 8/25/15 14:22 Domain first added 2013-06-06. Domain first added 2013-06-06.",http://carrollcountyga.com/
carrollcountyohio.net,,,,County,,Ohio,"Carroll County, OH -- Note added 3/11/14 14:36 Domain first added 2013-06-06. Domain first added 2013-06-06.",http://carrollcountyohio.net/
carrollcountyva.org,,,,County,,Virginia,"Carroll County, VA -- Note added 5/30/14 13:52 Domain first added 2013-06-06. Domain first added 2013-06-06.",http://carrollcountyva.org
carrolltonky.net,,,,Local,,Kentucky,"carrollton, ky -- Note added 8/27/15 16:13 Domain first added 2013-06-06. Domain first added 2013-06-06.",http://www.carrolltonky.net/
carrolltown.pa.us,,,,Local,,Pennsylvania,"Borough of Carrolltown, PA -- Note added 7/1/14 19:26 Domain first added 2013-06-06. Domain first added 2013-06-06.",http://carrolltown.pa.us/
carrollvalley.org,,,,Local,,Pennsylvania,"Borough of Carroll Valley, PA -- Note added 7/1/14 19:28 Domain first added 2013-06-06. Domain first added 2013-06-06.",http://carrollvalley.org/
carsonia.com,,,,Local,,Iowa,"City of Carson, Ia -- Note added 8/25/15 20:03 Domain first added 2013-06-06. Domain first added 2013-06-06.",http://carsonia.com/
cartercountymt.info,,,,County,,Montana,"Carter County, MT -- Note added 11/22/13 12:40 Domain first added 2013-06-06. Domain first added 2013-06-06.",http://cartercountymt.info/
carteretcountygov.org,,,,County,,North Carolina,"carteret county, nc -- Note added 9/11/15 18:57 Domain first added 2013-06-06. Domain first added 2013-06-06.",http://www.carteretcountync.gov/
carthagetexas.com,,,,Local,,Texas,"City of Carthage, TX -- Note added 3/4/15 6:41 Domain first added 2013-06-06. Domain first added 2013-06-06.",http://carthagetexas.us/
caruthersvillecity.com,,,,Local,,Missouri,"City of Caruthersville, MO. -- Note added 9/24/15 14:35 Domain first added 2013-06-06. Domain first added 2013-06-06.",http://caruthersvillecity.com/
carverma.org,,,,Local,,Massachusetts,"Carver, Ma -- Note added 8/26/15 15:44 Domain first added 2013-06-06. Domain first added 2013-06-06.",http://carverma.org/
caryillinois.com,,,,Local,,Illinois,"Village of Cary, IL -- Note added 7/1/14 19:23 Domain first added 2013-06-06. Domain first added 2013-06-06.",http://caryillinois.com/
cascade-locks.or.us,,,,Local,,Oregon,"City of Cascade Locks, OR -- Note added 6/13/14 6:14 Domain first added 2013-06-06. Domain first added 2013-06-06.",http://www.cascade-locks.or.us/
cascadetwp.com,,,,Local,,Michigan,"cascade township, mi -- Note added 9/2/15 20:28 Domain first added 2013-06-06. Domain first added 2013-06-06.",http://cascadetwp.com/
cascomaine.org,,,,Local,,Maine,"casco, me -- Note added 8/27/15 18:05 Domain first added 2013-06-06. Domain first added 2013-06-06.",http://cascomaine.org/
cascostclair.org,,,,Local,,Michigan,"casco township, mi -- Note added 9/2/15 20:28 Domain first added 2013-06-06. Domain first added 2013-06-06.",http://www.cascostclair.com/
casscounty.com,,,,County,,Missouri,Cass County of Missouri -- Note added 9/24/15 15:09 Domain first added 2013-06-06. Domain first added 2013-06-06.,http://casscounty.com/
casscountymi.org,,,,County,,Michigan,"CAss county, Mi -- Note added 9/2/15 20:28 Domain first added 2013-06-06. Domain first added 2013-06-06.",http://casscountymi.org/
casselberry.org,,,,Local,,Florida,"The City of Casselberry, FL -- Note added 6/16/15 14:13 Domain first added 2013-06-06. Domain first added 2013-06-06.",http://casselberry.org/
casselton.com/city,,,,Local,,North Dakota,"City of Casselton, ND -- Note added 7/18/14 5:27 Domain first added 2013-06-06. Domain first added 2013-06-06.",http://casselton.com/city
cassiacounty.org,,,,County,,Idaho,"Cassia County, ID -- Note added 7/5/13 18:28 Domain first added 2013-06-06. Domain first added 2013-06-06.",http://cassiacounty.org/
cassne.org,,,,County,,Nebraska,"Cass County, NE -- Note added 12/6/13 18:50 Domain first added 2013-06-06. Domain first added 2013-06-06.",http://www.cassne.org/
castileny.com,,,,Local,,New York,"Town and Village of Castile, NY -- Note added 6/17/15 16:53 Domain first added 2013-06-06. Domain first added 2013-06-06.",http://castileny.com/
castlerocktownship.com,,,,Local,,Minnesota,"Castle Rock Township, MN -- Note added 3/24/15 2:16 Domain first added 2013-06-06. Domain first added 2013-06-06.",http://www.castlerocktownship.com/
castletonvermont.org,,,,Local,,Vermont,"Town of Castleton, VT -- Note added 8/18/14 6:00 Domain first added 2013-06-06. Domain first added 2013-06-06.",http://castletonvermont.org/
castlewoodcity.com,,,,Local,,South Dakota,"City of Castlewood, SD -- Note added 7/17/14 5:15 Domain first added 2013-06-06. Domain first added 2013-06-06.",http://www.castlewoodcity.com/
caswellbeach.org,,,,Local,,North Carolina,"caswell beach, nc -- Note added 9/11/15 18:58 Domain first added 2013-06-06. Domain first added 2013-06-06.",http://caswellbeach.org/
caswellcenter.org,,,,State,,North Carolina,"Caswell Developmental Center, NC Division of State Operated Healthcare Facilities -- Note added 6/6/13 18:08 Domain first added 2013-06-06. Domain first added 2013-06-06.",#N/A
catawbaindian.net,,,,Local,,South Carolina,"Catawba Indian Nation (Rock Hill, SC) -- Note added 7/25/13 18:25 Domain first added 2013-06-06. Domain first added 2013-06-06.",http://catawbaindian.net/
catoosa.com,,,,County,,Georgia,"Catoosa County, Ga -- Note added 8/25/15 14:23 Domain first added 2013-06-06. Domain first added 2013-06-06.",http://catoosa.com/
catroncounty.us,,,,County,,New Mexico,"Catron County, NM -- Note added 7/16/14 5:26 Domain first added 2013-06-06. Domain first added 2013-06-06.",http://www.catroncounty.us/
cattaraugusny.org,,,,Local,,New York,"Town of New Albion/ Village of Cattaraugus, NY -- Note added 6/17/15 16:57 Domain first added 2013-06-06. Domain first added 2013-06-06.",http://cattaraugusny.org/
cattco.org,,,,County,,New York,"Cattaraugus County, NY -- Note added 7/31/13 18:55 Domain first added 2013-06-06. Domain first added 2013-06-06.",http://cattco.org/
cavaliercounty.us,,,,County,,North Dakota,"Cavalier County, ND -- Note added 7/18/14 5:28 Domain first added 2013-06-06. Domain first added 2013-06-06.",http://www.cavaliercounty.us/
cavaliernd.com,,,,Local,,North Dakota,"City of Cavalier, ND -- Note added 7/18/14 5:29 Domain first added 2013-06-06. Domain first added 2013-06-06.",http://www.cavaliernd.com/
cavecreek.org,,,,Local,,Arizona,"Town of Cave Creek, AZ -- Note added 12/11/13 13:53 Domain first added 2013-06-06. Domain first added 2013-06-06.",http://www.cavecreek.org/
cawh.org,,,,Local,,Washington,"City of Airway Heights, WA -- Note added 9/12/14 5:27 Domain first added 2013-06-06. Domain first added 2013-06-06.",http://cawh.org/
cayuga-heights.ny.us,,,,Local,,New York,"Village of Cayuga Heights, NY -- Note added 6/17/15 17:00 Domain first added 2013-06-06. Domain first added 2013-06-06.",http://cayuga-heights.ny.us/
cayugacounty.us,,,,County,,New York,"Cayuga County, NY -- Note added 12/6/13 14:13 Domain first added 2013-06-06. Domain first added 2013-06-06.",http://www.cayugacounty.us/
cbacfc.org,Combined Federal Campaign,,,Federal,,West Virginia,Chesapeake Bay Area Combined Federal Campaign (CBACFC) -- Note added 3/31/14 13:04 Domain first added 2013-06-06. Domain first added 2013-06-06.,http://www.cbacfc.org/
cbp-ntep.info,,,,Federal,,,"National Training Evaluation Program, Customs and Border Patrol, Department of Homeland Security -- Note added 6/14/13 18:49 Domain first added 2013-06-06. Domain first added 2013-06-06.",#N/A
cce.cornell.edu,,,,Local,,New York,Cornell University (NY) Cooperative Extension -- Note added 6/17/15 17:03 Domain first added 2013-06-06. Domain first added 2013-06-06.,http://cce.cornell.edu/Pages/Default.aspx
ccgov.net,,,,County,,Wyoming,"Campbell County, WY -- Note added 11/20/13 20:18 Domain first added 2013-06-06. Domain first added 2013-06-06.",http://www.ccgov.net/
ccgov.org,,,,County,,Maryland,"Cecil County, MD -- Note added 5/27/14 1:23 Domain first added 2013-06-06. Domain first added 2013-06-06.",http://www.ccgov.org/
ccitoolsforfeds.org,,,,Federal,,,Comprehensive Community Initiatives Tools for Federal Staff -- Note added 1/10/14 19:17 Domain first added 2014-01-10. Domain first added 2014-01-10.,http://ccitoolsforfeds.org/
ccok.us,,,,County,,Oklahoma,"Cleveland County, OK -- Note added 8/2/13 14:59 Domain first added 2013-08-02. Domain first added 2013-08-02.",http://www.clevelandcountyok.com/
ccpa.net,,,,County,,Pennsylvania,"Cumberland County, PA -- Note added 7/1/14 19:30 Domain first added 2013-06-06. Domain first added 2013-06-06.",http://ccpa.net/
ccrpa.org,,,,Regional,,Connecticut,Central Connecticut Regional Planning Agency -- Note added 12/15/14 6:18 Domain first added 2013-06-06. Domain first added 2013-06-06.,http://ccrpa.org/
ccsinventory.wilsoncenter.org,,,,Quasigovernmental,,,"Federal Crowdsourcing and Citizen Science Catalog In 2014, the Commons Lab at the Woodrow Wilson International Center for Scholars (The Wilson Center) began compiling a database of Federal Citizen Science and Crowdsourcing projects in collaboration with the Federal Community of Practice for Crowdsourcing and Citizen Science (CCS) and OSTP. -- Note added 7/12/16 16:48 Domain first added 2016-07-12. Domain first added 2016-07-12.",https://ccsinventory.wilsoncenter.org/
cctexas.com,,,,Local,,Texas,"City of Corpus Christi, TX -- Note added 3/4/15 6:42 Domain first added 2013-06-06. Domain first added 2013-06-06.",http://cctexas.com/
ccvillage.org,,,,Local,,Maryland,"Chevy Chase Village, MD -- Note added 5/27/14 1:25 Domain first added 2013-06-06. Domain first added 2013-06-06.",http://www.ccvillage.org/
cdaid.org,,,,Local,,Idaho,"City of Coeur d'Alene, ID -- Note added 7/5/13 18:29 Domain first added 2013-06-06. Domain first added 2013-06-06.",http://cdaid.org/
cdcnpin.org,,,,Federal,,,National Prevention Information Network from the CDC -- Note added 1/10/14 19:17 Domain first added 2014-01-10. Domain first added 2014-01-10.,http://cdcnpin.org/
cdrpc.org,,,,Regional,,New York,Capital District Regional Planning Commission (NY) -- Note added 6/17/15 17:05 Domain first added 2013-06-06. Domain first added 2013-06-06.,http://cdrpc.org/
cdse.edu,,,,Federal,,,"Center for Development of Security Excellence, Defense Security Service, Department of Defense -- Note added 6/14/13 18:49 Domain first added 2013-06-06. Domain first added 2013-06-06.",http://cdse.edu/
cedar-rapids.org,,,,Local,,Iowa,"Cedar Rapides, IA -- Note added 8/25/15 20:03 Domain first added 2013-06-06. Domain first added 2013-06-06.",http://cedar-rapids.org/Pages/home.aspx
cedarbluff-al.org,,,,Local,,Alabama,"Town of Cedar Bluff, AL -- Note added 6/12/13 17:22 Domain first added 2013-06-06. Domain first added 2013-06-06.",http://cedarbluff-al.org/
cedarcity.org,,,,Local,,Utah,"Cedar City, UT -- Note added 8/19/14 5:02 Domain first added 2013-06-06. Domain first added 2013-06-06.",http://cedarcity.org/
cedarcreeknebraska.com,,,,Local,,Nebraska,"Village of Cedar Creek, NE -- Note added 12/6/13 18:51 Domain first added 2013-06-06. Domain first added 2013-06-06.",http://cedarcreeknebraska.com/
cedaredgecolorado.com,,,,Local,,Colorado,"Town of Cedaredge, CO -- Note added 1/14/14 15:01 Domain first added 2013-06-06. Domain first added 2013-06-06.",http://cedaredgecolorado.com/
cedargrovenj.org,,,,Local,,New Jersey,"cedar grove, nj -- Note added 9/15/15 19:12 Domain first added 2013-06-06. Domain first added 2013-06-06.",http://www.cedargrovenj.org/site/
cedarhills.org,,,,Local,,Utah,"City of Cedar Hills, UT -- Note added 8/19/14 5:04 Domain first added 2013-06-06. Domain first added 2013-06-06.",http://www.cedarhills.org/
cedarhilltx.com,,,,Local,,Texas,"City of Cedar Hill, TX -- Note added 3/4/15 6:44 Domain first added 2013-06-06. Domain first added 2013-06-06.",http://www.cedarhilltx.com/
cedarparktx.us,,,,Local,,Texas,"City of Cedar Park, TX -- Note added 3/4/15 6:45 Domain first added 2013-06-06. Domain first added 2013-06-06.",http://cedarparktx.us/
cehtp.org,,,,State,,California,"California Environmental Health Tracking Program, California Department of Public Health -- Note added 10/24/14 12:09 Domain first added 2014-10-24. Domain first added 2014-10-24.",http://cehtp.org/project.jsp?project_key=EHSS01
celebratedouglascounty.com,,,,County,,Georgia,"Douglas County, Ga -- Note added 8/25/15 14:24 Domain first added 2013-06-06. Domain first added 2013-06-06.",http://www.celebratedouglascounty.com/
centerharbornh.org,,,,Local,,New Hampshire,"Town of Center Harbor, NH -- Note added 3/20/14 17:55 Domain first added 2013-06-06. Domain first added 2013-06-06.",http://centerharbornh.org/
centernd.net,,,,Local,,North Dakota,"City of Center, ND -- Note added 7/18/14 5:30 Domain first added 2013-06-06. Domain first added 2013-06-06.",http://www.centernd.net/
centertownshiptrustee.com,,,,Local,,Indiana,"Center Township Trustee, In  and Delaware County, In -- Note added 8/27/15 14:17 Domain first added 2013-06-06. Domain first added 2013-06-06.",http://centertownshiptrustee.com/
centertwp.netfirms.com,,,,Local,,Pennsylvania,"Center Township, PA -- Note added 1/14/14 14:22 Domain first added 2013-06-06. Domain first added 2013-06-06.",http://centertwp.netfirms.com/
centervillega.org,,,,Local,,Georgia,"Centerville, Ga -- Note added 8/25/15 14:24 Domain first added 2013-06-06. Domain first added 2013-06-06.",http://www.centervillega.org/
centervillemn.com,,,,Local,,Minnesota,"City of Centerville, MN -- Note added 3/24/15 2:18 Domain first added 2013-06-06. Domain first added 2013-06-06.",http://www.centervillemn.com/
centervilleut.net,,,,Local,,Utah,"Centerville City, UT -- Note added 3/20/14 17:55 Domain first added 2013-06-06. Domain first added 2013-06-06.",http://www.centervilleut.net/
centralcaliforniacfc.org,Combined Federal Campaign,,,Federal,,California,Central Califoria Combined Federal Compaign -- Note added 3/9/15 16:55 Domain first added 2013-06-06. Domain first added 2013-06-06.,http://www.centralcaliforniacfc.org
centralfallsri.us,,,,Local,,Rhode Island,"City of Central Falls, RI -- Note added 6/7/13 18:31 Domain first added 2013-06-06. Domain first added 2013-06-06.",http://www.centralfallsri.us/
centraliamo.org,,,,Local,,Missouri,"City of Centralia, MO. -- Note added 9/24/15 15:22 Domain first added 2013-06-06. Domain first added 2013-06-06.",http://centraliamo.org/
centralina.org,,,,Local,,North Carolina,"Centralina Council of Governments, General Assembly of North Carolina -- Note added 6/6/13 18:08 Domain first added 2013-06-06. Domain first added 2013-06-06.",#N/A
centralmidlands.org,,,,Local,,South Carolina,Central Midlands Council of Governments  -- Note added 8/28/15 13:20 Domain first added 2013-06-06. Domain first added 2013-06-06.,http://centralmidlands.org/
centralpacfc.org,Combined Federal Campaign,,,Federal,,Pennsylvania,Combined Federal Campaign of Central Pennsylvania -- Note added 7/1/14 19:38 Domain first added 2013-06-06. Domain first added 2013-06-06.,http://www.centralpacfc.org/
centraltexascfc.org,Combined Federal Campaign,,,Federal,,Texas,Central Texas Combined Federal Campaign -- Note added 3/4/15 6:46 Domain first added 2013-06-06. Domain first added 2013-06-06.,http://centraltexascfc.org/wp/
centralwashingtoncfc.us,Combined Federal Campaign,,,County,,Washington,Central Washington Combined Federal CampaignServing: Chelan CountyDouglas CountyKittitas CountyYakima County -- Note added 9/12/14 5:29 Domain first added 2013-06-06. Domain first added 2013-06-06.,http://centralwashingtoncfc.us/
cerritos.us,,,,Local,,California,City of Cerritos municipal website -- Note added 3/9/15 17:01 Domain first added 2013-06-06. Domain first added 2013-06-06.,http://www.cerritos.us/
ces.ca.uky.edu/ces,,,,State,,Kentucky,Univ of Kentucky Extension website -- Note added 8/27/15 16:14 Domain first added 2013-06-06. Domain first added 2013-06-06.,http://extension.ca.uky.edu/
cf-cfc.org,Combined Federal Campaign,,,Federal,,Florida,Central Florida - Combined Federal Campaign -- Note added 6/15/15 18:58 Domain first added 2013-06-06. Domain first added 2013-06-06.,http://www.cf-cfc.org/_root/
cfc-centralok.org,Combined Federal Campaign,,,Federal,,Oklahoma,central OK CFC -- Note added 8/28/15 16:28 Domain first added 2013-06-06. Domain first added 2013-06-06.,http://www.cfc-centralok.org/
cfc-hawaii.org,Combined Federal Campaign,,,State,,Northern Mariana Islands,"Hawaii-Pacific Area Combined Federal Campaign - geographic area includes the State of Hawaii, Guam, Northern Marianas Islands, and American Samoa -- Note added 6/12/13 13:14 Domain first added 2013-06-06. Domain first added 2013-06-06.",http://cfc-hawaii.org/
cfcaaga.org,Combined Federal Campaign,,,Federal,,Georgia,Greater Atlanta-Athens Combined Federal Campaign -- Note added 12/6/13 15:10 Domain first added 2013-06-06. Domain first added 2013-06-06.,http://www.cfcaaga.org/_root/
cfcaz.org,Combined Federal Campaign,,,Federal,,California,Arizona Combined Federal Campaign (CFC) -- Note added 12/11/13 13:54 Domain first added 2013-06-06. Domain first added 2013-06-06.,http://cfcaz.org/
cfccoastalga.org,Combined Federal Campaign,,,Federal,,Georgia,Coastal Georgia Combined Federal Campaign -- Note added 8/25/15 14:25 Domain first added 2013-06-06. Domain first added 2013-06-06.,http://www.cfccoastalga.org/_root/
cfcforthood.org,Combined Federal Campaign,,,Federal,,Texas,"Combined Federal Campaign website for the greater Fort Hood, TX area -- Note added 3/4/15 6:47 Domain first added 2013-06-06. Domain first added 2013-06-06.",http://www.cfcforthood.org/
cfcgive.org,Combined Federal Campaign,,,Federal,,Washington,"Combined Federal Campaign of South Puget Sound, WA -- Note added 9/12/14 5:30 Domain first added 2013-06-06. Domain first added 2013-06-06.",http://cfcgive.org/
cfcgno.org,Combined Federal Campaign,,,Federal,,Louisiana,Greater New Orleans Area Combined Federal Campaign -- Note added 8/24/15 15:47 Domain first added 2013-06-06. Domain first added 2013-06-06.,http://www.cfcgno.org/_root/
cfcgreaterarkansas.org,Combined Federal Campaign,,,Federal,,Arkansas,Combined Federal Campaign of Greater Arkansas -- Note added 7/17/13 18:03 Domain first added 2013-06-06. Domain first added 2013-06-06.,http://cfcgreaterarkansas.org/
cfcgreaternc.org,Combined Federal Campaign,,,Federal,,South Carolina,North Carolina CFC -- Note added 8/28/15 13:20 Domain first added 2013-06-06. Domain first added 2013-06-06.,http://www.cfcgreaternc.org/_root/
cfcindiana.org,Combined Federal Campaign,,,Federal,,Indiana,"Indiana, Kentucky, and Southwestern Ohio CFC -- Note added 8/27/15 14:17 Domain first added 2013-06-06. Domain first added 2013-06-06.",http://www.givecfc.org/_root/
cfclincoln.org,Combined Federal Campaign,,,County,,Nebraska,Lincoln and Lancaster County Area Combined Federal Campaign -- Note added 12/6/13 18:52 Domain first added 2013-06-06. Domain first added 2013-06-06.,http://cfclincoln.org/
cfclouisville.org,Combined Federal Campaign,,,State,,Kentucky,"Tristate CFC, Indiana -- Note added 8/27/15 14:19 Domain first added 2013-06-06. Domain first added 2013-06-06.",http://www.givecfc.org/_root/
cfcmaine.org,Combined Federal Campaign,,,Federal,,Maine,Northern NE CFc -- Note added 8/27/15 18:07 Domain first added 2013-06-06. Domain first added 2013-06-06.,http://wp.northernnewenglandcfc.org/
cfcmidsouth.org,Combined Federal Campaign,,,Federal,,Tennessee,Combined Federal Campaign of the Mid-South -- Note added 7/17/13 18:04 Domain first added 2013-06-06. Domain first added 2013-06-06.,http://cfcmidsouth.org/
cfcmontereysantacruz.org,Combined Federal Campaign,,,Federal,,California,Combined Federal Campaign Monterey/Santa Cruz -- Note added 3/9/15 17:53 Domain first added 2013-06-06. Domain first added 2013-06-06.,http://www.cfcmontereysantacruz.org/
cfcnca.org,Combined Federal Campaign,,,Federal,,Virginia,Combined Federal Campaign of the National Capital Area -- Note added 6/7/13 17:35 Domain first added 2013-06-06. Domain first added 2013-06-06.,http://cfcnca.org/
cfcnexus.org,Combined Federal Campaign,,,Federal,,,CFC (Combined Federal Campaign) Nexus -- Note added 10/7/14 12:22 Domain first added 2014-10-07. Domain first added 2014-10-07.,https://www.cfcnexus.org/_root/
cfcnnj.org,Combined Federal Campaign,,,Federal,,New Jersey,Northern New Jersey Combined Federal Campaign ( CFC ) -- Note added 9/22/15 14:08 Domain first added 2013-06-06. Domain first added 2013-06-06.,http://cfcnnj.org/
cfcnorthtexas.org,Combined Federal Campaign,,,Federal,,Texas,North Texas CFC possibly part of OK -- Note added 8/28/15 16:30 Domain first added 2013-06-06. Domain first added 2013-06-06.,http://www.dfwmetroplexcfc.org/_root/
cfcnps.org,Combined Federal Campaign,,,Federal,,Washington,"Combined Federal Campaign of Nort Puget Sound, WA -- Note added 9/12/14 5:32 Domain first added 2013-06-06. Domain first added 2013-06-06.",http://www.cfcnps.org/_root/
cfcofcva.org,Combined Federal Campaign,,,Federal,,Virginia,Central Virginia Area Combined Federal Campaign -- Note added 6/6/14 13:50 Domain first added 2013-06-06. Domain first added 2013-06-06.,http://www.cfcofcva.org/_root/
cfcofgreatersocal.org,Combined Federal Campaign,,,Federal,,California,Combined Federal Campaign of Greater Southern CA -- Note added 3/9/15 17:56 Domain first added 2013-06-06. Domain first added 2013-06-06.,http://www.cfcofgreatersocal.org/_root/
cfcofthecsra.org,Combined Federal Campaign,,,Federal,,South Carolina,Combined Federal Campaign of the Central Savannah River Area -- Note added 8/25/15 14:25 Domain first added 2013-06-06. Domain first added 2013-06-06.,http://www.cfcofthecsra.org/
cfcredrivervalley.org,Combined Federal Campaign,,,Federal,,North Dakota,Combined Federal Campaign of the Red River Valley -- Note added 7/18/14 5:31 Domain first added 2013-06-06. Domain first added 2013-06-06.,http://www.cfcredrivervalley.org/
cfcsanantonio.org,Combined Federal Campaign,,,Federal,,Texas,Combined Federal Campaign Fund website for San Antonio Area -- Note added 3/4/15 6:55 Domain first added 2013-06-06. Domain first added 2013-06-06.,http://www.cfcsanantonio.org/_root/
cfcsemi.org,Combined Federal Campaign,,,Federal,,Michigan,Southeastern Michigan Area CFC   -- Note added 9/2/15 20:29 Domain first added 2013-06-06. Domain first added 2013-06-06.,http://www.cfcsemi.org/_root/
cfcshr.org,Combined Federal Campaign,,,Federal,,Virginia,Combined Federal Campaign of South Hampton Roads (CFCSHR) -- Note added 5/30/14 13:56 Domain first added 2013-06-06. Domain first added 2013-06-06.,http://www.cfcshr.org
cfcsnj.org,Combined Federal Campaign,,,Federal,,Pennsylvania,Eastern Pennsylvania and South Jersey Combined Federal Campaign -- Note added 12/6/13 13:32 Domain first added 2013-06-06. Domain first added 2013-06-06.,http://www.cfcsnj.org/
cfctexasgulfcoast.org,Combined Federal Campaign,,,Federal,,Texas,Combined Federal Campaign website for theTexas Gulf Coast -- Note added 3/4/15 6:57 Domain first added 2013-06-06. Domain first added 2013-06-06.,http://www.cfctexasgulfcoast.org/
cfcvp.org,Combined Federal Campaign,,,Federal,,Virginia,Combined Federal Campaign of the Virginia Peninsula (CFCVP) -- Note added 5/30/14 13:57 Domain first added 2013-06-06. Domain first added 2013-06-06.,http://www.cfcvp.org/
cfcwesternmichigan.org,Combined Federal Campaign,,,Federal,,Michigan,CFC UP-North Michigan Area (CFC Western Michigan has merged with UP-North -- Note added 9/2/15 20:29 Domain first added 2013-06-06. Domain first added 2013-06-06.,http://cfcwesternmichigan.org/
cfcwesternmontana.org,Combined Federal Campaign,,,Federal,,Montana,Combined Federal Campaign (CFC) of Western Montana -- Note added 11/22/13 12:41 Domain first added 2013-06-06. Domain first added 2013-06-06.,http://cfcwesternmontana.org/
cfcwnc.com,Combined Federal Campaign,,,Federal,,North Carolina,West NC CFC -- Note added 9/11/15 19:01 Domain first added 2013-06-06. Domain first added 2013-06-06.,http://cfcwnc.com/
cfe-dmha.org,,,,Federal,,,"Center for Excellence in Disaster Management and Humanitarian Assistance (CFE-DMHA), US Pacific Command, Joint Base Pearl Harbor-Hickam, HI -- Note added 3/20/14 15:12 Domain first added 2014-03-20. Domain first added 2014-03-20.",http://www.cfe-dmha.org/
cfnc.org,,,,State,,North Carolina,"College Foundation of North Carolina, a¬†service of the State¬†of North Carolina -- Note added 7/24/13 16:09 Domain first added 2013-06-06. Domain first added 2013-06-06.",http://www.cfnc.org/index.jsp
cfrpc.org,,,,Regional,,Florida,Central Florida Regional Planning Council -- Note added 6/16/15 14:15 Domain first added 2013-06-06. Domain first added 2013-06-06.,http://www.cfrpc.org/
cga.edu,,,,Federal,,,United States Coast Guard Academy -- Note added 1/23/14 15:30 Domain first added 2014-01-23. Domain first added 2014-01-23.,http://www.cga.edu/
cgaux.org,,,,Federal,,,U.S. Coast Guard Auxiliary -- Note added 6/14/13 18:52 Domain first added 2013-06-06. Domain first added 2013-06-06.,http://cgaux.org/
cge.concursolutions.com,,,,Federal,,,"e-Gov Travel Service, Concur Government Edition (CGE) for the General Services Administration -- Note added 1/13/14 12:01 Domain first added 2014-01-13. Domain first added 2014-01-13.",https://cge.concursolutions.com/
chaffeecounty.org,,,,County,,Colorado,"Chaffee County, CO -- Note added 7/11/14 5:25 Domain first added 2013-06-06. Domain first added 2013-06-06.",http://chaffeecounty.org/
chagrin-falls.org,,,,Local,,Ohio,"Village of Chagrin Falls, OH -- Note added 3/11/14 14:37 Domain first added 2013-06-06. Domain first added 2013-06-06.",http://chagrin-falls.org/
chalfontborough.com,,,,Local,,Pennsylvania,"Borough of Chalfont, PA -- Note added 7/1/14 19:41 Domain first added 2013-06-06. Domain first added 2013-06-06.",http://www.chalfontborough.com/
chambleega.com,,,,Local,,Georgia,"Chamblee, Ga -- Note added 8/25/15 14:26 Domain first added 2013-06-06. Domain first added 2013-06-06.",http://chambleega.com/
chandlerok.com,,,,Local,,Oklahoma,"chandler, ok -- Note added 8/28/15 16:30 Domain first added 2013-06-06. Domain first added 2013-06-06.",http://chandlerok.com/
chandlertx.com,,,,Local,,Texas,"City of Chandler, TX -- Note added 6/6/13 18:09 Domain first added 2013-06-06. Domain first added 2013-06-06.",http://chandlertx.com/
chandra.harvard.edu,,,,Quasigovernmental,,,"Chandra X-ray Center, Operated for NASA by¬†the Smithsonian Astrophysical Observatory.¬†This site was developed with funding from NASA under contract NAS8-03060. -- Note added 6/14/13 18:54 Domain first added 2013-06-06. Domain first added 2013-06-06.",#N/A
channahon.org,,,,Local,,Illinois,"Village of Channahon, IL -- Note added 7/1/14 19:28 Domain first added 2013-06-06. Domain first added 2013-06-06.",http://www.channahon.org/
chanute.org,,,,Local,,Kansas,"City of Chanute, KS -- Note added 6/30/14 6:27 Domain first added 2013-06-06. Domain first added 2013-06-06.",http://chanute.org/
chapinsc.com,,,,Local,,South Carolina,"chapin, sc -- Note added 8/28/15 13:21 Domain first added 2013-06-06. Domain first added 2013-06-06.",http://www.chapinsc.com/
chaplinct.org,,,,Local,,Connecticut,"Town of Chaplin, CT -- Note added 12/15/14 6:18 Domain first added 2013-06-06. Domain first added 2013-06-06.",http://www.chaplinct.org/
chardon.cc,,,,Local,,Ohio,"City of Chardon, OH -- Note added 3/11/14 14:39 Domain first added 2013-06-06. Domain first added 2013-06-06.",http://www.chardon.cc/
charlemont-ma.us,,,,Local,,Massachusetts,"Charlemont, MA -- Note added 8/26/15 15:48 Domain first added 2013-06-06. Domain first added 2013-06-06.",http://charlemont-ma.us/
charlestoncounty.org,,,,County,,South Carolina,"charleston county, sc -- Note added 8/28/15 13:21 Domain first added 2013-06-06. Domain first added 2013-06-06.",http://www.charlestoncounty.org/
charlestonillinois.org,,,,Local,,Illinois,"City of Charleston, IL -- Note added 7/1/14 19:29 Domain first added 2013-06-06. Domain first added 2013-06-06.",http://www.charlestonillinois.org/
charlestonutah.org,,,,Local,,Utah,"Town of Charleston, UT -- Note added 8/19/14 5:05 Domain first added 2013-06-06. Domain first added 2013-06-06.",http://www.charlestonutah.org/
charlestonvt.org,,,,Local,,Vermont,"Charleston, VT -- Note added 8/13/14 5:33 Domain first added 2013-06-06. Domain first added 2013-06-06.",http://charlestonvt.org/
charlestownmd.org,,,,Local,,Maryland,"Charlestown, MD -- Note added 5/27/14 1:26 Domain first added 2013-06-06. Domain first added 2013-06-06.",http://www.charlestownmd.org/
charlestownri.org,,,,Local,,Rhode Island,"Town of Charlestown, RI -- Note added 6/7/13 18:32 Domain first added 2013-06-06. Domain first added 2013-06-06.",http://www.charlestownri.org/
charlevoixcounty.org,,,,County,,Michigan,Charlevoix County -- Note added 9/2/15 20:30 Domain first added 2013-06-06. Domain first added 2013-06-06.,http://charlevoixcounty.org/
charlottesville.org,,,,Local,,Virginia,"City of Charlottesville, VA -- Note added 5/30/14 13:59 Domain first added 2013-06-06. Domain first added 2013-06-06.",http://charlottesville.org/
charlotteva.com,,,,County,,Virginia,"Charlotte County, VA -- Note added 5/30/14 14:02 Domain first added 2013-06-06. Domain first added 2013-06-06.",http://charlotteva.com/
charlottevt.org,,,,Local,,Vermont,"Town of Charlotte, VT -- Note added 8/13/14 5:34 Domain first added 2013-06-06. Domain first added 2013-06-06.",http://www.charlottevt.org/
charmeck.org,,,,Local,,North Carolina,"City of Charlotte and Meckleburg County, NC -- Note added 9/11/15 19:02 Domain first added 2013-06-06. Domain first added 2013-06-06.",http://charmeck.org/Pages/default.aspx
chathamborough.org,,,,Local,,New Jersey,"chatham borough, NJ -- Note added 9/15/15 19:14 Domain first added 2013-06-06. Domain first added 2013-06-06.",http://www.chathamborough.org/chatham/
chathamcounty.org,,,,County,,Georgia,"Chatham County, Ga -- Note added 8/25/15 14:27 Domain first added 2013-06-06. Domain first added 2013-06-06.",http://www.chathamcounty.org/
chathamil.net,,,,Local,,Illinois,"Village of Chatham, IL -- Note added 7/1/14 19:30 Domain first added 2013-06-06. Domain first added 2013-06-06.",https://www.chathamil.net/
chathamnc.org,,,,Local,,North Carolina,"chatham, nc -- Note added 9/11/15 19:03 Domain first added 2013-06-06. Domain first added 2013-06-06.",http://chathamnc.org/
chathamnewyork.us,,,,Local,,New York,"Town of Chatham, NY -- Note added 6/17/15 17:06 Domain first added 2013-06-06. Domain first added 2013-06-06.",http://chathamnewyork.us/
chathamtownship.org,,,,Local,,New Jersey,"chatham township, NJ -- Note added 9/15/15 19:15 Domain first added 2013-06-06. Domain first added 2013-06-06.",http://chathamtownship.org/
chattanoogacfc.org,Combined Federal Campaign,,,Federal,,Tennessee,Greater Chattanooga Area Combined Federal Campaign (CFC) -- Note added 6/23/14 9:39 Domain first added 2013-06-06. Domain first added 2013-06-06.,http://www.chattanoogacfc.org/13/Pages/CFC2013Main.html
chautauqua-ny.com,,,,Local,,New York,"Chautauqua, NY-My WordPress Blog -- Note added 6/17/15 17:10 Domain first added 2013-06-06. Domain first added 2013-06-06.",http://chautauqua-ny.com/
cheboygan.org,,,,Local,,Michigan,"cheboygan, mi -- Note added 9/2/15 20:30 Domain first added 2013-06-06. Domain first added 2013-06-06.",http://cheboygan.org/
cheboygancounty.net,,,,County,,Michigan,"cheboygan county, mi -- Note added 9/2/15 20:31 Domain first added 2013-06-06. Domain first added 2013-06-06.",http://www.cheboygancounty.net/
chelseavt.org,,,,Local,,Vermont,"Town of Chelsea, VT -- Note added 8/13/14 5:35 Domain first added 2013-06-06. Domain first added 2013-06-06.",http://www.chelseavt.org/
cheltenhamtownship.org,,,,Local,,Pennsylvania,"Cheltenham Township, PA -- Note added 7/19/13 17:28 Domain first added 2013-06-06. Domain first added 2013-06-06.",http://cheltenhamtownship.org/
chemcatbio.org,Department of Energy (DOE),,,Federal,,,"ChemCatBio is a U.S. Department of Energy national lab-led research and development consortium dedicated to identifying and overcoming catalysis challenges for the conversion of biomass and waste resources into fuels, chemicals, and materials. From https://www.chemcatbio.org/, retrieved 7/5/19. Domain first added 2019-07-05. Domain first added 2019-07-05.",https://www.chemcatbio.org/
chemehuevi.net,,,,Native Sovereign Nation / Tribal,,California,"Chemehuevi Indian Tribe, Havasu Lake, CA -- Note added 7/19/13 17:32 Domain first added 2013-06-06. Domain first added 2013-06-06.",http://chemehuevi.net/home.php
chemungcounty.com,,,,County,,New York,"Chemung County, NY -- Note added 6/17/15 17:11 Domain first added 2013-06-06. Domain first added 2013-06-06.",http://www.chemungcounty.com/
cheraw.com,,,,Local,,South Carolina,"cheraw, sc -- Note added 8/28/15 13:22 Domain first added 2013-06-06. Domain first added 2013-06-06.",http://cheraw.com/
cherokeega.com,,,,Local,,Georgia,"Cherokega, Ga -- Note added 8/25/15 14:29 Domain first added 2013-06-06. Domain first added 2013-06-06.",http://cherokeega.com/
cherokeeiowa.net,,,,Local,,Iowa,"Cherokee, Ia -- Note added 8/25/15 20:04 Domain first added 2013-06-06. Domain first added 2013-06-06.",http://cherokeeiowa.net/
cherokeevillage.org,,,,Local,,Arkansas,"City of Cherokee Village, AR -- Note added 7/17/13 18:11 Domain first added 2013-06-06. Domain first added 2013-06-06.",http://cherokeevillage.org/
cherryhill-nj.com,,,,Local,,New Jersey,"cherryhill, nj -- Note added 9/15/15 19:15 Domain first added 2013-06-06. Domain first added 2013-06-06.",http://cherryhill-nj.com/
cherryhillsvillage.com,,,,Local,,Colorado,"City of Cherry Hills Village, CO -- Note added 7/11/14 5:27 Domain first added 2013-06-06. Domain first added 2013-06-06.",http://cherryhillsvillage.com/
cherryvalley.org,,,,Local,,Illinois,"Village of Cherry Valley, IL -- Note added 7/1/14 19:30 Domain first added 2013-06-06. Domain first added 2013-06-06.",http://cherryvalley.org/
chesapeake-beach.md.us,,,,Local,,Maryland,"Chesapeake, MD -- Note added 5/27/14 1:28 Domain first added 2013-06-06. Domain first added 2013-06-06.",http://www.chesapeake-beach.md.us/
